r_word,line_1,line_1_id,line_2,line_2_id,r_sounds,r_degree,r_scheme,authors_id,poem_id
guide | preside,"Here comes the neighbouring Justice, pleased to guide",pcr18-l07100," His little club, and in the chair preside. ",pcr18-l07105,/aɪd/ | /aɪd/,full,<b>a</b><b>a</b>,pers00275,pcr18-w0030
preside | guide," His little club, and in the chair preside. ",pcr18-l07105,"Here comes the neighbouring Justice, pleased to guide",pcr18-l07100,/aɪd/ | /aɪd/,full,<b>a</b><b>a</b>,pers00275,pcr18-w0030
prevail | scale,"In private business his commands prevail,",pcr18-l07110, On public themes his reasoning turns the scale;,pcr18-l07115,/eɪl/ | /eɪl/,full,<b>a</b><b>a</b>,pers00275,pcr18-w0030
scale | prevail, On public themes his reasoning turns the scale;,pcr18-l07115,"In private business his commands prevail,",pcr18-l07110,/eɪl/ | /eɪl/,full,<b>a</b><b>a</b>,pers00275,pcr18-w0030
ear | here," Assenting silence soothes his happy ear,",pcr18-l07120," And, in or out, his party triumphs here. ",pcr18-l07125,/ɪə/ | /ɪə/,full,<b>a</b><b>a</b>,pers00275,pcr18-w0030
here | ear," And, in or out, his party triumphs here. ",pcr18-l07125," Assenting silence soothes his happy ear,",pcr18-l07120,/ɪə/ | /ɪə/,full,<b>a</b><b>a</b>,pers00275,pcr18-w0030
stops | shops,"Nor here th' infectious rage for party stops,",pcr18-l07130, But flits along from palaces to shops;,pcr18-l07135,/ɒps/ | /ɒps/,full,<b>a</b><b>a</b>,pers00275,pcr18-w0030
shops | stops, But flits along from palaces to shops;,pcr18-l07135,"Nor here th' infectious rage for party stops,",pcr18-l07130,/ɒps/ | /ɒps/,full,<b>a</b><b>a</b>,pers00275,pcr18-w0030
abound | round," Our weekly journals o'er the land abound,",pcr18-l07140, And spread their plague and influenzas round;,pcr18-l07145,/aʊnd/ | /aʊnd/,full,<b>a</b><b>a</b>,pers00275,pcr18-w0030
round | abound, And spread their plague and influenzas round;,pcr18-l07145," Our weekly journals o'er the land abound,",pcr18-l07140,/aʊnd/ | /aʊnd/,full,<b>a</b><b>a</b>,pers00275,pcr18-w0030
plain | swain," The village, too, the peaceful, pleasant plain,",pcr18-l07150, Breeds the Whig farmer and the Tory swain;,pcr18-l07155,/eɪn/ | /eɪn/,full,<b>a</b><b>a</b>,pers00275,pcr18-w0030
swain | plain, Breeds the Whig farmer and the Tory swain;,pcr18-l07155," The village, too, the peaceful, pleasant plain,",pcr18-l07150,/eɪn/ | /eɪn/,full,<b>a</b><b>a</b>,pers00275,pcr18-w0030
instead | head," Brookes 'and St. Alban's boasts not, but, instead,",pcr18-l07160," Stares the Red Ram, and swings the Rodney's Head: —",pcr18-l07165,/ed/ | /ed/,full,<b>a</b><b>a</b>,pers00275,pcr18-w0030
head | instead," Stares the Red Ram, and swings the Rodney's Head: —",pcr18-l07165," Brookes 'and St. Alban's boasts not, but, instead,",pcr18-l07160,/ed/ | /ed/,full,<b>a</b><b>a</b>,pers00275,pcr18-w0030
he | free," Hither, with all a patriot's care, comes he",pcr18-l07170, Who owns the little hut that makes him free;,pcr18-l07175,/iː/ | /iː/,full,<b>a</b><b>a</b>,pers00275,pcr18-w0030
free | he, Who owns the little hut that makes him free;,pcr18-l07175," Hither, with all a patriot's care, comes he",pcr18-l07170,/iː/ | /iː/,full,<b>a</b><b>a</b>,pers00275,pcr18-w0030
smile | while, Whose yearly forty shillings buy the smile,pcr18-l07180," Of mightier men, and never waste the while;",pcr18-l07185,/aɪl/ | /aɪl/,full,<b>a</b><b>a</b>,pers00275,pcr18-w0030
while | smile," Of mightier men, and never waste the while;",pcr18-l07185, Whose yearly forty shillings buy the smile,pcr18-l07180,/aɪl/ | /aɪl/,full,<b>a</b><b>a</b>,pers00275,pcr18-w0030
elate | state," Who feels his freehold's worth, and looks elate,",pcr18-l07190, A little prop and pillar of the state. ,pcr18-l07195,/eɪt/ | /eɪt/,full,<b>a</b><b>a</b>,pers00275,pcr18-w0030
state | elate, A little prop and pillar of the state. ,pcr18-l07195," Who feels his freehold's worth, and looks elate,",pcr18-l07190,/eɪt/ | /eɪt/,full,<b>a</b><b>a</b>,pers00275,pcr18-w0030
con | on,"Here he delights the weekly news to con,",pcr18-l07200, And mingle comments as he blunders on;,pcr18-l07205,/ɒn/ | /ɒn/,full,<b>a</b><b>a</b>,pers00275,pcr18-w0030
on | con, And mingle comments as he blunders on;,pcr18-l07205,"Here he delights the weekly news to con,",pcr18-l07200,/ɒn/ | /ɒn/,full,<b>a</b><b>a</b>,pers00275,pcr18-w0030
teach | speech," To swallow all their varying authors teach,",pcr18-l07210," To spell a title, and confound a speech:",pcr18-l07215,/iːtʃ/ | /iːtʃ/,full,<b>a</b><b>a</b>,pers00275,pcr18-w0030
speech | teach," To spell a title, and confound a speech:",pcr18-l07215," To swallow all their varying authors teach,",pcr18-l07210,/iːtʃ/ | /iːtʃ/,full,<b>a</b><b>a</b>,pers00275,pcr18-w0030
news | abuse," Till with a muddled mind he quits the news,",pcr18-l07220, And claims his nation's license to abuse;,pcr18-l07225,/uːz/ | /uːz/,full,<b>a</b><b>a</b>,pers00275,pcr18-w0030
abuse | news, And claims his nation's license to abuse;,pcr18-l07225," Till with a muddled mind he quits the news,",pcr18-l07220,/uːz/ | /uːz/,full,<b>a</b><b>a</b>,pers00275,pcr18-w0030
race | place," Then joins the cry, ""That all the courtly race",pcr18-l07230,""" Are venal candidates for power and place; """,pcr18-l07235,/eɪs/ | /eɪs/,full,<b>a</b><b>a</b>,pers00275,pcr18-w0030
place | race,""" Are venal candidates for power and place; """,pcr18-l07235," Then joins the cry, ""That all the courtly race",pcr18-l07230,/eɪs/ | /eɪs/,full,<b>a</b><b>a</b>,pers00275,pcr18-w0030
vice | price,"Yet feels some joy, amid the general vice,",pcr18-l07240, That his own vote will bring its wonted price. ,pcr18-l07245,/aɪsi/ | /aɪs/,half-vowelrhyme,<b>a</b><b>a</b>,pers00275,pcr18-w0030
price | vice, That his own vote will bring its wonted price. ,pcr18-l07245,"Yet feels some joy, amid the general vice,",pcr18-l07240,/aɪs/ | /aɪsi/,half-vowelrhyme,<b>a</b><b>a</b>,pers00275,pcr18-w0030
supplies | rise,"These are the ills the teeming Press supplies,",pcr18-l07250, The pois'nous springs from learning's fountain rise:,pcr18-l07255,/aɪz/ | /aɪz/,full,<b>a</b><b>a</b>,pers00275,pcr18-w0030
rise | supplies, The pois'nous springs from learning's fountain rise:,pcr18-l07255,"These are the ills the teeming Press supplies,",pcr18-l07250,/aɪz/ | /aɪz/,full,<b>a</b><b>a</b>,pers00275,pcr18-w0030
find | blind," Not there the wise alone their entrance find,",pcr18-l07260, Imparting useful light to mortals blind;,pcr18-l07265,/aɪnd/ | /aɪnd/,full,<b>a</b><b>a</b>,pers00275,pcr18-w0030
blind | find, Imparting useful light to mortals blind;,pcr18-l07265," Not there the wise alone their entrance find,",pcr18-l07260,/aɪnd/ | /aɪnd/,full,<b>a</b><b>a</b>,pers00275,pcr18-w0030
out | about," But, blind themselves, these erring guides hold out",pcr18-l07270, Alluring lights to lead us far about;,pcr18-l07275,/aʊt/ | /aʊt/,full,<b>a</b><b>a</b>,pers00275,pcr18-w0030
about | out, Alluring lights to lead us far about;,pcr18-l07275," But, blind themselves, these erring guides hold out",pcr18-l07270,/aʊt/ | /aʊt/,full,<b>a</b><b>a</b>,pers00275,pcr18-w0030
quill | will," Screen'd by such means, here Scandal whets her quill,",pcr18-l07280," Here Slander shoots unseen, whene'er she will;",pcr18-l07285,/ɪl/ | /ɪl/,full,<b>a</b><b>a</b>,pers00275,pcr18-w0030
will | quill," Here Slander shoots unseen, whene'er she will;",pcr18-l07285," Screen'd by such means, here Scandal whets her quill,",pcr18-l07280,/ɪl/ | /ɪl/,full,<b>a</b><b>a</b>,pers00275,pcr18-w0030
deceive | believe," Here Fraud and Falsehood labour to deceive,",pcr18-l07290," And Folly aids them both, impatient to believe. ",pcr18-l07295,/iːv/ | /iːv/,full,<b>a</b><b>a</b>,pers00275,pcr18-w0030
believe | deceive," And Folly aids them both, impatient to believe. ",pcr18-l07295," Here Fraud and Falsehood labour to deceive,",pcr18-l07290,/iːv/ | /iːv/,full,<b>a</b><b>a</b>,pers00275,pcr18-w0030
trust | just,"Such, sons of Britain! are the guides ye trust;",pcr18-l07300," So wise their counsel, their reports so just! —",pcr18-l07305,/ʌst/ | /ʌst/,full,<b>a</b><b>a</b>,pers00275,pcr18-w0030
just | trust," So wise their counsel, their reports so just! —",pcr18-l07305,"Such, sons of Britain! are the guides ye trust;",pcr18-l07300,/ʌst/ | /ʌst/,full,<b>a</b><b>a</b>,pers00275,pcr18-w0030
pure | sure," Yet, though we cannot call their morals pure,",pcr18-l07310," Their judgment nice, or their decisions sure;",pcr18-l07315,/ʊə/ | /ɔː/,half-pararhyme,<b>a</b><b>a</b>,pers00275,pcr18-w0030
sure | pure," Their judgment nice, or their decisions sure;",pcr18-l07315," Yet, though we cannot call their morals pure,",pcr18-l07310,/ɔː/ | /ʊə/,half-pararhyme,<b>a</b><b>a</b>,pers00275,pcr18-w0030
unknown | own," Merit they have to mightier works unknown,",pcr18-l07320," A style, a manner, and a fate their own. ",pcr18-l07325,/əʊn/ | /əʊn/,full,<b>a</b><b>a</b>,pers00275,pcr18-w0030
own | unknown," A style, a manner, and a fate their own. ",pcr18-l07325," Merit they have to mightier works unknown,",pcr18-l07320,/əʊn/ | /əʊn/,full,<b>a</b><b>a</b>,pers00275,pcr18-w0030
strive | alive,"We, who for longer fame with labour strive,",pcr18-l07330, Are pain'd to keep our sickly works alive;,pcr18-l07335,/aɪv/ | /aɪv/,full,<b>a</b><b>a</b>,pers00275,pcr18-w0030
alive | strive, Are pain'd to keep our sickly works alive;,pcr18-l07335,"We, who for longer fame with labour strive,",pcr18-l07330,/aɪv/ | /aɪv/,full,<b>a</b><b>a</b>,pers00275,pcr18-w0030
refine | line," Studious we toil, with patient care refine,",pcr18-l07340, Nor let our love protect one languid line. ,pcr18-l07345,/aɪn/ | /aɪn/,full,<b>a</b><b>a</b>,pers00275,pcr18-w0030
line | refine, Nor let our love protect one languid line. ,pcr18-l07345," Studious we toil, with patient care refine,",pcr18-l07340,/aɪn/ | /aɪn/,full,<b>a</b><b>a</b>,pers00275,pcr18-w0030
appear | severe,"Severe ourselves, at last our works appear,",pcr18-l07350," When, ah! we find our readers more severe;",pcr18-l07355,/ɪə/ | /ɪə/,full,<b>a</b><b>a</b>,pers00275,pcr18-w0030
severe | appear," When, ah! we find our readers more severe;",pcr18-l07355,"Severe ourselves, at last our works appear,",pcr18-l07350,/ɪə/ | /ɪə/,full,<b>a</b><b>a</b>,pers00275,pcr18-w0030
few | do," For, after all our care and pains, how few",pcr18-l07360," Acquire applause, or keep it if they do! —",pcr18-l07365,/uː/ | /uː/,full,<b>a</b><b>a</b>,pers00275,pcr18-w0030
do | few," Acquire applause, or keep it if they do! —",pcr18-l07365," For, after all our care and pains, how few",pcr18-l07360,/uː/ | /uː/,full,<b>a</b><b>a</b>,pers00275,pcr18-w0030
fate | date," Not so these sheets, ordain'd to happier fate,",pcr18-l07370," Praised through their day, and but that day their date;",pcr18-l07375,/eɪt/ | /eɪt/,full,<b>a</b><b>a</b>,pers00275,pcr18-w0030
date | fate," Praised through their day, and but that day their date;",pcr18-l07375," Not so these sheets, ordain'd to happier fate,",pcr18-l07370,/eɪt/ | /eɪt/,full,<b>a</b><b>a</b>,pers00275,pcr18-w0030
join | line, Their careless authors only strive to join,pcr18-l07380, As many words as make an even line;,pcr18-l07385,/ɔɪn/ | /aɪn/,half-pararhyme,<b>a</b><b>a</b>,pers00275,pcr18-w0030
line | join, As many words as make an even line;,pcr18-l07385, Their careless authors only strive to join,pcr18-l07380,/aɪn/ | /ɔɪn/,half-pararhyme,<b>a</b><b>a</b>,pers00275,pcr18-w0030
complete | sheet, As many lines as fill a row complete;,pcr18-l07390, As many rows as furnish up a sheet:,pcr18-l07395,/iːt/ | /iːt/,full,<b>a</b><b>a</b>,pers00275,pcr18-w0030
sheet | complete, As many rows as furnish up a sheet:,pcr18-l07395, As many lines as fill a row complete;,pcr18-l07390,/iːt/ | /iːt/,full,<b>a</b><b>a</b>,pers00275,pcr18-w0030
run | done," From side to side, with ready types they run",pcr18-l07400," The measure's ended, and the work is done;",pcr18-l07405,/ʌn/ | /ʌn/,full,<b>a</b><b>a</b>,pers00275,pcr18-w0030
done | run," The measure's ended, and the work is done;",pcr18-l07405," From side to side, with ready types they run",pcr18-l07400,/ʌn/ | /ʌn/,full,<b>a</b><b>a</b>,pers00275,pcr18-w0030
blessed | rest," Oh, born with ease, how envied and how blest! ",pcr18-l07410,Your fate to-day and your to-morrow's rest. ,pcr18-l07415,/est/ | /est/,full,<b>a</b><b>a</b>,pers00275,pcr18-w0030
rest | blessed,Your fate to-day and your to-morrow's rest. ,pcr18-l07415," Oh, born with ease, how envied and how blest! ",pcr18-l07410,/est/ | /est/,full,<b>a</b><b>a</b>,pers00275,pcr18-w0030
look | book,"To you all readers turn, and they can look",pcr18-l07420," Pleased on a paper, who abhor a book;",pcr18-l07425,/ʊk/ | /ʊk/,full,<b>a</b><b>a</b>,pers00275,pcr18-w0030
book | look," Pleased on a paper, who abhor a book;",pcr18-l07425,"To you all readers turn, and they can look",pcr18-l07420,/ʊk/ | /ʊk/,full,<b>a</b><b>a</b>,pers00275,pcr18-w0030
peruse | news," Those who ne'er deign'd their Bible to peruse,",pcr18-l07430, Would think it hard to be denied their News;,pcr18-l07435,/uːz/ | /uːz/,full,<b>a</b><b>a</b>,pers00275,pcr18-w0030
news | peruse, Would think it hard to be denied their News;,pcr18-l07435," Those who ne'er deign'd their Bible to peruse,",pcr18-l07430,/uːz/ | /uːz/,full,<b>a</b><b>a</b>,pers00275,pcr18-w0030
weak | seek," Sinners and saints, the wisest with the weak,",pcr18-l07440," Here mingle tastes, and one amusement seek;",pcr18-l07445,/iːk/ | /iːk/,full,<b>a</b><b>a</b>,pers00275,pcr18-w0030
seek | weak," Here mingle tastes, and one amusement seek;",pcr18-l07445," Sinners and saints, the wisest with the weak,",pcr18-l07440,/iːk/ | /iːk/,full,<b>a</b><b>a</b>,pers00275,pcr18-w0030
treat | eat," This, like the public inn, provides a treat,",pcr18-l07450, Where each promiscuous guest sits down to eat;,pcr18-l07455,/iːt/ | /iːt/,full,<b>a</b><b>a</b>,pers00275,pcr18-w0030
eat | treat, Where each promiscuous guest sits down to eat;,pcr18-l07455," This, like the public inn, provides a treat,",pcr18-l07450,/iːt/ | /iːt/,full,<b>a</b><b>a</b>,pers00275,pcr18-w0030
call | all," And such this mental food, as we may call",pcr18-l07460," Something to all men, and to some men all. ",pcr18-l07465,/ɔːl/ | /ɔːl/,full,<b>a</b><b>a</b>,pers00275,pcr18-w0030
all | call," Something to all men, and to some men all. ",pcr18-l07465," And such this mental food, as we may call",pcr18-l07460,/ɔːl/ | /ɔːl/,full,<b>a</b><b>a</b>,pers00275,pcr18-w0030
trace | space,"Next, in what rare production shall we trace",pcr18-l07470, Such various subjects in so small a space? ,pcr18-l07475,/eɪs/ | /eɪs/,full,<b>a</b><b>a</b>,pers00275,pcr18-w0030
space | trace, Such various subjects in so small a space? ,pcr18-l07475,"Next, in what rare production shall we trace",pcr18-l07470,/eɪs/ | /eɪs/,full,<b>a</b><b>a</b>,pers00275,pcr18-w0030
bore | before,As the first ship upon the waters bore,pcr18-l07480, Incongruous kinds who never met before;,pcr18-l07485,/ɔː/ | /ɔː/,full,<b>a</b><b>a</b>,pers00275,pcr18-w0030
before | bore, Incongruous kinds who never met before;,pcr18-l07485,As the first ship upon the waters bore,pcr18-l07480,/ɔː/ | /ɔː/,full,<b>a</b><b>a</b>,pers00275,pcr18-w0030
joins | coins," Or as some curious virtuoso joins,",pcr18-l07490," In one small room, moths, minerals, and coins,",pcr18-l07495,/ɔɪnz/ | /ɔɪnz/,full,<b>a</b><b>a</b>,pers00275,pcr18-w0030
coins | joins," In one small room, moths, minerals, and coins,",pcr18-l07495," Or as some curious virtuoso joins,",pcr18-l07490,/ɔɪnz/ | /ɔɪnz/,full,<b>a</b><b>a</b>,pers00275,pcr18-w0030
place | race," Birds, beasts, and fishes; nor refuses place",pcr18-l07500," To serpents, toads, and all the reptile race",pcr18-l07505,/eɪs/ | /eɪs/,full,<b>a</b><b>a</b>,pers00275,pcr18-w0030
race | place," To serpents, toads, and all the reptile race",pcr18-l07505," Birds, beasts, and fishes; nor refuses place",pcr18-l07500,/eɪs/ | /eɪs/,full,<b>a</b><b>a</b>,pers00275,pcr18-w0030
sheet | meet," So here, compress'd within a single sheet,",pcr18-l07510," Great things and small, the mean and mighty meet,",pcr18-l07515,/iːt/ | /iːt/,full,<b>a</b><b>a</b>,pers00275,pcr18-w0030
meet | sheet," Great things and small, the mean and mighty meet,",pcr18-l07515," So here, compress'd within a single sheet,",pcr18-l07510,/iːt/ | /iːt/,full,<b>a</b><b>a</b>,pers00275,pcr18-w0030
known | own," 'Tis this which makes all Europe's business known,",pcr18-l07520, Yet here a private man may place his own;,pcr18-l07525,/əʊn/ | /əʊn/,full,<b>a</b><b>a</b>,pers00275,pcr18-w0030
own | known, Yet here a private man may place his own;,pcr18-l07525," 'Tis this which makes all Europe's business known,",pcr18-l07520,/əʊn/ | /əʊn/,full,<b>a</b><b>a</b>,pers00275,pcr18-w0030
he | rappee," And, where he reads of Lords and Commons, he",pcr18-l07530, May tell their honours that he sells rappee. ,pcr18-l07535,/iː/ | /iː/,full,<b>a</b><b>a</b>,pers00275,pcr18-w0030
rappee | he, May tell their honours that he sells rappee. ,pcr18-l07535," And, where he reads of Lords and Commons, he",pcr18-l07530,/iː/ | /iː/,full,<b>a</b><b>a</b>,pers00275,pcr18-w0030
page | age,Add next th' amusement which the motley page,pcr18-l07540, Affords to either sex and every age:,pcr18-l07545,/eɪdʒ/ | /eɪdʒ/,full,<b>a</b><b>a</b>,pers00275,pcr18-w0030
age | page, Affords to either sex and every age:,pcr18-l07545,Add next th' amusement which the motley page,pcr18-l07540,/eɪdʒ/ | /eɪdʒ/,full,<b>a</b><b>a</b>,pers00275,pcr18-w0030
fire | aspire," Lo! where it comes before the cheerful fire, —",pcr18-l07550, Damps from the press in smoky curls aspire,pcr18-l07555,/æə/ | /æə/,full,<b>a</b><b>a</b>,pers00275,pcr18-w0030
aspire | fire, Damps from the press in smoky curls aspire,pcr18-l07555," Lo! where it comes before the cheerful fire, —",pcr18-l07550,/æə/ | /æə/,full,<b>a</b><b>a</b>,pers00275,pcr18-w0030
dew | ensue," (As from the earth the sun exhales the dew),",pcr18-l07560, Ere we can read the wonders that ensue:,pcr18-l07565,/uː/ | /uː/,full,<b>a</b><b>a</b>,pers00275,pcr18-w0030
ensue | dew, Ere we can read the wonders that ensue:,pcr18-l07565," (As from the earth the sun exhales the dew),",pcr18-l07560,/uː/ | /uː/,full,<b>a</b><b>a</b>,pers00275,pcr18-w0030
part | heart," Then eager every eye surveys the part,",pcr18-l07570, That brings its favourite subject to the heart;,pcr18-l07575,/ɑːt/ | /ɑːt/,full,<b>a</b><b>a</b>,pers00275,pcr18-w0030
heart | part, That brings its favourite subject to the heart;,pcr18-l07575," Then eager every eye surveys the part,",pcr18-l07570,/ɑːt/ | /ɑːt/,full,<b>a</b><b>a</b>,pers00275,pcr18-w0030
alone | own," Grave politicians look for facts alone,",pcr18-l07580, And gravely add conjectures of their own:,pcr18-l07585,/əʊn/ | /əʊn/,full,<b>a</b><b>a</b>,pers00275,pcr18-w0030
own | alone, And gravely add conjectures of their own:,pcr18-l07585," Grave politicians look for facts alone,",pcr18-l07580,/əʊn/ | /əʊn/,full,<b>a</b><b>a</b>,pers00275,pcr18-w0030
rest | oppressed," The sprightly nymph, who never broke her rest. ",pcr18-l07590,"For tottering crowns, or mighty lands oppress'd,",pcr18-l07595,/est/ | /est/,full,<b>a</b><b>a</b>,pers00275,pcr18-w0030
oppressed | rest,"For tottering crowns, or mighty lands oppress'd,",pcr18-l07595," The sprightly nymph, who never broke her rest. ",pcr18-l07590,/est/ | /est/,full,<b>a</b><b>a</b>,pers00275,pcr18-w0030
all | ball," Finds broils and battles, but neglects them all",pcr18-l07600," For songs and suits, a birth-day, or a ball:",pcr18-l07605,/ɔːl/ | /ɔːl/,full,<b>a</b><b>a</b>,pers00275,pcr18-w0030
ball | all," For songs and suits, a birth-day, or a ball:",pcr18-l07605," Finds broils and battles, but neglects them all",pcr18-l07600,/ɔːl/ | /ɔːl/,full,<b>a</b><b>a</b>,pers00275,pcr18-w0030
tale | sale, The keen warm man o'erlooks each idle tale,pcr18-l07610," For ""Monies wanted,"" and ""Estates on Sale;""",pcr18-l07615,/eɪl/ | /eɪl/,full,<b>a</b><b>a</b>,pers00275,pcr18-w0030
sale | tale," For ""Monies wanted,"" and ""Estates on Sale;""",pcr18-l07615, The keen warm man o'erlooks each idle tale,pcr18-l07610,/eɪl/ | /eɪl/,full,<b>a</b><b>a</b>,pers00275,pcr18-w0030
attend | end," While some with equal minds to all attend,",pcr18-l07620," Pleased with each part, and grieved to find an end. ",pcr18-l07625,/end/ | /end/,full,<b>a</b><b>a</b>,pers00275,pcr18-w0030
end | attend," Pleased with each part, and grieved to find an end. ",pcr18-l07625," While some with equal minds to all attend,",pcr18-l07620,/end/ | /end/,full,<b>a</b><b>a</b>,pers00275,pcr18-w0030
town | down,"So charm the News; but we, who far from town",pcr18-l07630," Wait till the postman brings the packet down,",pcr18-l07635,/aʊn/ | /aʊn/,full,<b>a</b><b>a</b>,pers00275,pcr18-w0030
down | town," Wait till the postman brings the packet down,",pcr18-l07635,"So charm the News; but we, who far from town",pcr18-l07630,/aʊn/ | /aʊn/,full,<b>a</b><b>a</b>,pers00275,pcr18-w0030
behold | old," Once in the week, a vacant day behold,",pcr18-l07640," And stay for tidings, till they're three days old:",pcr18-l07645,/əʊld/ | /əʊld/,full,<b>a</b><b>a</b>,pers00275,pcr18-w0030
old | behold," And stay for tidings, till they're three days old:",pcr18-l07645," Once in the week, a vacant day behold,",pcr18-l07640,/əʊld/ | /əʊld/,full,<b>a</b><b>a</b>,pers00275,pcr18-w0030
appears | wears," That day arrives; no welcome post appears,",pcr18-l07650, But the dull morn a sullen aspect wears:,pcr18-l07655,/ɪəz/ | /eəz/,half-pararhyme,<b>a</b><b>a</b>,pers00275,pcr18-w0030
wears | appears, But the dull morn a sullen aspect wears:,pcr18-l07655," That day arrives; no welcome post appears,",pcr18-l07650,/eəz/ | /ɪəz/,half-pararhyme,<b>a</b><b>a</b>,pers00275,pcr18-w0030
smile | boil," We meet, but ah! without our wonted smile,",pcr18-l07660," To talk of headachs, and complain of bile;",pcr18-l07665,/aɪl/ | /aɪl/,full,<b>a</b><b>a</b>,pers00275,pcr18-w0030
boil | smile," To talk of headachs, and complain of bile;",pcr18-l07665," We meet, but ah! without our wonted smile,",pcr18-l07660,/aɪl/ | /aɪl/,full,<b>a</b><b>a</b>,pers00275,pcr18-w0030
repast | fast," Sullen we ponder o'er a dull repast,",pcr18-l07670, Nor feast the body while the mind must fast. ,pcr18-l07675,/ɑːst/ | /ɑːst/,full,<b>a</b><b>a</b>,pers00275,pcr18-w0030
fast | repast, Nor feast the body while the mind must fast. ,pcr18-l07675," Sullen we ponder o'er a dull repast,",pcr18-l07670,/ɑːst/ | /ɑːst/,full,<b>a</b><b>a</b>,pers00275,pcr18-w0030
news | muse,"A master-passion is the love of news,",pcr18-l07680," Not music so commands, nor so the Muse:",pcr18-l07685,/uːz/ | /uːz/,full,<b>a</b><b>a</b>,pers00275,pcr18-w0030
muse | news," Not music so commands, nor so the Muse:",pcr18-l07685,"A master-passion is the love of news,",pcr18-l07680,/uːz/ | /uːz/,full,<b>a</b><b>a</b>,pers00275,pcr18-w0030
soon | tune," Give poets claret, they grow idle soon;",pcr18-l07690," Feed the musician, and he's out of tune;",pcr18-l07695,/uːn/ | /uːn/,full,<b>a</b><b>a</b>,pers00275,pcr18-w0030
tune | soon," Feed the musician, and he's out of tune;",pcr18-l07695," Give poets claret, they grow idle soon;",pcr18-l07690,/uːn/ | /uːn/,full,<b>a</b><b>a</b>,pers00275,pcr18-w0030
possessed | rest," But the sick mind, of this disease possess'd,",pcr18-l07700," Flies from all cure, and sickens when at rest. ",pcr18-l07705,/est/ | /est/,full,<b>a</b><b>a</b>,pers00275,pcr18-w0030
rest | possessed," Flies from all cure, and sickens when at rest. ",pcr18-l07705," But the sick mind, of this disease possess'd,",pcr18-l07700,/est/ | /est/,full,<b>a</b><b>a</b>,pers00275,pcr18-w0030
compose | prose,"Now sing, my Muse, what various parts compose",pcr18-l07710, These rival sheets of politics and prose. ,pcr18-l07715,/əʊz/ | /əʊz/,full,<b>a</b><b>a</b>,pers00275,pcr18-w0030
prose | compose, These rival sheets of politics and prose. ,pcr18-l07715,"Now sing, my Muse, what various parts compose",pcr18-l07710,/əʊz/ | /əʊz/,full,<b>a</b><b>a</b>,pers00275,pcr18-w0030
draw | law,"First, from each brother's hoard a part they draw,",pcr18-l07720, A mutual theft that never fear'd a law;,pcr18-l07725,/ɔː/ | /ɔː/,full,<b>a</b><b>a</b>,pers00275,pcr18-w0030
law | draw, A mutual theft that never fear'd a law;,pcr18-l07725,"First, from each brother's hoard a part they draw,",pcr18-l07720,/ɔː/ | /ɔː/,full,<b>a</b><b>a</b>,pers00275,pcr18-w0030
fall | all," Whate'er they gain, to each man's portion fall,",pcr18-l07730," And read it once, you read it through them all:",pcr18-l07735,/ɔːl/ | /ɔːl/,full,<b>a</b><b>a</b>,pers00275,pcr18-w0030
all | fall," And read it once, you read it through them all:",pcr18-l07735," Whate'er they gain, to each man's portion fall,",pcr18-l07730,/ɔːl/ | /ɔːl/,full,<b>a</b><b>a</b>,pers00275,pcr18-w0030
night | light," For this their runners ramble day and night,",pcr18-l07740, To drag each lurking deed to open light;,pcr18-l07745,/aɪt/ | /aɪt/,full,<b>a</b><b>a</b>,pers00275,pcr18-w0030
light | night, To drag each lurking deed to open light;,pcr18-l07745," For this their runners ramble day and night,",pcr18-l07740,/aɪt/ | /aɪt/,full,<b>a</b><b>a</b>,pers00275,pcr18-w0030
ply | lie," For daily bread the dirty trade they ply,",pcr18-l07750," Coin their fresh tales, and live upon the lie:",pcr18-l07755,/aɪ/ | /aɪ/,full,<b>a</b><b>a</b>,pers00275,pcr18-w0030
lie | ply," Coin their fresh tales, and live upon the lie:",pcr18-l07755," For daily bread the dirty trade they ply,",pcr18-l07750,/aɪ/ | /aɪ/,full,<b>a</b><b>a</b>,pers00275,pcr18-w0030
spring | wing," Like bees for honey, forth for news they spring, —",pcr18-l07760, Industrious creatures! ever on the wing;,pcr18-l07765,/ɪŋ/ | /ɪŋ/,full,<b>a</b><b>a</b>,pers00275,pcr18-w0030
