r_word,line_1,line_1_id,line_2,line_2_id,r_sounds,r_degree,r_scheme,authors_id,poem_id
tell | dwell, Let other poets tell;,o4986-l23335, Superior beauties dwell. ,o4986-l23345,/el/ | /el/,full,x<b>a</b>x<b>a</b>,pers00247,o4986-w0520
dwell | tell, Superior beauties dwell. ,o4986-l23345, Let other poets tell;,o4986-l23335,/el/ | /el/,full,x<b>a</b>x<b>a</b>,pers00247,o4986-w0520
play | ray, In blithe assemblage play;,o4986-l23355, Its intellectual ray. ,o4986-l23365,/eɪ/ | /eɪ/,full,x<b>a</b>x<b>a</b>,pers00247,o4986-w0520
ray | play, Its intellectual ray. ,o4986-l23365, In blithe assemblage play;,o4986-l23355,/eɪ/ | /eɪ/,full,x<b>a</b>x<b>a</b>,pers00247,o4986-w0520
refines | shines," Heaven's wide expanse refines,",o4986-l23375, Celestial Sweetness shines. ,o4986-l23385,/aɪnz/ | /aɪnz/,full,x<b>a</b>x<b>a</b>,pers00247,o4986-w0520
shines | refines, Celestial Sweetness shines. ,o4986-l23385," Heaven's wide expanse refines,",o4986-l23375,/aɪnz/ | /aɪnz/,full,x<b>a</b>x<b>a</b>,pers00247,o4986-w0520
face | grace, And sparkles in the face;,o4986-l23395, And heightens every grace. ,o4986-l23405,/eɪs/ | /eɪs/,full,x<b>a</b>x<b>a</b>,pers00247,o4986-w0520
grace | face, And heightens every grace. ,o4986-l23405, And sparkles in the face;,o4986-l23395,/eɪs/ | /eɪs/,full,x<b>a</b>x<b>a</b>,pers00247,o4986-w0520
restrain | pain, The heaving sigh restrain;,o4986-l23415, And stop the sense of pain. ,o4986-l23425,/eɪn/ | /eɪn/,full,x<b>a</b>x<b>a</b>,pers00247,o4986-w0520
pain | restrain, And stop the sense of pain. ,o4986-l23425, The heaving sigh restrain;,o4986-l23415,/eɪn/ | /eɪn/,full,x<b>a</b>x<b>a</b>,pers00247,o4986-w0520
move | love, The tyrant's pity move;,o4986-l23435, And melt the soul to love. ,o4986-l23445,/uːv/ | /ʌv/,half-pararhyme,x<b>a</b>x<b>a</b>,pers00247,o4986-w0520
love | move, And melt the soul to love. ,o4986-l23445, The tyrant's pity move;,o4986-l23435,/ʌv/ | /uːv/,half-pararhyme,x<b>a</b>x<b>a</b>,pers00247,o4986-w0520
benign | shine," In majesty benign,",o4986-l23455, With milder lustre shine. ,o4986-l23465,/aɪn/ | /aɪn/,full,x<b>a</b>x<b>a</b>,pers00247,o4986-w0520
shine | benign, With milder lustre shine. ,o4986-l23465," In majesty benign,",o4986-l23455,/aɪn/ | /aɪn/,full,x<b>a</b>x<b>a</b>,pers00247,o4986-w0520
dwells | dispels," Where melancholy dwells,",o4986-l23475, The dreary gloom dispels. ,o4986-l23485,/elz/ | /elz/,full,x<b>a</b>x<b>a</b>,pers00247,o4986-w0520
dispels | dwells, The dreary gloom dispels. ,o4986-l23485," Where melancholy dwells,",o4986-l23475,/elz/ | /elz/,full,x<b>a</b>x<b>a</b>,pers00247,o4986-w0520
plains | reigns," To chear the mournful plains,",o4986-l23495, Etherial mildness reigns. ,o4986-l23505,/eɪnz/ | /eɪnz/,full,x<b>a</b>x<b>a</b>,pers00247,o4986-w0520
reigns | plains, Etherial mildness reigns. ,o4986-l23505," To chear the mournful plains,",o4986-l23495,/eɪnz/ | /eɪnz/,full,x<b>a</b>x<b>a</b>,pers00247,o4986-w0520
rise | flies, No boisterous passions rise;,o4986-l23515, And baleful Discord flies. ,o4986-l23525,/aɪz/ | /aɪz/,full,x<b>a</b>x<b>a</b>,pers00247,o4986-w0520
flies | rise, And baleful Discord flies. ,o4986-l23525, No boisterous passions rise;,o4986-l23515,/aɪz/ | /aɪz/,full,x<b>a</b>x<b>a</b>,pers00247,o4986-w0520
glow | flow, A thousand virtues glow;,o4986-l23535, And endless blessings flow. ,o4986-l23545,/əʊ/ | /əʊ/,full,x<b>a</b>x<b>a</b>,pers00247,o4986-w0520
flow | glow, And endless blessings flow. ,o4986-l23545, A thousand virtues glow;,o4986-l23535,/əʊ/ | /əʊ/,full,x<b>a</b>x<b>a</b>,pers00247,o4986-w0520
charms | warms, Her sympathizing charms;,o4986-l23555, The generous bosom warms. ,o4986-l23565,/ɑːmz/ | /ɔːmz/,half-pararhyme,x<b>a</b>x<b>a</b>,pers00247,o4986-w0520
warms | charms, The generous bosom warms. ,o4986-l23565, Her sympathizing charms;,o4986-l23555,/ɔːmz/ | /ɑːmz/,half-pararhyme,x<b>a</b>x<b>a</b>,pers00247,o4986-w0520
art | heart," And spreads, with secret art,",o4986-l23575, A transport through the heart. ,o4986-l23585,/ɑːt/ | /ɑːt/,full,x<b>a</b>x<b>a</b>,pers00247,o4986-w0520
heart | art, A transport through the heart. ,o4986-l23585," And spreads, with secret art,",o4986-l23575,/ɑːt/ | /ɑːt/,full,x<b>a</b>x<b>a</b>,pers00247,o4986-w0520
joy | destroy, Each gleam of sensual joy;,o4986-l23595, These blest effects destroy. ,o4986-l23605,/ɔɪ/ | /ɔɪ/,full,x<b>a</b>x<b>a</b>,pers00247,o4986-w0520
destroy | joy, These blest effects destroy. ,o4986-l23605, Each gleam of sensual joy;,o4986-l23595,/ɔɪ/ | /ɔɪ/,full,x<b>a</b>x<b>a</b>,pers00247,o4986-w0520
fly | defy, And all those graces fly;,o4986-l23615, Shall length of days defy. ,o4986-l23625,/aɪ/ | /aɪ/,full,x<b>a</b>x<b>a</b>,pers00247,o4986-w0520
defy | fly, Shall length of days defy. ,o4986-l23625, And all those graces fly;,o4986-l23615,/aɪ/ | /aɪ/,full,x<b>a</b>x<b>a</b>,pers00247,o4986-w0520
right | delight," Thy dispensations right,",o4986-l23765, Compassion thy delight. ,o4986-l23775,/aɪt/ | /aɪt/,full,x<b>a</b>x<b>a</b>,pers00247,o4986-w0540
delight | right, Compassion thy delight. ,o4986-l23775," Thy dispensations right,",o4986-l23765,/aɪt/ | /aɪt/,full,x<b>a</b>x<b>a</b>,pers00247,o4986-w0540
distress | suppress," To pity my distress,",o4986-l23785, Of lenity suppress. ,o4986-l23795,/es/ | /es/,full,x<b>a</b>x<b>a</b>,pers00247,o4986-w0540
suppress | distress, Of lenity suppress. ,o4986-l23795," To pity my distress,",o4986-l23785,/es/ | /es/,full,x<b>a</b>x<b>a</b>,pers00247,o4986-w0540
room | doom, For pardon leave no room;,o4986-l23805, Thy grace demands my doom. ,o4986-l23815,/uːm/ | /uːm/,full,x<b>a</b>x<b>a</b>,pers00247,o4986-w0540
doom | room, Thy grace demands my doom. ,o4986-l23815, For pardon leave no room;,o4986-l23805,/uːm/ | /uːm/,full,x<b>a</b>x<b>a</b>,pers00247,o4986-w0540
name | inflame, Avenge thy injur'd name;,o4986-l23825, Thy sacred wrath inflame. ,o4986-l23835,/eɪm/ | /eɪm/,full,x<b>a</b>x<b>a</b>,pers00247,o4986-w0540
inflame | name, Thy sacred wrath inflame. ,o4986-l23835, Avenge thy injur'd name;,o4986-l23825,/eɪm/ | /eɪm/,full,x<b>a</b>x<b>a</b>,pers00247,o4986-w0540
head | dead, On my rebellious head;,o4986-l23845, The hand that strikes me dead. ,o4986-l23855,/ed/ | /ed/,full,x<b>a</b>x<b>a</b>,pers00247,o4986-w0540
dead | head, The hand that strikes me dead. ,o4986-l23855, On my rebellious head;,o4986-l23845,/ed/ | /ed/,full,x<b>a</b>x<b>a</b>,pers00247,o4986-w0540
run | son," Thy missive vengeance run,",o4986-l23865, Of thy beloved Son? ,o4986-l23875,/ʌn/ | /ʌn/,full,x<b>a</b>x<b>a</b>,pers00247,o4986-w0540
son | run, Of thy beloved Son? ,o4986-l23875," Thy missive vengeance run,",o4986-l23865,/ʌn/ | /ʌn/,full,x<b>a</b>x<b>a</b>,pers00247,o4986-w0540
hide | sighed, Those lovely seatures hide;,o4986-l23635, A thousand swains have sigh'd. ,o4986-l23645,/aɪd/ | /aɪd/,full,x<b>a</b>x<b>a</b>,pers00247,o4986-w0530
sighed | hide, A thousand swains have sigh'd. ,o4986-l23645, Those lovely seatures hide;,o4986-l23635,/aɪd/ | /aɪd/,full,x<b>a</b>x<b>a</b>,pers00247,o4986-w0530
maid | shade," The gay, the blooming maid;",o4986-l23655, Beneath that flowery shade. ,o4986-l23665,/eɪd/ | /eɪd/,full,x<b>a</b>x<b>a</b>,pers00247,o4986-w0530
shade | maid, Beneath that flowery shade. ,o4986-l23665," The gay, the blooming maid;",o4986-l23655,/eɪd/ | /eɪd/,full,x<b>a</b>x<b>a</b>,pers00247,o4986-w0530
displays | rays," His vivid warmth displays,",o4986-l23675, That shades the dazzling rays. ,o4986-l23685,/eɪz/ | /eɪz/,full,x<b>a</b>x<b>a</b>,pers00247,o4986-w0530
rays | displays, That shades the dazzling rays. ,o4986-l23685," His vivid warmth displays,",o4986-l23675,/eɪz/ | /eɪz/,full,x<b>a</b>x<b>a</b>,pers00247,o4986-w0530
