r_word,line_1,line_1_id,line_2,line_2_id,r_sounds,r_degree,r_scheme,authors_id,poem_id
around | wound," Or some swoln serpent twist his scales around,",o5089-l01245, And wake to anguish with a burning wound. ,o5089-l01250,/aʊnd/ | /uːnd/,half-pararhyme,<b>a</b><b>a</b>,pers00048,o5089-w0020
wound | around, And wake to anguish with a burning wound. ,o5089-l01250," Or some swoln serpent twist his scales around,",o5089-l01245,/uːnd/ | /aʊnd/,half-pararhyme,<b>a</b><b>a</b>,pers00048,o5089-w0020
poor | secure,"Thrice happy they, the wise contented poor,",o5089-l01255," From lust of wealth, and dread of death secure! ",o5089-l01260,/ɔː/ | /ʊə/,half-pararhyme,<b>a</b><b>a</b>,pers00048,o5089-w0020
secure | poor," From lust of wealth, and dread of death secure! ",o5089-l01260,"Thrice happy they, the wise contented poor,",o5089-l01255,/ʊə/ | /ɔː/,half-pararhyme,<b>a</b><b>a</b>,pers00048,o5089-w0020
find | mind,"They tempt no deserts, and no griefs they find;",o5089-l01265," Peace rules the day, where reason rules the mind. ",o5089-l01270,/aɪnd/ | /aɪnd/,full,<b>a</b><b>a</b>,pers00048,o5089-w0020
mind | find," Peace rules the day, where reason rules the mind. ",o5089-l01270,"They tempt no deserts, and no griefs they find;",o5089-l01265,/aɪnd/ | /aɪnd/,full,<b>a</b><b>a</b>,pers00048,o5089-w0020
day | way," ""Sad was the hour, and luckless was the day,",o5089-l01275,"""When first from Schiraz' walls I bent my way! """,o5089-l01280,/eɪ/ | /eɪ/,full,<b>a</b><b>a</b>,pers00048,o5089-w0020
way | day,"""When first from Schiraz' walls I bent my way! """,o5089-l01280," ""Sad was the hour, and luckless was the day,",o5089-l01275,/eɪ/ | /eɪ/,full,<b>a</b><b>a</b>,pers00048,o5089-w0020
won | undone,"O hapless youth! for she thy love hath won,",o5089-l01285, The tender Zara will be most undone! ,o5089-l01290,/ʌn/ | /ʌn/,full,<b>a</b><b>a</b>,pers00048,o5089-w0020
undone | won, The tender Zara will be most undone! ,o5089-l01290,"O hapless youth! for she thy love hath won,",o5089-l01285,/ʌn/ | /ʌn/,full,<b>a</b><b>a</b>,pers00048,o5089-w0020
maid | said,"Big swell'd my heart, and own'd the powerful maid,",o5089-l01295," When fast she dropt her tears, as thus she said:",o5089-l01300,/eɪd/ | /ed/,half-pararhyme,<b>a</b><b>a</b>,pers00048,o5089-w0020
said | maid," When fast she dropt her tears, as thus she said:",o5089-l01300,"Big swell'd my heart, and own'd the powerful maid,",o5089-l01295,/ed/ | /eɪd/,half-pararhyme,<b>a</b><b>a</b>,pers00048,o5089-w0020
detain | vain," ""Farewell the youth whom sighs could not detain,",o5089-l01305,"""Whom Zara's breaking heart implor'd in vain! ",o5089-l01310,/eɪn/ | /eɪn/,full,<b>a</b><b>a</b>,pers00048,o5089-w0020
vain | detain,"""Whom Zara's breaking heart implor'd in vain! ",o5089-l01310," ""Farewell the youth whom sighs could not detain,",o5089-l01305,/eɪn/ | /eɪn/,full,<b>a</b><b>a</b>,pers00048,o5089-w0020
arise | sighs," ""Yet as thou go'st, may every blast arise",o5089-l01315,"""Weak and unfelt as these rejected sighs! ",o5089-l01320,/aɪz/ | /aɪz/,full,<b>a</b><b>a</b>,pers00048,o5089-w0020
sighs | arise,"""Weak and unfelt as these rejected sighs! ",o5089-l01320," ""Yet as thou go'st, may every blast arise",o5089-l01315,/aɪz/ | /aɪz/,full,<b>a</b><b>a</b>,pers00048,o5089-w0020
see | me," ""Safe o'er the wild, no perils may'st thou see,",o5089-l01325,"""No griefs endure, nor weep, false youth, like me. """,o5089-l01330,/iː/ | /iː/,full,<b>a</b><b>a</b>,pers00048,o5089-w0020
me | see,"""No griefs endure, nor weep, false youth, like me. """,o5089-l01330," ""Safe o'er the wild, no perils may'st thou see,",o5089-l01325,/iː/ | /iː/,full,<b>a</b><b>a</b>,pers00048,o5089-w0020
return | mourn,"O let me safely to the fair return,",o5089-l01335," Say with a kiss, she must not, shall not mourn;",o5089-l01340,/ɜːn/ | /ɔːn/,half-pararhyme,<b>a</b><b>a</b>,pers00048,o5089-w0020
mourn | return," Say with a kiss, she must not, shall not mourn;",o5089-l01340,"O let me safely to the fair return,",o5089-l01335,/ɔːn/ | /ɜːn/,half-pararhyme,<b>a</b><b>a</b>,pers00048,o5089-w0020
fears | tears," O! let me teach my heart to lose its fears,",o5089-l01345," Recall'd by Wisdom's voice, and Zara's tears. ",o5089-l01350,/ɪəz/ | /ɪəz/,full,<b>a</b><b>a</b>,pers00048,o5089-w0020
tears | fears," Recall'd by Wisdom's voice, and Zara's tears. ",o5089-l01350," O! let me teach my heart to lose its fears,",o5089-l01345,/ɪəz/ | /ɪəz/,full,<b>a</b><b>a</b>,pers00048,o5089-w0020
day | way,"He said, and call'd on heaven to bless the day,",o5089-l01355, When back to Schiraz' walls he bent his way. ,o5089-l01360,/eɪ/ | /eɪ/,full,<b>a</b><b>a</b>,pers00048,o5089-w0020
way | day, When back to Schiraz' walls he bent his way. ,o5089-l01360,"He said, and call'd on heaven to bless the day,",o5089-l01355,/eɪ/ | /eɪ/,full,<b>a</b><b>a</b>,pers00048,o5089-w0020
seen | green,"IN Georgia's land, where Tefflis' towers are seen,",o5089-l01365," In distant view along the level green,",o5089-l01370,/iːn/ | /iːn/,full,<b>a</b><b>a</b>,pers00048,o5089-w0020
green | seen," In distant view along the level green,",o5089-l01370,"IN Georgia's land, where Tefflis' towers are seen,",o5089-l01365,/iːn/ | /iːn/,full,<b>a</b><b>a</b>,pers00048,o5089-w0020
glade | shade," While evening dews enrich the glittering glade,",o5089-l01375," And the tall forests cast a longer shade,",o5089-l01380,/eɪd/ | /eɪd/,full,<b>a</b><b>a</b>,pers00048,o5089-w0020
shade | glade," And the tall forests cast a longer shade,",o5089-l01380," While evening dews enrich the glittering glade,",o5089-l01375,/eɪd/ | /eɪd/,full,<b>a</b><b>a</b>,pers00048,o5089-w0020
stray | day," What time 'tis sweet o'er fields of rice to stray,",o5089-l01385, Or scent the breathing maize at setting day;,o5089-l01390,/eɪ/ | /eɪ/,full,<b>a</b><b>a</b>,pers00048,o5089-w0020
day | stray, Or scent the breathing maize at setting day;,o5089-l01390," What time 'tis sweet o'er fields of rice to stray,",o5089-l01385,/eɪ/ | /eɪ/,full,<b>a</b><b>a</b>,pers00048,o5089-w0020
grove | love," Amidst the maids of Zagen's peaceful grove,",o5089-l01395, Emyra sung the pleasing cares of love. ,o5089-l01400,/əʊv/ | /ʌv/,half-pararhyme,<b>a</b><b>a</b>,pers00048,o5089-w0020
love | grove, Emyra sung the pleasing cares of love. ,o5089-l01400," Amidst the maids of Zagen's peaceful grove,",o5089-l01395,/ʌv/ | /əʊv/,half-pararhyme,<b>a</b><b>a</b>,pers00048,o5089-w0020
strain | plain,"Of Abra first began the tender strain,",o5089-l01405, Who led her youth with flocks upon the plain:,o5089-l01410,/eɪn/ | /eɪn/,full,<b>a</b><b>a</b>,pers00048,o5089-w0020
plain | strain, Who led her youth with flocks upon the plain:,o5089-l01410,"Of Abra first began the tender strain,",o5089-l01405,/eɪn/ | /eɪn/,full,<b>a</b><b>a</b>,pers00048,o5089-w0020
lead | mead," At morn she came those willing flocks to lead,",o5089-l01415, Where lillies-rear them in the watery mead;,o5089-l01420,/iːd/ | /iːd/,full,<b>a</b><b>a</b>,pers00048,o5089-w0020
mead | lead, Where lillies-rear them in the watery mead;,o5089-l01420," At morn she came those willing flocks to lead,",o5089-l01415,/iːd/ | /iːd/,full,<b>a</b><b>a</b>,pers00048,o5089-w0020
told | fold," From early dawn the live-long hours she told,",o5089-l01425, 'Till late at silent eve she penn'd the fold. ,o5089-l01430,/əʊld/ | /əʊld/,full,<b>a</b><b>a</b>,pers00048,o5089-w0020
fold | told, 'Till late at silent eve she penn'd the fold. ,o5089-l01430," From early dawn the live-long hours she told,",o5089-l01425,/əʊld/ | /əʊld/,full,<b>a</b><b>a</b>,pers00048,o5089-w0020
shade | made,"Deep in the grove, beneath the secret shade,",o5089-l01435, A various wreath of odorous flowers she made:,o5089-l01440,/eɪd/ | /eɪd/,full,<b>a</b><b>a</b>,pers00048,o5089-w0020
made | shade, A various wreath of odorous flowers she made:,o5089-l01440,"Deep in the grove, beneath the secret shade,",o5089-l01435,/eɪd/ | /eɪd/,full,<b>a</b><b>a</b>,pers00048,o5089-w0020
chose | grows," Gay-motley'd pinks and sweet jonquils she chose,",o5089-l01445, The violet blue that on the moss-bank grows;,o5089-l01450,/əʊz/ | /əʊz/,full,<b>a</b><b>a</b>,pers00048,o5089-w0020
grows | chose, The violet blue that on the moss-bank grows;,o5089-l01450," Gay-motley'd pinks and sweet jonquils she chose,",o5089-l01445,/əʊz/ | /əʊz/,full,<b>a</b><b>a</b>,pers00048,o5089-w0020
there | hair," All-sweet to sense, the flaunting rose was there:",o5089-l01455, The finish'd chaplet well-adorn'd her hair. ,o5089-l01460,/eə/ | /eə/,full,<b>a</b><b>a</b>,pers00048,o5089-w0020
hair | there, The finish'd chaplet well-adorn'd her hair. ,o5089-l01460," All-sweet to sense, the flaunting rose was there:",o5089-l01455,/eə/ | /eə/,full,<b>a</b><b>a</b>,pers00048,o5089-w0020
stray | away,"Great Abbas chanc'd that fated morn to stray,",o5089-l01465, By love conducted from the chace away;,o5089-l01470,/eɪ/ | /eɪ/,full,<b>a</b><b>a</b>,pers00048,o5089-w0020
away | stray, By love conducted from the chace away;,o5089-l01470,"Great Abbas chanc'd that fated morn to stray,",o5089-l01465,/eɪ/ | /eɪ/,full,<b>a</b><b>a</b>,pers00048,o5089-w0020
song | among," Among the vocal vales he heard her song,",o5089-l01475, And sought the vales and echoing groves among:,o5089-l01480,/ɒŋ/ | /ʌŋ/,half-pararhyme,<b>a</b><b>a</b>,pers00048,o5089-w0020
among | song, And sought the vales and echoing groves among:,o5089-l01480," Among the vocal vales he heard her song,",o5089-l01475,/ʌŋ/ | /ɒŋ/,half-pararhyme,<b>a</b><b>a</b>,pers00048,o5089-w0020
maid | obeyed," At length he found, and woo'd the rural maid;",o5089-l01485," She knew the monarch, and with fear obey'd. ",o5089-l01490,/eɪd/ | /eɪd/,full,<b>a</b><b>a</b>,pers00048,o5089-w0020
obeyed | maid," She knew the monarch, and with fear obey'd. ",o5089-l01490," At length he found, and woo'd the rural maid;",o5089-l01485,/eɪd/ | /eɪd/,full,<b>a</b><b>a</b>,pers00048,o5089-w0020
moved | loved," ""Be every youth like royal Abbas mov'd,",o5089-l01495,"""And every Georgian maid like Abra lov'd! """,o5089-l01500,/uːvd/ | /ʌvd/,half-pararhyme,<b>a</b><b>a</b>,pers00048,o5089-w0020
loved | moved,"""And every Georgian maid like Abra lov'd! """,o5089-l01500," ""Be every youth like royal Abbas mov'd,",o5089-l01495,/ʌvd/ | /uːvd/,half-pararhyme,<b>a</b><b>a</b>,pers00048,o5089-w0020
plain | remain,The royal lover bore her from the plain;,o5089-l01505, Yet still her crook and bleating flock remain:,o5089-l01510,/eɪn/ | /eɪn/,full,<b>a</b><b>a</b>,pers00048,o5089-w0020
remain | plain, Yet still her crook and bleating flock remain:,o5089-l01510,The royal lover bore her from the plain;,o5089-l01505,/eɪn/ | /eɪn/,full,<b>a</b><b>a</b>,pers00048,o5089-w0020
view | adieu," Oft as she went, she backward turn'd her view,",o5089-l01515, And bad that crook and bleating flock adieu. ,o5089-l01520,/uː/ | /uː/,full,<b>a</b><b>a</b>,pers00048,o5089-w0020
adieu | view, And bad that crook and bleating flock adieu. ,o5089-l01520," Oft as she went, she backward turn'd her view,",o5089-l01515,/uː/ | /uː/,full,<b>a</b><b>a</b>,pers00048,o5089-w0020
remove | love,"Fair happy maid! to other scenes remove,",o5089-l01525, To richer scenes of golden power and love! ,o5089-l01530,/uːv/ | /ʌv/,half-pararhyme,<b>a</b><b>a</b>,pers00048,o5089-w0020
love | remove, To richer scenes of golden power and love! ,o5089-l01530,"Fair happy maid! to other scenes remove,",o5089-l01525,/ʌv/ | /uːv/,half-pararhyme,<b>a</b><b>a</b>,pers00048,o5089-w0020
strain | reign,"Go leave the simple pipe, and shepherd's strain;",o5089-l01535," With love delight thee, and with Abbas reign. ",o5089-l01540,/eɪn/ | /eɪn/,full,<b>a</b><b>a</b>,pers00048,o5089-w0020
reign | strain," With love delight thee, and with Abbas reign. ",o5089-l01540,"Go leave the simple pipe, and shepherd's strain;",o5089-l01535,/eɪn/ | /eɪn/,full,<b>a</b><b>a</b>,pers00048,o5089-w0020
moved | loved," ""Be every youth like royal Abbas mov'd,",o5089-l01545,"""And every Georgian maid like Abra lov'd! """,o5089-l01550,/uːvd/ | /ʌvd/,half-pararhyme,<b>a</b><b>a</b>,pers00048,o5089-w0020
loved | moved,"""And every Georgian maid like Abra lov'd! """,o5089-l01550," ""Be every youth like royal Abbas mov'd,",o5089-l01545,/ʌvd/ | /uːvd/,half-pararhyme,<b>a</b><b>a</b>,pers00048,o5089-w0020
love | grove,Yet midst the blaze of courts she fix'd her love,o5089-l01555," On the cool fountain, or the shady grove;",o5089-l01560,/ʌv/ | /əʊv/,half-pararhyme,<b>a</b><b>a</b>,pers00048,o5089-w0020
grove | love," On the cool fountain, or the shady grove;",o5089-l01560,Yet midst the blaze of courts she fix'd her love,o5089-l01555,/əʊv/ | /ʌv/,half-pararhyme,<b>a</b><b>a</b>,pers00048,o5089-w0020
mind | inclined, Still with the shepherd's innocence her mind,o5089-l01565," To the sweet vale, and flowery mead inclin'd;",o5089-l01570,/aɪnd/ | /aɪnd/,full,<b>a</b><b>a</b>,pers00048,o5089-w0020
inclined | mind," To the sweet vale, and flowery mead inclin'd;",o5089-l01570, Still with the shepherd's innocence her mind,o5089-l01565,/aɪnd/ | /aɪnd/,full,<b>a</b><b>a</b>,pers00048,o5089-w0020
flowers | hours," And oft as spring renew'd the plains with flowers,",o5089-l01575," Breath'd his soft gales, and led the fragrant hours,",o5089-l01580,/æəz/ | /æəz/,full,<b>a</b><b>a</b>,pers00048,o5089-w0020
hours | flowers," Breath'd his soft gales, and led the fragrant hours,",o5089-l01580," And oft as spring renew'd the plains with flowers,",o5089-l01575,/æəz/ | /æəz/,full,<b>a</b><b>a</b>,pers00048,o5089-w0020
scene | green," With sure return she sought the sylvan scene,",o5089-l01585," The breezy mountains, and the forests green. ",o5089-l01590,/iːn/ | /iːn/,full,<b>a</b><b>a</b>,pers00048,o5089-w0020
green | scene," The breezy mountains, and the forests green. ",o5089-l01590," With sure return she sought the sylvan scene,",o5089-l01585,/iːn/ | /iːn/,full,<b>a</b><b>a</b>,pers00048,o5089-w0020
band | hand,"Her maids around her mov'd, a duteous band! ",o5089-l01595,Each bore a crook all-rural in her hand:,o5089-l01600,/ænd/ | /ænd/,full,<b>a</b><b>a</b>,pers00048,o5089-w0020
hand | band,Each bore a crook all-rural in her hand:,o5089-l01600,"Her maids around her mov'd, a duteous band! ",o5089-l01595,/ænd/ | /ænd/,full,<b>a</b><b>a</b>,pers00048,o5089-w0020
sung | rung," Some simple lay, of flocks and herds they sung;",o5089-l01605," With joy the mountain, and the forest rung. ",o5089-l01610,/ʌŋ/ | /ʌŋ/,full,<b>a</b><b>a</b>,pers00048,o5089-w0020
rung | sung," With joy the mountain, and the forest rung. ",o5089-l01610," Some simple lay, of flocks and herds they sung;",o5089-l01605,/ʌŋ/ | /ʌŋ/,full,<b>a</b><b>a</b>,pers00048,o5089-w0020
moved | loved," ""Be every youth like royal Abbas mov'd,",o5089-l01615,"""And every Georgian maid like Abra lov'd! """,o5089-l01620,/uːvd/ | /ʌvd/,half-pararhyme,<b>a</b><b>a</b>,pers00048,o5089-w0020
loved | moved,"""And every Georgian maid like Abra lov'd! """,o5089-l01620," ""Be every youth like royal Abbas mov'd,",o5089-l01615,/ʌvd/ | /uːvd/,half-pararhyme,<b>a</b><b>a</b>,pers00048,o5089-w0020
care | fair,And oft the royal lover left the care,o5089-l01625," And thorns of state, attendant on the fair;",o5089-l01630,/eə/ | /eə/,full,<b>a</b><b>a</b>,pers00048,o5089-w0020
fair | care," And thorns of state, attendant on the fair;",o5089-l01630,And oft the royal lover left the care,o5089-l01625,/eə/ | /eə/,full,<b>a</b><b>a</b>,pers00048,o5089-w0020
retired | fired," Oft to the shades and low-roof'd cots retir'd,",o5089-l01635, Or sought the vale where first his heart was fir'd:,o5089-l01640,/æəd/ | /æəd/,full,<b>a</b><b>a</b>,pers00048,o5089-w0020
fired | retired, Or sought the vale where first his heart was fir'd:,o5089-l01640," Oft to the shades and low-roof'd cots retir'd,",o5089-l01635,/æəd/ | /æəd/,full,<b>a</b><b>a</b>,pers00048,o5089-w0020
wore | more," A russet mantle, like a swain, he wore,",o5089-l01645, And thought of crowns and busy courts no more. ,o5089-l01650,/ɔː/ | /ɔː/,full,<b>a</b><b>a</b>,pers00048,o5089-w0020
more | wore, And thought of crowns and busy courts no more. ,o5089-l01650," A russet mantle, like a swain, he wore,",o5089-l01645,/ɔː/ | /ɔː/,full,<b>a</b><b>a</b>,pers00048,o5089-w0020
moved | loved," ""Be every youth like royal Abbas mov'd,",o5089-l01655,"""And every Georgian maid like Abra lov'd! """,o5089-l01660,/uːvd/ | /ʌvd/,half-pararhyme,<b>a</b><b>a</b>,pers00048,o5089-w0020
loved | moved,"""And every Georgian maid like Abra lov'd! """,o5089-l01660," ""Be every youth like royal Abbas mov'd,",o5089-l01655,/ʌvd/ | /uːvd/,half-pararhyme,<b>a</b><b>a</b>,pers00048,o5089-w0020
led | bed,"Blest was the life, that royal Abbas led:",o5089-l01665," Sweet was his love, and innocent his bed. ",o5089-l01670,/ed/ | /ed/,full,<b>a</b><b>a</b>,pers00048,o5089-w0020
bed | led," Sweet was his love, and innocent his bed. ",o5089-l01670,"Blest was the life, that royal Abbas led:",o5089-l01665,/ed/ | /ed/,full,<b>a</b><b>a</b>,pers00048,o5089-w0020
excel | well,What if in wealth the noble maid excel;,o5089-l01675, The simple shepherd girl can love as well. ,o5089-l01680,/el/ | /el/,full,<b>a</b><b>a</b>,pers00048,o5089-w0020
well | excel, The simple shepherd girl can love as well. ,o5089-l01680,What if in wealth the noble maid excel;,o5089-l01675,/el/ | /el/,full,<b>a</b><b>a</b>,pers00048,o5089-w0020
throne | alone,Let those who rule on Persia's jewell'd throne,o5089-l01685," Be fam'd for love, and gentlest love alone;",o5089-l01690,/əʊn/ | /əʊn/,full,<b>a</b><b>a</b>,pers00048,o5089-w0020
alone | throne," Be fam'd for love, and gentlest love alone;",o5089-l01690,Let those who rule on Persia's jewell'd throne,o5089-l01685,/əʊn/ | /əʊn/,full,<b>a</b><b>a</b>,pers00048,o5089-w0020
renown | crown," Or wreathe, like Abbas, full of fair renown,",o5089-l01695, The lover's myrtle with the warrior's crown. ,o5089-l01700,/aʊn/ | /aʊn/,full,<b>a</b><b>a</b>,pers00048,o5089-w0020
crown | renown, The lover's myrtle with the warrior's crown. ,o5089-l01700," Or wreathe, like Abbas, full of fair renown,",o5089-l01695,/aʊn/ | /aʊn/,full,<b>a</b><b>a</b>,pers00048,o5089-w0020
say | away,O happy days! the maids around her say;,o5089-l01705," O haste, profuse of blessings, haste away! ",o5089-l01710,/eɪ/ | /eɪ/,full,<b>a</b><b>a</b>,pers00048,o5089-w0020
away | say," O haste, profuse of blessings, haste away! ",o5089-l01710,O happy days! the maids around her say;,o5089-l01705,/eɪ/ | /eɪ/,full,<b>a</b><b>a</b>,pers00048,o5089-w0020
moved | loved," ""Be every youth, like royal Abbas, mov'd;",o5089-l01715,"""And every Georgian maid, like Abra, lov'd! """,o5089-l01720,/uːvd/ | /ʌvd/,half-pararhyme,<b>a</b><b>a</b>,pers00048,o5089-w0020
loved | moved,"""And every Georgian maid, like Abra, lov'd! """,o5089-l01720," ""Be every youth, like royal Abbas, mov'd;",o5089-l01715,/ʌvd/ | /uːvd/,half-pararhyme,<b>a</b><b>a</b>,pers00048,o5089-w0020
inclined | kind,"IN fair Circassia, where, to love inclin'd,",o5089-l01725," Each swain was blest, for every maid was kind;",o5089-l01730,/aɪnd/ | /aɪnd/,full,<b>a</b><b>a</b>,pers00048,o5089-w0020
kind | inclined," Each swain was blest, for every maid was kind;",o5089-l01730,"IN fair Circassia, where, to love inclin'd,",o5089-l01725,/aɪnd/ | /aɪnd/,full,<b>a</b><b>a</b>,pers00048,o5089-w0020
reigns | plains," At that still hour, when awful midnight reigns,",o5089-l01735," And none, but wretches, haunt the twilight plains;",o5089-l01740,/eɪnz/ | /eɪnz/,full,<b>a</b><b>a</b>,pers00048,o5089-w0020
plains | reigns," And none, but wretches, haunt the twilight plains;",o5089-l01740," At that still hour, when awful midnight reigns,",o5089-l01735,/eɪnz/ | /eɪnz/,full,<b>a</b><b>a</b>,pers00048,o5089-w0020
high | sky," What time the moon had hung her lamp on high,",o5089-l01745, And past in radiance thro' the cloudless sky;,o5089-l01750,/aɪ/ | /aɪ/,full,<b>a</b><b>a</b>,pers00048,o5089-w0020
sky | high, And past in radiance thro' the cloudless sky;,o5089-l01750," What time the moon had hung her lamp on high,",o5089-l01745,/aɪ/ | /aɪ/,full,<b>a</b><b>a</b>,pers00048,o5089-w0020
fled | led," Sad o'er the dews, two brother shepherds fled,",o5089-l01755, Where wildering fear and desperate sorrow led:,o5089-l01760,/ed/ | /ed/,full,<b>a</b><b>a</b>,pers00048,o5089-w0020
led | fled, Where wildering fear and desperate sorrow led:,o5089-l01760," Sad o'er the dews, two brother shepherds fled,",o5089-l01755,/ed/ | /ed/,full,<b>a</b><b>a</b>,pers00048,o5089-w0020
lay | away," Fast as they prest their flight, behind them lay",o5089-l01765," Wide ravag'd plains, and vallies stole away. ",o5089-l01770,/eɪ/ | /eɪ/,full,<b>a</b><b>a</b>,pers00048,o5089-w0020
away | lay," Wide ravag'd plains, and vallies stole away. ",o5089-l01770," Fast as they prest their flight, behind them lay",o5089-l01765,/eɪ/ | /eɪ/,full,<b>a</b><b>a</b>,pers00048,o5089-w0020
ran | began,"Along the mountain's bending sides they ran,",o5089-l01775, 'Till faint and weak Secander thus began:,o5089-l01780,/æn/ | /æn/,full,<b>a</b><b>a</b>,pers00048,o5089-w0020
began | ran, 'Till faint and weak Secander thus began:,o5089-l01780,"Along the mountain's bending sides they ran,",o5089-l01775,/æn/ | /æn/,full,<b>a</b><b>a</b>,pers00048,o5089-w0020
deny | fly,"O stay thee, Agib, for my feet deny,",o5089-l01785," No longer friendly to my life, to fly. ",o5089-l01790,/aɪ/ | /aɪ/,full,<b>a</b><b>a</b>,pers00048,o5089-w0020
fly | deny," No longer friendly to my life, to fly. ",o5089-l01790,"O stay thee, Agib, for my feet deny,",o5089-l01785,/aɪ/ | /aɪ/,full,<b>a</b><b>a</b>,pers00048,o5089-w0020
survey | way,"Friend of my heart, O turn thee and survey,",o5089-l01795, Trace our said flight thro' all its length of way! ,o5089-l01800,/ɜːveɪ/ | /eɪ/,half-vowelrhyme,<b>a</b><b>a</b>,pers00048,o5089-w0020
way | survey, Trace our said flight thro' all its length of way! ,o5089-l01800,"Friend of my heart, O turn thee and survey,",o5089-l01795,/eɪ/ | /ɜːveɪ/,half-vowelrhyme,<b>a</b><b>a</b>,pers00048,o5089-w0020
plain | pain,And first review that long-extended plain! ,o5089-l01805,"And yon wide groves, already past, with pain! ",o5089-l01810,/eɪn/ | /eɪn/,full,<b>a</b><b>a</b>,pers00048,o5089-w0020
pain | plain,"And yon wide groves, already past, with pain! ",o5089-l01810,And first review that long-extended plain! ,o5089-l01805,/eɪn/ | /eɪn/,full,<b>a</b><b>a</b>,pers00048,o5089-w0020
tried | side,"Yon ragged cliff, whose dangerous path we tried! ",o5089-l01815,And last this lofty mountain's weary side! ,o5089-l01820,/aɪd/ | /aɪd/,full,<b>a</b><b>a</b>,pers00048,o5089-w0020
side | tried,And last this lofty mountain's weary side! ,o5089-l01820,"Yon ragged cliff, whose dangerous path we tried! ",o5089-l01815,/aɪd/ | /aɪd/,full,<b>a</b><b>a</b>,pers00048,o5089-w0020
know | woe,"Weak as thou art, yet hapless must thou know",o5089-l01825," The toils of flight, or some severer woe! ",o5089-l01830,/əʊ/ | /əʊ/,full,<b>a</b><b>a</b>,pers00048,o5089-w0020
woe | know," The toils of flight, or some severer woe! ",o5089-l01830,"Weak as thou art, yet hapless must thou know",o5089-l01825,/əʊ/ | /əʊ/,full,<b>a</b><b>a</b>,pers00048,o5089-w0020
behind | wind,"Still as I haste, the Tartar shouts behind,",o5089-l01835, And shrieks and sorrows load the saddening wind:,o5089-l01840,/aɪnd/ | /ɪnd/,half-pararhyme,<b>a</b><b>a</b>,pers00048,o5089-w0020
wind | behind, And shrieks and sorrows load the saddening wind:,o5089-l01840,"Still as I haste, the Tartar shouts behind,",o5089-l01835,/ɪnd/ | /aɪnd/,half-pararhyme,<b>a</b><b>a</b>,pers00048,o5089-w0020
hand | land," In rage of heart, with ruin in his hand,",o5089-l01845," He blasts our harvests, and deforms our land. ",o5089-l01850,/ænd/ | /ænd/,full,<b>a</b><b>a</b>,pers00048,o5089-w0020
land | hand," He blasts our harvests, and deforms our land. ",o5089-l01850," In rage of heart, with ruin in his hand,",o5089-l01845,/ænd/ | /ænd/,full,<b>a</b><b>a</b>,pers00048,o5089-w0020
came | flame,"Yon citron grove, whence first in fear we came,",o5089-l01855, Droops its fair honours to the conquering flame:,o5089-l01860,/eɪm/ | /eɪm/,full,<b>a</b><b>a</b>,pers00048,o5089-w0020
flame | came, Droops its fair honours to the conquering flame:,o5089-l01860,"Yon citron grove, whence first in fear we came,",o5089-l01855,/eɪm/ | /eɪm/,full,<b>a</b><b>a</b>,pers00048,o5089-w0020
despair | care," Far fly the swains, like us, in deep despair,",o5089-l01865, And leave to ruffian bands their fleecy care. ,o5089-l01870,/eə/ | /eə/,full,<b>a</b><b>a</b>,pers00048,o5089-w0020
care | despair, And leave to ruffian bands their fleecy care. ,o5089-l01870," Far fly the swains, like us, in deep despair,",o5089-l01865,/eə/ | /eə/,full,<b>a</b><b>a</b>,pers00048,o5089-w0020
sword | lord,"Unhappy land, whose blessings tempt the sword,",o5089-l01875," In vain, unheard, thou call'st thy Persian lord! ",o5089-l01880,/ɔːd/ | /ɔːd/,full,<b>a</b><b>a</b>,pers00048,o5089-w0020
lord | sword," In vain, unheard, thou call'st thy Persian lord! ",o5089-l01880,"Unhappy land, whose blessings tempt the sword,",o5089-l01875,/ɔːd/ | /ɔːd/,full,<b>a</b><b>a</b>,pers00048,o5089-w0020
aid | maid,"In vain thou court'st him, helpless, to thine aid,",o5089-l01885," To shield the shepherd, and protect the maid! ",o5089-l01890,/eɪd/ | /eɪd/,full,<b>a</b><b>a</b>,pers00048,o5089-w0020
maid | aid," To shield the shepherd, and protect the maid! ",o5089-l01890,"In vain thou court'st him, helpless, to thine aid,",o5089-l01885,/eɪd/ | /eɪd/,full,<b>a</b><b>a</b>,pers00048,o5089-w0020
resigned | mind,"Far off, in thoughtless indolence resign'd,",o5089-l01895, Soft dreams of love and pleasure sooth his mind:,o5089-l01900,/aɪnd/ | /aɪnd/,full,<b>a</b><b>a</b>,pers00048,o5089-w0020
