r_word,line_1,line_1_id,line_2,line_2_id,r_sounds,r_degree,r_scheme,authors_id,poem_id
attends | friends, An art it is where each at once attends,pcr18-l15015," To all, and claims attention from her friends,",pcr18-l15020,/endz/ | /endz/,full,<b>a</b><b>a</b>,pers00275,pcr18-w0040
friends | attends," To all, and claims attention from her friends,",pcr18-l15020, An art it is where each at once attends,pcr18-l15015,/endz/ | /endz/,full,<b>a</b><b>a</b>,pers00275,pcr18-w0040
ear | hear," When they engage the tongue, the eye, the ear,",pcr18-l15025," Reply when list'ning, and when speaking hear:",pcr18-l15030,/ɪə/ | /ɪə/,full,<b>a</b><b>a</b>,pers00275,pcr18-w0040
hear | ear," Reply when list'ning, and when speaking hear:",pcr18-l15030," When they engage the tongue, the eye, the ear,",pcr18-l15025,/ɪə/ | /ɪə/,full,<b>a</b><b>a</b>,pers00275,pcr18-w0040
delays | praise," The ready converse knows no dull delays,",pcr18-l15035," ""But double are the pains, and double be the praise."" ",pcr18-l15040,/eɪz/ | /eɪz/,full,<b>a</b><b>a</b>,pers00275,pcr18-w0040
praise | delays," ""But double are the pains, and double be the praise."" ",pcr18-l15040," The ready converse knows no dull delays,",pcr18-l15035,/eɪz/ | /eɪz/,full,<b>a</b><b>a</b>,pers00275,pcr18-w0040
command | band,Yet not to those alone who bear command,pcr18-l15045, Heaven gives a heart to hail the marriage band;,pcr18-l15050,/ɑːnd/ | /ænd/,half-pararhyme,<b>a</b><b>a</b>,pers00275,pcr18-w0040
band | command, Heaven gives a heart to hail the marriage band;,pcr18-l15050,Yet not to those alone who bear command,pcr18-l15045,/ænd/ | /ɑːnd/,half-pararhyme,<b>a</b><b>a</b>,pers00275,pcr18-w0040
show | owe," Among their servants, we the pairs can show,",pcr18-l15055," Who much to love, and more to prudence owe:",pcr18-l15060,/əʊ/ | /əʊ/,full,<b>a</b><b>a</b>,pers00275,pcr18-w0040
owe | show," Who much to love, and more to prudence owe:",pcr18-l15060," Among their servants, we the pairs can show,",pcr18-l15055,/əʊ/ | /əʊ/,full,<b>a</b><b>a</b>,pers00275,pcr18-w0040
doves | loves," Reuben and Rachel, though as fond as doves,",pcr18-l15065, Were yet discreet and cautious in their loves;,pcr18-l15070,/ʌvz/ | /ʌvz/,full,<b>a</b><b>a</b>,pers00275,pcr18-w0040
loves | doves, Were yet discreet and cautious in their loves;,pcr18-l15070," Reuben and Rachel, though as fond as doves,",pcr18-l15065,/ʌvz/ | /ʌvz/,full,<b>a</b><b>a</b>,pers00275,pcr18-w0040
commands | hands," Nor would attend to Cupid's wild commands,",pcr18-l15075, Till cool reflection bade them join their hands:,pcr18-l15080,/ɑːndz/ | /ændz/,half-pararhyme,<b>a</b><b>a</b>,pers00275,pcr18-w0040
hands | commands, Till cool reflection bade them join their hands:,pcr18-l15080," Nor would attend to Cupid's wild commands,",pcr18-l15075,/ændz/ | /ɑːndz/,half-pararhyme,<b>a</b><b>a</b>,pers00275,pcr18-w0040
ill | still," When both were poor, they thought it argued ill",pcr18-l15085, Of hasty love to make them poorer still;,pcr18-l15090,/ɪl/ | /ɪl/,full,<b>a</b><b>a</b>,pers00275,pcr18-w0040
still | ill, Of hasty love to make them poorer still;,pcr18-l15090," When both were poor, they thought it argued ill",pcr18-l15085,/ɪl/ | /ɪl/,full,<b>a</b><b>a</b>,pers00275,pcr18-w0040
by | supply," Year after year, with savings long laid by,",pcr18-l15095, They bought the future dwelling's full supply;,pcr18-l15100,/aɪ/ | /ʌpli/,half-pararhyme,<b>a</b><b>a</b>,pers00275,pcr18-w0040
supply | by, They bought the future dwelling's full supply;,pcr18-l15100," Year after year, with savings long laid by,",pcr18-l15095,/ʌpli/ | /aɪ/,half-pararhyme,<b>a</b><b>a</b>,pers00275,pcr18-w0040
ware | care," Her frugal fancy cull'd the smaller ware,",pcr18-l15105, The weightier purchase ask'd her Reuben's care;,pcr18-l15110,/eə/ | /eə/,full,<b>a</b><b>a</b>,pers00275,pcr18-w0040
care | ware, The weightier purchase ask'd her Reuben's care;,pcr18-l15110," Her frugal fancy cull'd the smaller ware,",pcr18-l15105,/eə/ | /eə/,full,<b>a</b><b>a</b>,pers00275,pcr18-w0040
threw | new," Together then their last year's gain they threw,",pcr18-l15115," And lo! an auction'd bed, with curtains neat and new. ",pcr18-l15120,/uː/ | /uː/,full,<b>a</b><b>a</b>,pers00275,pcr18-w0040
new | threw," And lo! an auction'd bed, with curtains neat and new. ",pcr18-l15120," Together then their last year's gain they threw,",pcr18-l15115,/uː/ | /uː/,full,<b>a</b><b>a</b>,pers00275,pcr18-w0040
stayed | obeyed,"Thus both, as prudence counsell'd, wisely stay'd,",pcr18-l15125, And cheerful then the calls of Love obey'd:,pcr18-l15130,/eɪd/ | /eɪd/,full,<b>a</b><b>a</b>,pers00275,pcr18-w0040
obeyed | stayed, And cheerful then the calls of Love obey'd:,pcr18-l15130,"Thus both, as prudence counsell'd, wisely stay'd,",pcr18-l15125,/eɪd/ | /eɪd/,full,<b>a</b><b>a</b>,pers00275,pcr18-w0040
one | sun," What if, when Rachel gave her hand, 'twas one. ",pcr18-l15135,Embrown'd by Winter's ice and Summer's sun? ,pcr18-l15140,/ʌn/ | /ʌn/,full,<b>a</b><b>a</b>,pers00275,pcr18-w0040
sun | one,Embrown'd by Winter's ice and Summer's sun? ,pcr18-l15140," What if, when Rachel gave her hand, 'twas one. ",pcr18-l15135,/ʌn/ | /ʌn/,full,<b>a</b><b>a</b>,pers00275,pcr18-w0040
eye | spy,"What if, in Reuben's hair the female eye",pcr18-l15145, Usurping grey among the black could spy? ,pcr18-l15150,/aɪ/ | /aɪ/,full,<b>a</b><b>a</b>,pers00275,pcr18-w0040
spy | eye, Usurping grey among the black could spy? ,pcr18-l15150,"What if, in Reuben's hair the female eye",pcr18-l15145,/aɪ/ | /aɪ/,full,<b>a</b><b>a</b>,pers00275,pcr18-w0040
lost | frost,"What if, in both, life's bloomy flush was lost,",pcr18-l15155, And their full autumn felt the mellowing frost? ,pcr18-l15160,/ɒst/ | /ɒst/,full,<b>a</b><b>a</b>,pers00275,pcr18-w0040
frost | lost, And their full autumn felt the mellowing frost? ,pcr18-l15160,"What if, in both, life's bloomy flush was lost,",pcr18-l15155,/ɒst/ | /ɒst/,full,<b>a</b><b>a</b>,pers00275,pcr18-w0040
away | decay,"Yet time, who blow'd the rose of youth away,",pcr18-l15165, Had left the vigorous stem without decay;,pcr18-l15170,/eɪ/ | /eɪ/,full,<b>a</b><b>a</b>,pers00275,pcr18-w0040
decay | away, Had left the vigorous stem without decay;,pcr18-l15170,"Yet time, who blow'd the rose of youth away,",pcr18-l15165,/eɪ/ | /eɪ/,full,<b>a</b><b>a</b>,pers00275,pcr18-w0040
ground | sound," Like those tall elms, in Farmer Frankford's ground,",pcr18-l15175," They'll grow no more, — but all their growth is sound;",pcr18-l15180,/aʊnd/ | /aʊnd/,full,<b>a</b><b>a</b>,pers00275,pcr18-w0040
sound | ground," They'll grow no more, — but all their growth is sound;",pcr18-l15180," Like those tall elms, in Farmer Frankford's ground,",pcr18-l15175,/aʊnd/ | /aʊnd/,full,<b>a</b><b>a</b>,pers00275,pcr18-w0040
land | stand," By time confirm'd and rooted in the land,",pcr18-l15185," The storms they've stood, still promise they shall stand. ",pcr18-l15190,/ænd/ | /ænd/,full,<b>a</b><b>a</b>,pers00275,pcr18-w0040
stand | land," The storms they've stood, still promise they shall stand. ",pcr18-l15190," By time confirm'd and rooted in the land,",pcr18-l15185,/ænd/ | /ænd/,full,<b>a</b><b>a</b>,pers00275,pcr18-w0040
rest | blessed,"These are the happier pairs, their life has rest,",pcr18-l15195," Their hopes are strong, their humble portion blest",pcr18-l15200,/est/ | /est/,full,<b>a</b><b>a</b>,pers00275,pcr18-w0040
blessed | rest," Their hopes are strong, their humble portion blest",pcr18-l15200,"These are the happier pairs, their life has rest,",pcr18-l15195,/est/ | /est/,full,<b>a</b><b>a</b>,pers00275,pcr18-w0040
led | bread," While those more rash to hasty marriage led,",pcr18-l15205, Lament th' impatience which now stints their bread:,pcr18-l15210,/ed/ | /ed/,full,<b>a</b><b>a</b>,pers00275,pcr18-w0040
bread | led, Lament th' impatience which now stints their bread:,pcr18-l15210," While those more rash to hasty marriage led,",pcr18-l15205,/ed/ | /ed/,full,<b>a</b><b>a</b>,pers00275,pcr18-w0040
increase | cease," When such their union, years their cares increase,",pcr18-l15215," Their love grows colder, and their pleasures cease;",pcr18-l15220,/ɪnkriːs/ | /iːs/,half-vowelrhyme,<b>a</b><b>a</b>,pers00275,pcr18-w0040
cease | increase," Their love grows colder, and their pleasures cease;",pcr18-l15220," When such their union, years their cares increase,",pcr18-l15215,/iːs/ | /ɪnkriːs/,half-vowelrhyme,<b>a</b><b>a</b>,pers00275,pcr18-w0040
relieved | grieved," In health just fed, in sickness just relieved;",pcr18-l15225, By hardships harass'd and by children grieved;,pcr18-l15230,/iːvd/ | /iːvd/,full,<b>a</b><b>a</b>,pers00275,pcr18-w0040
grieved | relieved, By hardships harass'd and by children grieved;,pcr18-l15230," In health just fed, in sickness just relieved;",pcr18-l15225,/iːvd/ | /iːvd/,full,<b>a</b><b>a</b>,pers00275,pcr18-w0040
strife | life," In petty quarrels and in peevish strife,",pcr18-l15235, The once fond couple waste the spring of life:,pcr18-l15240,/aɪf/ | /aɪf/,full,<b>a</b><b>a</b>,pers00275,pcr18-w0040
life | strife, The once fond couple waste the spring of life:,pcr18-l15240," In petty quarrels and in peevish strife,",pcr18-l15235,/aɪf/ | /aɪf/,full,<b>a</b><b>a</b>,pers00275,pcr18-w0040
grown | own," But when to age mature those children grown,",pcr18-l15245," Find hopes and homes and hardships of their own,",pcr18-l15250,/əʊn/ | /əʊn/,full,<b>a</b><b>a</b>,pers00275,pcr18-w0040
own | grown," Find hopes and homes and hardships of their own,",pcr18-l15250," But when to age mature those children grown,",pcr18-l15245,/əʊn/ | /əʊn/,full,<b>a</b><b>a</b>,pers00275,pcr18-w0040
woes | repose, The harass'd couple feel their lingering woes,pcr18-l15255," Receding slowly, till they find repose. ",pcr18-l15260,/əʊz/ | /əʊz/,full,<b>a</b><b>a</b>,pers00275,pcr18-w0040
repose | woes," Receding slowly, till they find repose. ",pcr18-l15260, The harass'd couple feel their lingering woes,pcr18-l15255,/əʊz/ | /əʊz/,full,<b>a</b><b>a</b>,pers00275,pcr18-w0040
aside | pride,"Complaints and murmurs then are laid aside,",pcr18-l15265," (By reason these subdued, and those by pride;)",pcr18-l15270,/aɪd/ | /aɪd/,full,<b>a</b><b>a</b>,pers00275,pcr18-w0040
pride | aside," (By reason these subdued, and those by pride;)",pcr18-l15270,"Complaints and murmurs then are laid aside,",pcr18-l15265,/aɪd/ | /aɪd/,full,<b>a</b><b>a</b>,pers00275,pcr18-w0040
wife | life," And, taught by care, the patient man and wife",pcr18-l15275, Agree to share the bitter-sweet of life;,pcr18-l15280,/aɪf/ | /aɪf/,full,<b>a</b><b>a</b>,pers00275,pcr18-w0040
life | wife, Agree to share the bitter-sweet of life;,pcr18-l15280," And, taught by care, the patient man and wife",pcr18-l15275,/aɪf/ | /aɪf/,full,<b>a</b><b>a</b>,pers00275,pcr18-w0040
cure | endure," (Life that has sorrow much and sorrow's cure,",pcr18-l15285, Where they who most enjoy shall much endure:),pcr18-l15290,/ʊə/ | /ʊə/,full,<b>a</b><b>a</b>,pers00275,pcr18-w0040
endure | cure, Where they who most enjoy shall much endure:),pcr18-l15290," (Life that has sorrow much and sorrow's cure,",pcr18-l15285,/ʊə/ | /ʊə/,full,<b>a</b><b>a</b>,pers00275,pcr18-w0040
prayers | cares," Their rest, their labours, duties, sufferings, prayers,",pcr18-l15295," Compose the soul, and fit it for its cares;",pcr18-l15300,/eɪəz/ | /eəz/,half-pararhyme,<b>a</b><b>a</b>,pers00275,pcr18-w0040
cares | prayers," Compose the soul, and fit it for its cares;",pcr18-l15300," Their rest, their labours, duties, sufferings, prayers,",pcr18-l15295,/eəz/ | /eɪəz/,half-pararhyme,<b>a</b><b>a</b>,pers00275,pcr18-w0040
behind | mind," Their graves before them and their griefs behind,",pcr18-l15305, Have each a med'cine for the rustic mind;,pcr18-l15310,/aɪnd/ | /aɪnd/,full,<b>a</b><b>a</b>,pers00275,pcr18-w0040
mind | behind, Have each a med'cine for the rustic mind;,pcr18-l15310," Their graves before them and their griefs behind,",pcr18-l15305,/aɪnd/ | /aɪnd/,full,<b>a</b><b>a</b>,pers00275,pcr18-w0040
go | hoe," Nor has he care to whom his wealth shall go,",pcr18-l15315, Or who shall labour with his spade and hoe;,pcr18-l15320,/əʊ/ | /əʊ/,full,<b>a</b><b>a</b>,pers00275,pcr18-w0040
hoe | go, Or who shall labour with his spade and hoe;,pcr18-l15320," Nor has he care to whom his wealth shall go,",pcr18-l15315,/əʊ/ | /əʊ/,full,<b>a</b><b>a</b>,pers00275,pcr18-w0040
remains | sustains," But as he lends the strength that yet remains,",pcr18-l15325," And some dead neighbour on his bier sustains,",pcr18-l15330,/eɪnz/ | /eɪnz/,full,<b>a</b><b>a</b>,pers00275,pcr18-w0040
sustains | remains," And some dead neighbour on his bier sustains,",pcr18-l15330," But as he lends the strength that yet remains,",pcr18-l15325,/eɪnz/ | /eɪnz/,full,<b>a</b><b>a</b>,pers00275,pcr18-w0040
flail | ale," (One with whom oft he whirl'd the bounding flail,",pcr18-l15335," Toss'd the broad coit, or took th' inspiring ale,)",pcr18-l15340,/eɪl/ | /eɪl/,full,<b>a</b><b>a</b>,pers00275,pcr18-w0040
ale | flail," Toss'd the broad coit, or took th' inspiring ale,)",pcr18-l15340," (One with whom oft he whirl'd the bounding flail,",pcr18-l15335,/eɪl/ | /eɪl/,full,<b>a</b><b>a</b>,pers00275,pcr18-w0040
done | run," ""For me,"" (he meditates,) ""shall soon be done",pcr18-l15345," 'This friendly duty, when my race be run;",pcr18-l15350,/ʌn/ | /ʌn/,full,<b>a</b><b>a</b>,pers00275,pcr18-w0040
run | done," 'This friendly duty, when my race be run;",pcr18-l15350," ""For me,"" (he meditates,) ""shall soon be done",pcr18-l15345,/ʌn/ | /ʌn/,full,<b>a</b><b>a</b>,pers00275,pcr18-w0040
past | overcast,""" 'T was first in trouble as in error past,",pcr18-l15355," ""Dark clouds and stormy cares whole years o'ercast,",pcr18-l15360,/ɑːst/ | /ɔːkæst/,half-pararhyme,<b>a</b><b>a</b>a,pers00275,pcr18-w0040
past | last,""" 'T was first in trouble as in error past,",pcr18-l15355,""" But calm my setting day, and sunshine smiles at last:",pcr18-l15365,/ɑːst/ | /ɑːst/,full,<b>a</b>a<b>a</b>,pers00275,pcr18-w0040
overcast | past," ""Dark clouds and stormy cares whole years o'ercast,",pcr18-l15360,""" 'T was first in trouble as in error past,",pcr18-l15355,/ɔːkæst/ | /ɑːst/,half-pararhyme,<b>a</b><b>a</b>a,pers00275,pcr18-w0040
overcast | last," ""Dark clouds and stormy cares whole years o'ercast,",pcr18-l15360,""" But calm my setting day, and sunshine smiles at last:",pcr18-l15365,/ɔːkæst/ | /ɑːst/,half-pararhyme,a<b>a</b><b>a</b>,pers00275,pcr18-w0040
last | past,""" But calm my setting day, and sunshine smiles at last:",pcr18-l15365,""" 'T was first in trouble as in error past,",pcr18-l15355,/ɑːst/ | /ɑːst/,full,<b>a</b>a<b>a</b>,pers00275,pcr18-w0040
last | overcast,""" But calm my setting day, and sunshine smiles at last:",pcr18-l15365," ""Dark clouds and stormy cares whole years o'ercast,",pcr18-l15360,/ɑːst/ | /ɔːkæst/,half-pararhyme,a<b>a</b><b>a</b>,pers00275,pcr18-w0040
spent | content," ""My vices punish'd and my follies spent,",pcr18-l15370,""" Not loth to die, but yet to live content,",pcr18-l15375,/ent/ | /ɒntent/,half-vowelrhyme,<b>a</b><b>a</b>,pers00275,pcr18-w0040
content | spent,""" Not loth to die, but yet to live content,",pcr18-l15375," ""My vices punish'd and my follies spent,",pcr18-l15370,/ɒntent/ | /ent/,half-vowelrhyme,<b>a</b><b>a</b>,pers00275,pcr18-w0040
eye | sigh," ""I rest:"" — then casting on the grave his eye,",pcr18-l15380," His friend compels a tear, and his own griefs a sigh. ",pcr18-l15385,/aɪ/ | /aɪ/,full,<b>a</b><b>a</b>,pers00275,pcr18-w0040
sigh | eye," His friend compels a tear, and his own griefs a sigh. ",pcr18-l15385," ""I rest:"" — then casting on the grave his eye,",pcr18-l15380,/aɪ/ | /aɪ/,full,<b>a</b><b>a</b>,pers00275,pcr18-w0040
love | prove,"Last on my list appears a match of love,",pcr18-l15390, And one of virtue; — happy may it prove! —,pcr18-l15395,/ʌv/ | /uːv/,half-pararhyme,<b>a</b><b>a</b>,pers00275,pcr18-w0040
prove | love, And one of virtue; — happy may it prove! —,pcr18-l15395,"Last on my list appears a match of love,",pcr18-l15390,/uːv/ | /ʌv/,half-pararhyme,<b>a</b><b>a</b>,pers00275,pcr18-w0040
knight | sight," Sir Edward Archer is an amorous knight,",pcr18-l15400, And maidens chaste and lovely shun his sight;,pcr18-l15405,/aɪt/ | /aɪt/,full,<b>a</b><b>a</b>,pers00275,pcr18-w0040
sight | knight, And maidens chaste and lovely shun his sight;,pcr18-l15405," Sir Edward Archer is an amorous knight,",pcr18-l15400,/aɪt/ | /aɪt/,full,<b>a</b><b>a</b>,pers00275,pcr18-w0040
taste | chaste," His bailiff's daughter suited much his taste,",pcr18-l15410, For Fanny Price was lovely and was chaste;,pcr18-l15415,/eɪst/ | /eɪst/,full,<b>a</b><b>a</b>,pers00275,pcr18-w0040
chaste | taste, For Fanny Price was lovely and was chaste;,pcr18-l15415," His bailiff's daughter suited much his taste,",pcr18-l15410,/eɪst/ | /eɪst/,full,<b>a</b><b>a</b>,pers00275,pcr18-w0040
near | fear," To her the Knight with gentle looks drew near,",pcr18-l15420," And timid voice assumed, to banish fear: —",pcr18-l15425,/ɪə/ | /ɪə/,full,<b>a</b><b>a</b>,pers00275,pcr18-w0040
fear | near," And timid voice assumed, to banish fear: —",pcr18-l15425," To her the Knight with gentle looks drew near,",pcr18-l15420,/ɪə/ | /ɪə/,full,<b>a</b><b>a</b>,pers00275,pcr18-w0040
breast | rest," ""Hope of my life, dear sovereign of my breast,",pcr18-l15430,""" Which, since I knew thee, knows not joy nor rest;",pcr18-l15435,/est/ | /est/,full,<b>a</b><b>a</b>,pers00275,pcr18-w0040
rest | breast,""" Which, since I knew thee, knows not joy nor rest;",pcr18-l15435," ""Hope of my life, dear sovereign of my breast,",pcr18-l15430,/est/ | /est/,full,<b>a</b><b>a</b>,pers00275,pcr18-w0040
eyes | prise," ""Know, thou art all that my delighted eyes,",pcr18-l15440,""" My fondest thoughts, my proudest wishes prize;",pcr18-l15445,/aɪz/ | /aɪz/,full,<b>a</b><b>a</b>,pers00275,pcr18-w0040
prise | eyes,""" My fondest thoughts, my proudest wishes prize;",pcr18-l15445," ""Know, thou art all that my delighted eyes,",pcr18-l15440,/aɪz/ | /aɪz/,full,<b>a</b><b>a</b>,pers00275,pcr18-w0040
fair | heir," ""And is that bosom — (what on earth so fair!)",pcr18-l15450,""" To cradle some coarse peasant's sprawling heir,",pcr18-l15455,/eə/ | /eə/,full,<b>a</b><b>a</b>,pers00275,pcr18-w0040
heir | fair,""" To cradle some coarse peasant's sprawling heir,",pcr18-l15455," ""And is that bosom — (what on earth so fair!)",pcr18-l15450,/eə/ | /eə/,full,<b>a</b><b>a</b>,pers00275,pcr18-w0040
swain | pain," ""To be that pillow which some surly swain",pcr18-l15460,""" May treat with scorn and agonise with pain? ",pcr18-l15465,/eɪn/ | /eɪn/,full,<b>a</b><b>a</b>,pers00275,pcr18-w0040
pain | swain,""" May treat with scorn and agonise with pain? ",pcr18-l15465," ""To be that pillow which some surly swain",pcr18-l15460,/eɪn/ | /eɪn/,full,<b>a</b><b>a</b>,pers00275,pcr18-w0040
share | care," ""Art thou, sweet maid, a ploughman's wants to share,",pcr18-l15470,""" To dread his insult, to support his care;",pcr18-l15475,/eə/ | /eə/,full,<b>a</b><b>a</b>,pers00275,pcr18-w0040
care | share,""" To dread his insult, to support his care;",pcr18-l15475," ""Art thou, sweet maid, a ploughman's wants to share,",pcr18-l15470,/eə/ | /eə/,full,<b>a</b><b>a</b>,pers00275,pcr18-w0040
prove | love," ""To hear his follies, his contempt to prove,",pcr18-l15480,""" And (oh! the torment!) to endure his love;",pcr18-l15485,/uːv/ | /ʌv/,half-pararhyme,<b>a</b><b>a</b>,pers00275,pcr18-w0040
love | prove,""" And (oh! the torment!) to endure his love;",pcr18-l15485," ""To hear his follies, his contempt to prove,",pcr18-l15480,/ʌv/ | /uːv/,half-pararhyme,<b>a</b><b>a</b>,pers00275,pcr18-w0040
destroy | joy," ""Till want and deep regret those charms destroy,",pcr18-l15490,""" That time would spare, if time were pass'd in joy? ",pcr18-l15495,/ɔɪ/ | /ɔɪ/,full,<b>a</b><b>a</b>,pers00275,pcr18-w0040
joy | destroy,""" That time would spare, if time were pass'd in joy? ",pcr18-l15495," ""Till want and deep regret those charms destroy,",pcr18-l15490,/ɔɪ/ | /ɔɪ/,full,<b>a</b><b>a</b>,pers00275,pcr18-w0040
night | right," ""With him, in varied pains, from morn till night,",pcr18-l15500,""" Your hours shall pass; yourself a ruffian's right;",pcr18-l15505,/aɪt/ | /aɪt/,full,<b>a</b><b>a</b>,pers00275,pcr18-w0040
right | night,""" Your hours shall pass; yourself a ruffian's right;",pcr18-l15505," ""With him, in varied pains, from morn till night,",pcr18-l15500,/aɪt/ | /aɪt/,full,<b>a</b><b>a</b>,pers00275,pcr18-w0040
wool | pool," ""Your softest bed shall be the knotted wool;",pcr18-l15510,""" Your purest drink the waters of the pool;",pcr18-l15515,/ʊl/ | /uːl/,half-pararhyme,<b>a</b><b>a</b>,pers00275,pcr18-w0040
pool | wool,""" Your purest drink the waters of the pool;",pcr18-l15515," ""Your softest bed shall be the knotted wool;",pcr18-l15510,/uːl/ | /ʊl/,half-pararhyme,<b>a</b><b>a</b>,pers00275,pcr18-w0040
sustain | pain," ""Your sweetest food will but your life sustain,",pcr18-l15520,""" And your best pleasure be a rest from pain;",pcr18-l15525,/eɪn/ | /eɪn/,full,<b>a</b><b>a</b>,pers00275,pcr18-w0040
pain | sustain,""" And your best pleasure be a rest from pain;",pcr18-l15525," ""Your sweetest food will but your life sustain,",pcr18-l15520,/eɪn/ | /eɪn/,full,<b>a</b><b>a</b>,pers00275,pcr18-w0040
abate | fate," ""While, through each year, as health and strength abate,",pcr18-l15530,""" You'll weep your woes and wonder at your fate;",pcr18-l15535,/eɪt/ | /eɪt/,full,<b>a</b><b>a</b>,pers00275,pcr18-w0040
fate | abate,""" You'll weep your woes and wonder at your fate;",pcr18-l15535," ""While, through each year, as health and strength abate,",pcr18-l15530,/eɪt/ | /eɪt/,full,<b>a</b><b>a</b>,pers00275,pcr18-w0040
on | gone," ""And cry, 'Behold,' as life's last cares come on,",pcr18-l15540,"""'My burthens growing when my strength is gone.' ",pcr18-l15545,/ɒn/ | /ɒn/,full,<b>a</b><b>a</b>,pers00275,pcr18-w0040
gone | on,"""'My burthens growing when my strength is gone.' ",pcr18-l15545," ""And cry, 'Behold,' as life's last cares come on,",pcr18-l15540,/ɒn/ | /ɒn/,full,<b>a</b><b>a</b>,pers00275,pcr18-w0040
desire | require," ""Now turn with me, and all the young desire,",pcr18-l15550,""" That taste can form, that fancy can require;",pcr18-l15555,/æə/ | /æə/,full,<b>a</b><b>a</b>,pers00275,pcr18-w0040
require | desire,""" That taste can form, that fancy can require;",pcr18-l15555," ""Now turn with me, and all the young desire,",pcr18-l15550,/æə/ | /æə/,full,<b>a</b><b>a</b>,pers00275,pcr18-w0040
procures | yours," ""All that excites enjoyment, or procures",pcr18-l15560,""" Wealth, health, respect, delight, and love, are yours:",pcr18-l15565,/ʊəz/ | /ɔːz/,half-pararhyme,<b>a</b><b>a</b>,pers00275,pcr18-w0040
yours | procures,""" Wealth, health, respect, delight, and love, are yours:",pcr18-l15565," ""All that excites enjoyment, or procures",pcr18-l15560,/ɔːz/ | /ʊəz/,half-pararhyme,<b>a</b><b>a</b>,pers00275,pcr18-w0040
flow | glow," ""Sparkling, in cups of gold, your wines shall flow,",pcr18-l15570,""" Grace that fair hand, in that dear bosom glow;",pcr18-l15575,/əʊ/ | /əʊ/,full,<b>a</b><b>a</b>,pers00275,pcr18-w0040
glow | flow,""" Grace that fair hand, in that dear bosom glow;",pcr18-l15575," ""Sparkling, in cups of gold, your wines shall flow,",pcr18-l15570,/əʊ/ | /əʊ/,full,<b>a</b><b>a</b>,pers00275,pcr18-w0040
year | appear," ""Fruits of each clime, and flowers, through all the year,",pcr18-l15580,""" Shall on your walls and in your walks appear:",pcr18-l15585,/ɪə/ | /ɪə/,full,<b>a</b><b>a</b>,pers00275,pcr18-w0040
appear | year,""" Shall on your walls and in your walks appear:",pcr18-l15585," ""Fruits of each clime, and flowers, through all the year,",pcr18-l15580,/ɪə/ | /ɪə/,full,<b>a</b><b>a</b>,pers00275,pcr18-w0040
repeat | sweet," ""Where all beholding, shall your praise repeat,",pcr18-l15590,""" No fruit so tempting and no flower so sweet:",pcr18-l15595,/iːt/ | /iːt/,full,<b>a</b><b>a</b>,pers00275,pcr18-w0040
sweet | repeat,""" No fruit so tempting and no flower so sweet:",pcr18-l15595," ""Where all beholding, shall your praise repeat,",pcr18-l15590,/iːt/ | /iːt/,full,<b>a</b><b>a</b>,pers00275,pcr18-w0040
lie | eye," ""The softest carpets in your rooms shall lie,",pcr18-l15600,""" Pictures of happiest loves shall meet your eye,",pcr18-l15605,/aɪ/ | /aɪ/,full,<b>a</b><b>a</b>,pers00275,pcr18-w0040
eye | lie,""" Pictures of happiest loves shall meet your eye,",pcr18-l15605," ""The softest carpets in your rooms shall lie,",pcr18-l15600,/aɪ/ | /aɪ/,full,<b>a</b><b>a</b>,pers00275,pcr18-w0040
floor | adore," ""And tallest mirrors, reaching to the floor,",pcr18-l15610,""" Shall show you all the object I adore;",pcr18-l15615,/ɔː/ | /ɔː/,full,<b>a</b><b>a</b>,pers00275,pcr18-w0040
adore | floor,""" Shall show you all the object I adore;",pcr18-l15615," ""And tallest mirrors, reaching to the floor,",pcr18-l15610,/ɔː/ | /ɔː/,full,<b>a</b><b>a</b>,pers00275,pcr18-w0040
dressed | caressed," ""Who, by the hands of wealth and fashion dress'd,",pcr18-l15620,""" By slaves attended and by friends caress'd,",pcr18-l15625,/est/ | /est/,full,<b>a</b><b>a</b>,pers00275,pcr18-w0040
caressed | dressed,""" By slaves attended and by friends caress'd,",pcr18-l15625," ""Who, by the hands of wealth and fashion dress'd,",pcr18-l15620,/est/ | /est/,full,<b>a</b><b>a</b>,pers00275,pcr18-w0040
ways | praise," ""Shall move, a wonder, through the public ways,",pcr18-l15630,""" And hear the whispers of adoring praise. ",pcr18-l15635,/eɪz/ | /eɪz/,full,<b>a</b><b>a</b>,pers00275,pcr18-w0040
