r_word,line_1,line_1_id,line_2,line_2_id,r_sounds,r_degree,r_scheme,authors_id,poem_id
bribes | tribes,"Turn your bright eyes, and shun the dangerous bribes;",o4671-l16385," Stay in your crystal chambers, silver tribes! ",o4671-l16380,/aɪbz/ | /aɪbz/,full,<b>a</b><b>a</b>,pers00337,o4671-w0020
sweeps | deeps, The tramel'd net with less destruction sweeps,o4671-l16390," Your curling shallows, and your azure deeps;",o4671-l16395,/iːps/ | /iːps/,full,<b>a</b><b>a</b>,pers00337,o4671-w0020
deeps | sweeps," Your curling shallows, and your azure deeps;",o4671-l16395, The tramel'd net with less destruction sweeps,o4671-l16390,/iːps/ | /iːps/,full,<b>a</b><b>a</b>,pers00337,o4671-w0020
beneath | death," With less deceit, the gilded fly beneath,",o4671-l16400," Lurks the fell hook unseen, — to taste is death! —",o4671-l16405,/iːθ/ | /eθ/,half-pararhyme,<b>a</b><b>a</b>,pers00337,o4671-w0020
death | beneath," Lurks the fell hook unseen, — to taste is death! —",o4671-l16405," With less deceit, the gilded fly beneath,",o4671-l16400,/eθ/ | /iːθ/,half-pararhyme,<b>a</b><b>a</b>,pers00337,o4671-w0020
coat | float," — Dim your slow eyes, and dull your pearly coat,",o4671-l16410," Drunk on the waves your languid forms shall float,",o4671-l16415,/əʊt/ | /əʊt/,full,<b>a</b><b>a</b>,pers00337,o4671-w0020
float | coat," Drunk on the waves your languid forms shall float,",o4671-l16415," — Dim your slow eyes, and dull your pearly coat,",o4671-l16410,/əʊt/ | /əʊt/,full,<b>a</b><b>a</b>,pers00337,o4671-w0020
play | prey," On useless fins in giddy circles play,",o4671-l16420, And Herons and Otters seize you for their prey. —,o4671-l16425,/eɪ/ | /eɪ/,full,<b>a</b><b>a</b>,pers00337,o4671-w0020
prey | play, And Herons and Otters seize you for their prey. —,o4671-l16425," On useless fins in giddy circles play,",o4671-l16420,/eɪ/ | /eɪ/,full,<b>a</b><b>a</b>,pers00337,o4671-w0020
land | strand,"So, when the Saint from Padua's graceless land",o4671-l16430," In silent anguish sought the barren strand,",o4671-l16435,/ænd/ | /ænd/,full,<b>a</b><b>a</b>,pers00337,o4671-w0020
strand | land," In silent anguish sought the barren strand,",o4671-l16435,"So, when the Saint from Padua's graceless land",o4671-l16430,/ænd/ | /ænd/,full,<b>a</b><b>a</b>,pers00337,o4671-w0020
stood | flood," High on the shatter'd beech sublime He stood,",o4671-l16440, Still'd with his waving arm the babbling flood;,o4671-l16445,/ʊd/ | /ʌd/,half-pararhyme,<b>a</b><b>a</b>,pers00337,o4671-w0020
flood | stood, Still'd with his waving arm the babbling flood;,o4671-l16445," High on the shatter'd beech sublime He stood,",o4671-l16440,/ʌd/ | /ʊd/,half-pararhyme,<b>a</b><b>a</b>,pers00337,o4671-w0020
vain | main," ""To Man's dull ear,"" He cry'd, ""I call in vain,",o4671-l16450," Hear me, ye scaly tenants of the main!"" —",o4671-l16455,/eɪn/ | /eɪn/,full,<b>a</b><b>a</b>,pers00337,o4671-w0020
main | vain," Hear me, ye scaly tenants of the main!"" —",o4671-l16455," ""To Man's dull ear,"" He cry'd, ""I call in vain,",o4671-l16450,/eɪn/ | /eɪn/,full,<b>a</b><b>a</b>,pers00337,o4671-w0020
flocks | rocks," Misshapen Seals approach in circling flocks,",o4671-l16460," In dusky mail the Tortoise climbs the rocks,",o4671-l16465,/ɒks/ | /ɒks/,full,<b>a</b><b>a</b>,pers00337,o4671-w0020
rocks | flocks," In dusky mail the Tortoise climbs the rocks,",o4671-l16465," Misshapen Seals approach in circling flocks,",o4671-l16460,/ɒks/ | /ɒks/,full,<b>a</b><b>a</b>,pers00337,o4671-w0020
pour | shore," Torpedoes, Sharks, Rays, Porpus, Dolphins, pour",o4671-l16470, Their twinkling squadrons round the glittering shore;,o4671-l16475,/ɔː/ | /ɔː/,full,<b>a</b><b>a</b>,pers00337,o4671-w0020
shore | pour, Their twinkling squadrons round the glittering shore;,o4671-l16475," Torpedoes, Sharks, Rays, Porpus, Dolphins, pour",o4671-l16470,/ɔː/ | /ɔː/,full,<b>a</b><b>a</b>,pers00337,o4671-w0020
glide | tide," With tangled fins, behind, huge Phocae glide,",o4671-l16480, And Whales and Grampi swell the distant tide. ,o4671-l16485,/aɪd/ | /aɪd/,full,<b>a</b><b>a</b>,pers00337,o4671-w0020
tide | glide, And Whales and Grampi swell the distant tide. ,o4671-l16485," With tangled fins, behind, huge Phocae glide,",o4671-l16480,/aɪd/ | /aɪd/,full,<b>a</b><b>a</b>,pers00337,o4671-w0020
addressed | breast,"Then kneel'd the hoary Seer, to heaven address'd",o4671-l16490," His siery eyes, and smote his sounding brest;",o4671-l16495,/est/ | /est/,full,<b>a</b><b>a</b>,pers00337,o4671-w0020
breast | addressed," His siery eyes, and smote his sounding brest;",o4671-l16495,"Then kneel'd the hoary Seer, to heaven address'd",o4671-l16490,/est/ | /est/,full,<b>a</b><b>a</b>,pers00337,o4671-w0020
cried | replied," ""Bless ye the Lord!"" with thundering voice he cry'd,",o4671-l16500," ""Bless ye the Lord!"" the bending shores reply'd;",o4671-l16505,/aɪd/ | /aɪd/,full,<b>a</b><b>a</b>,pers00337,o4671-w0020
replied | cried," ""Bless ye the Lord!"" the bending shores reply'd;",o4671-l16505," ""Bless ye the Lord!"" with thundering voice he cry'd,",o4671-l16500,/aɪd/ | /aɪd/,full,<b>a</b><b>a</b>,pers00337,o4671-w0020
word | lord," The winds and waters caught the sacred word,",o4671-l16510," And mingling echoes shouted ""Bless the Lord!"" ",o4671-l16515,/ɜːd/ | /ɔːd/,half-pararhyme,<b>a</b><b>a</b>,pers00337,o4671-w0020
lord | word," And mingling echoes shouted ""Bless the Lord!"" ",o4671-l16515," The winds and waters caught the sacred word,",o4671-l16510,/ɔːd/ | /ɜːd/,half-pararhyme,<b>a</b><b>a</b>,pers00337,o4671-w0020
feel | zeal,The listening shoals the quick contagion feel. ,o4671-l16520,"Pant on the floods, inebriate with their zeal,",o4671-l16525,/iːl/ | /iːl/,full,<b>a</b><b>a</b>,pers00337,o4671-w0020
zeal | feel,"Pant on the floods, inebriate with their zeal,",o4671-l16525,The listening shoals the quick contagion feel. ,o4671-l16520,/iːl/ | /iːl/,full,<b>a</b><b>a</b>,pers00337,o4671-w0020
heads | beds," Ope their wide jaws, and bow their slimy heads,",o4671-l16530, And dash with frantic sins their foamy beds. ,o4671-l16535,/edz/ | /edz/,full,<b>a</b><b>a</b>,pers00337,o4671-w0020
beds | heads, And dash with frantic sins their foamy beds. ,o4671-l16535," Ope their wide jaws, and bow their slimy heads,",o4671-l16530,/edz/ | /edz/,full,<b>a</b><b>a</b>,pers00337,o4671-w0020
towers | bowers,"Sopha'd on silk, amid her charm-built towers,",o4671-l16540," Her meads of asphodel, and amaranth bowers,",o4671-l16545,/aʊəz/ | /aʊəz/,full,<b>a</b><b>a</b>,pers00337,o4671-w0020
bowers | towers," Her meads of asphodel, and amaranth bowers,",o4671-l16545,"Sopha'd on silk, amid her charm-built towers,",o4671-l16540,/aʊəz/ | /aʊəz/,full,<b>a</b><b>a</b>,pers00337,o4671-w0020
abodes | nods," Where Sleep and Silence guard the soft abodes,",o4671-l16550, In sullen apathy PAPAVER nods. ,o4671-l16555,/əʊdz/ | /ɒdz/,half-pararhyme,<b>a</b><b>a</b>,pers00337,o4671-w0020
nods | abodes, In sullen apathy PAPAVER nods. ,o4671-l16555," Where Sleep and Silence guard the soft abodes,",o4671-l16550,/ɒdz/ | /əʊdz/,half-pararhyme,<b>a</b><b>a</b>,pers00337,o4671-w0020
streams | dreams,Faint o'er her couch in scintillating streams,o4671-l16560, Pass the thin forms of Fancy and of Dreams;,o4671-l16565,/iːmz/ | /iːmz/,full,<b>a</b><b>a</b>,pers00337,o4671-w0020
dreams | streams, Pass the thin forms of Fancy and of Dreams;,o4671-l16565,Faint o'er her couch in scintillating streams,o4671-l16560,/iːmz/ | /iːmz/,full,<b>a</b><b>a</b>,pers00337,o4671-w0020
ground | round, Froze by inchantment on the velvet ground,o4671-l16570, Fair youths and beauteous ladies glitter round;,o4671-l16575,/aʊnd/ | /aʊnd/,full,<b>a</b><b>a</b>,pers00337,o4671-w0020
round | ground, Fair youths and beauteous ladies glitter round;,o4671-l16575, Froze by inchantment on the velvet ground,o4671-l16570,/aʊnd/ | /aʊnd/,full,<b>a</b><b>a</b>,pers00337,o4671-w0020
sigh | eye," On crystal pedestals they seem to sigh,",o4671-l16580," Bend the meek knee, and lift the imploring eye. ",o4671-l16585,/aɪ/ | /aɪ/,full,<b>a</b><b>a</b>,pers00337,o4671-w0020
eye | sigh," Bend the meek knee, and lift the imploring eye. ",o4671-l16585," On crystal pedestals they seem to sigh,",o4671-l16580,/aɪ/ | /aɪ/,full,<b>a</b><b>a</b>,pers00337,o4671-w0020
hand | wand,"— And now the Sorceress bares her shrivel'd hand,",o4671-l16590, And circles thrice in air her ebon wand;,o4671-l16595,/ænd/ | /ɒnd/,half-pararhyme,<b>a</b><b>a</b>,pers00337,o4671-w0020
wand | hand, And circles thrice in air her ebon wand;,o4671-l16595,"— And now the Sorceress bares her shrivel'd hand,",o4671-l16590,/ɒnd/ | /ænd/,half-pararhyme,<b>a</b><b>a</b>,pers00337,o4671-w0020
talk | walk," Flush'd with new life descending statues talk,",o4671-l16600, The pliant marble softening as they walk;,o4671-l16605,/ɔːk/ | /ɔːk/,full,<b>a</b><b>a</b>,pers00337,o4671-w0020
walk | talk, The pliant marble softening as they walk;,o4671-l16605," Flush'd with new life descending statues talk,",o4671-l16600,/ɔːk/ | /ɔːk/,full,<b>a</b><b>a</b>,pers00337,o4671-w0020
breathe | beneath," With deeper sobs reviving lovers breathe,",o4671-l16610, Fair bosoms rise and soft hearts pant beneath;,o4671-l16615,/iːð/ | /iːθ/,half-vowelrhyme,<b>a</b><b>a</b>,pers00337,o4671-w0020
beneath | breathe, Fair bosoms rise and soft hearts pant beneath;,o4671-l16615," With deeper sobs reviving lovers breathe,",o4671-l16610,/iːθ/ | /iːð/,half-vowelrhyme,<b>a</b><b>a</b>,pers00337,o4671-w0020
speak | cheek," With warmer lips relenting damsels speak,",o4671-l16620, And kindling blushes tinge the Parian cheek;,o4671-l16625,/iːk/ | /iːk/,full,<b>a</b><b>a</b>,pers00337,o4671-w0020
cheek | speak, And kindling blushes tinge the Parian cheek;,o4671-l16625," With warmer lips relenting damsels speak,",o4671-l16620,/iːk/ | /iːk/,full,<b>a</b><b>a</b>,pers00337,o4671-w0020
sing | wing," To viewless lutes aërial voices sing,",o4671-l16630, And hovering Loves are heard on rustling wing. ,o4671-l16635,/ɪŋ/ | /ɪŋ/,full,<b>a</b><b>a</b>,pers00337,o4671-w0020
wing | sing, And hovering Loves are heard on rustling wing. ,o4671-l16635," To viewless lutes aërial voices sing,",o4671-l16630,/ɪŋ/ | /ɪŋ/,full,<b>a</b><b>a</b>,pers00337,o4671-w0020
seize | freeze,— She waves her wand again! — fresh horrors seize,o4671-l16640," Their stiffening limbs, their vital currents freeze;",o4671-l16645,/iːz/ | /iːz/,full,<b>a</b><b>a</b>,pers00337,o4671-w0020
freeze | seize," Their stiffening limbs, their vital currents freeze;",o4671-l16645,— She waves her wand again! — fresh horrors seize,o4671-l16640,/iːz/ | /iːz/,full,<b>a</b><b>a</b>,pers00337,o4671-w0020
lies | eyes," By each cold nymph her marble lover lies,",o4671-l16650, And iron slumbers seal their glassy eyes. ,o4671-l16655,/aɪz/ | /aɪz/,full,<b>a</b><b>a</b>,pers00337,o4671-w0020
eyes | lies, And iron slumbers seal their glassy eyes. ,o4671-l16655," By each cold nymph her marble lover lies,",o4671-l16650,/aɪz/ | /aɪz/,full,<b>a</b><b>a</b>,pers00337,o4671-w0020
led | dead,So with his dread Caduceus HERMES led,o4671-l16660," From the dark regions of the imprison'd dead,",o4671-l16665,/ed/ | /ed/,full,<b>a</b><b>a</b>,pers00337,o4671-w0020
dead | led," From the dark regions of the imprison'd dead,",o4671-l16665,So with his dread Caduceus HERMES led,o4671-l16660,/ed/ | /ed/,full,<b>a</b><b>a</b>,pers00337,o4671-w0020
train | reign, Or drove in silent shoals the lingering train,o4671-l16670," To Night's dull shore, and PLUTO'S dreary reign. ",o4671-l16675,/eɪn/ | /eɪn/,full,<b>a</b><b>a</b>,pers00337,o4671-w0020
reign | train," To Night's dull shore, and PLUTO'S dreary reign. ",o4671-l16675, Or drove in silent shoals the lingering train,o4671-l16670,/eɪn/ | /eɪn/,full,<b>a</b><b>a</b>,pers00337,o4671-w0020
commands | lands,So with her waving pencil CREWE commands,o4671-l16680," The realms of Taste, and Fancy's fairy lands;",o4671-l16685,/ɑːndz/ | /ændz/,half-pararhyme,<b>a</b><b>a</b>,pers00337,o4671-w0020
lands | commands," The realms of Taste, and Fancy's fairy lands;",o4671-l16685,So with her waving pencil CREWE commands,o4671-l16680,/ændz/ | /ɑːndz/,half-pararhyme,<b>a</b><b>a</b>,pers00337,o4671-w0020
sleep | deep," Calls up with magic voice the shapes, that sleep",o4671-l16690," In earth's dark bosom, or unfathom'd deep;",o4671-l16695,/iːp/ | /iːp/,full,<b>a</b><b>a</b>,pers00337,o4671-w0020
deep | sleep," In earth's dark bosom, or unfathom'd deep;",o4671-l16695," Calls up with magic voice the shapes, that sleep",o4671-l16690,/iːp/ | /iːp/,full,<b>a</b><b>a</b>,pers00337,o4671-w0020
aspire | fire," That shrined in air on viewless wings aspire,",o4671-l16700, Or blazing bathe in elemental fire. ,o4671-l16705,/æə/ | /æə/,full,<b>a</b><b>a</b>,pers00337,o4671-w0020
fire | aspire, Or blazing bathe in elemental fire. ,o4671-l16705," That shrined in air on viewless wings aspire,",o4671-l16700,/æə/ | /æə/,full,<b>a</b><b>a</b>,pers00337,o4671-w0020
moves | loves,"As with nice touch her plaistic hand she moves,",o4671-l16710," Rise the fine forms of Beauties, Graces, Loves;",o4671-l16715,/uːvz/ | /ʌvz/,half-pararhyme,<b>a</b><b>a</b>,pers00337,o4671-w0020
loves | moves," Rise the fine forms of Beauties, Graces, Loves;",o4671-l16715,"As with nice touch her plaistic hand she moves,",o4671-l16710,/ʌvz/ | /uːvz/,half-pararhyme,<b>a</b><b>a</b>,pers00337,o4671-w0020
sigh | eye," Kneel to the fair Inchantress, smile or sigh,",o4671-l16720," And fade or flourish, as she turns her eye. ",o4671-l16725,/aɪ/ | /aɪ/,full,<b>a</b><b>a</b>,pers00337,o4671-w0020
eye | sigh," And fade or flourish, as she turns her eye. ",o4671-l16725," Kneel to the fair Inchantress, smile or sigh,",o4671-l16720,/aɪ/ | /aɪ/,full,<b>a</b><b>a</b>,pers00337,o4671-w0020
dawn | lawn,"Fair CISTA, rival of the rosy dawn,",o4671-l16730," Call'd her light choir, and trod the dewy lawn;",o4671-l16735,/ɔːn/ | /ɔːn/,full,<b>a</b><b>a</b>,pers00337,o4671-w0020
lawn | dawn," Call'd her light choir, and trod the dewy lawn;",o4671-l16735,"Fair CISTA, rival of the rosy dawn,",o4671-l16730,/ɔːn/ | /ɔːn/,full,<b>a</b><b>a</b>,pers00337,o4671-w0020
may | lay," Hail'd with rude melody the new-born May,",o4671-l16740, As cradled yet in April's lap she lay. ,o4671-l16745,/eɪ/ | /eɪ/,full,<b>a</b><b>a</b>,pers00337,o4671-w0020
lay | may, As cradled yet in April's lap she lay. ,o4671-l16745," Hail'd with rude melody the new-born May,",o4671-l16740,/eɪ/ | /eɪ/,full,<b>a</b><b>a</b>,pers00337,o4671-w0020
sky | eye," ""Born in yon blaze of orient sky,",o4671-l16750," ""Unclose thy blue voluptuous eye,",o4671-l16760,/aɪ/ | /aɪ/,full,<b>a</b>b<b>a</b>b,pers00337,o4671-w0020
unfold | gold,"""Sweet MAY! thy radiant form unfold;",o4671-l16755,"""And wave thy shadowy locks of gold,",o4671-l16765,/əʊld/ | /əʊld/,full,a<b>b</b>a<b>b</b>,pers00337,o4671-w0020
eye | sky," ""Unclose thy blue voluptuous eye,",o4671-l16760," ""Born in yon blaze of orient sky,",o4671-l16750,/aɪ/ | /aɪ/,full,<b>a</b>b<b>a</b>b,pers00337,o4671-w0020
gold | unfold,"""And wave thy shadowy locks of gold,",o4671-l16765,"""Sweet MAY! thy radiant form unfold;",o4671-l16755,/əʊld/ | /əʊld/,full,a<b>b</b>a<b>b</b>,pers00337,o4671-w0020
blow | flow," ""For Thee the fragrant zephyrs blow,",o4671-l16770," ""The rills in softer murmurs flow,",o4671-l16780,/əʊ/ | /əʊ/,full,<b>a</b>b<b>a</b>b,pers00337,o4671-w0020
shower | bower,"""For Thee descends the sunny shower;",o4671-l16775,"""And brighter blossoms gem the bower. ",o4671-l16785,/aʊə/ | /aʊə/,full,a<b>b</b>a<b>b</b>,pers00337,o4671-w0020
flow | blow," ""The rills in softer murmurs flow,",o4671-l16780," ""For Thee the fragrant zephyrs blow,",o4671-l16770,/əʊ/ | /əʊ/,full,<b>a</b>b<b>a</b>b,pers00337,o4671-w0020
bower | shower,"""And brighter blossoms gem the bower. ",o4671-l16785,"""For Thee descends the sunny shower;",o4671-l16775,/aʊə/ | /aʊə/,full,a<b>b</b>a<b>b</b>,pers00337,o4671-w0020
wreaths | breathes," ""Light Graces dress'd in flowery wreaths",o4671-l16790," ""And Love his sweet contagion breathes,",o4671-l16800,/iːðz/ | /iːðz/,full,<b>a</b>b<b>a</b>b,pers00337,o4671-w0020
combine | shrine,"""And tiptoe Joys their hands combine;",o4671-l16795,"""And laughing dances round thy shrine. ",o4671-l16805,/ɒmbaɪn/ | /aɪn/,half-vowelrhyme,a<b>b</b>a<b>b</b>,pers00337,o4671-w0020
breathes | wreaths," ""And Love his sweet contagion breathes,",o4671-l16800," ""Light Graces dress'd in flowery wreaths",o4671-l16790,/iːðz/ | /iːðz/,full,<b>a</b>b<b>a</b>b,pers00337,o4671-w0020
shrine | combine,"""And laughing dances round thy shrine. ",o4671-l16805,"""And tiptoe Joys their hands combine;",o4671-l16795,/aɪn/ | /ɒmbaɪn/,half-vowelrhyme,a<b>b</b>a<b>b</b>,pers00337,o4671-w0020
throngs | songs," ""Warm with new life the glittering throngs",o4671-l16810," ""Delighted join their votive songs,",o4671-l16820,/ɒŋz/ | /ɒŋz/,full,<b>a</b>b<b>a</b>b,pers00337,o4671-w0020
wing | spring,"""On quivering fin and rustling wing",o4671-l16815,"""And hail thee, GODDESS OF THE SPRING. "" ",o4671-l16825,/ɪŋ/ | /ɪŋ/,full,a<b>b</b>a<b>b</b>,pers00337,o4671-w0020
songs | throngs," ""Delighted join their votive songs,",o4671-l16820," ""Warm with new life the glittering throngs",o4671-l16810,/ɒŋz/ | /ɒŋz/,full,<b>a</b>b<b>a</b>b,pers00337,o4671-w0020
spring | wing,"""And hail thee, GODDESS OF THE SPRING. "" ",o4671-l16825,"""On quivering fin and rustling wing",o4671-l16815,/ɪŋ/ | /ɪŋ/,full,a<b>b</b>a<b>b</b>,pers00337,o4671-w0020
bed | led,"O'er the green brinks of Severn's oozy bed,",o4671-l16830," In changeful rings, her sprightly troop She led;",o4671-l16835,/ed/ | /ed/,full,<b>a</b><b>a</b>,pers00337,o4671-w0020
led | bed," In changeful rings, her sprightly troop She led;",o4671-l16835,"O'er the green brinks of Severn's oozy bed,",o4671-l16830,/ed/ | /ed/,full,<b>a</b><b>a</b>,pers00337,o4671-w0020
mead | reed," PAN tripp'd before, where Eudness shades the mead,",o4671-l16840, And blew with glowing lip his sevenfold reed;,o4671-l16845,/iːd/ | /iːd/,full,<b>a</b><b>a</b>,pers00337,o4671-w0020
reed | mead, And blew with glowing lip his sevenfold reed;,o4671-l16845," PAN tripp'd before, where Eudness shades the mead,",o4671-l16840,/iːd/ | /iːd/,full,<b>a</b><b>a</b>,pers00337,o4671-w0020
strain | train," Emerging Naiads swell'd the jocund strain,",o4671-l16850, And aped with mimic step the dancing train. —,o4671-l16855,/eɪn/ | /eɪn/,full,<b>a</b><b>a</b>,pers00337,o4671-w0020
train | strain, And aped with mimic step the dancing train. —,o4671-l16855," Emerging Naiads swell'd the jocund strain,",o4671-l16850,/eɪn/ | /eɪn/,full,<b>a</b><b>a</b>,pers00337,o4671-w0020
cried | died," ""I faint, I fall!"" — at noon the Beauty cried,",o4671-l16860," ""Weep o'er my tomb, ye Nymphs!"" — and sunk and died. ",o4671-l16865,/aɪd/ | /aɪd/,full,<b>a</b><b>a</b>,pers00337,o4671-w0020
died | cried," ""Weep o'er my tomb, ye Nymphs!"" — and sunk and died. ",o4671-l16865," ""I faint, I fall!"" — at noon the Beauty cried,",o4671-l16860,/aɪd/ | /aɪd/,full,<b>a</b><b>a</b>,pers00337,o4671-w0020
clime | rhyme,"— Thus, when white Winter o'er the shivering clime",o4671-l16870," Drives the still snow, or showers the silver rime;",o4671-l16875,/aɪm/ | /aɪm/,full,<b>a</b><b>a</b>,pers00337,o4671-w0020
rhyme | clime," Drives the still snow, or showers the silver rime;",o4671-l16875,"— Thus, when white Winter o'er the shivering clime",o4671-l16870,/aɪm/ | /aɪm/,full,<b>a</b><b>a</b>,pers00337,o4671-w0020
rocks | flocks, As the lone shepherd o'er the dazzling rocks,o4671-l16880," Prints his steep step, and guides his vagrant flocks;",o4671-l16885,/ɒks/ | /ɒks/,full,<b>a</b><b>a</b>,pers00337,o4671-w0020
flocks | rocks," Prints his steep step, and guides his vagrant flocks;",o4671-l16885, As the lone shepherd o'er the dazzling rocks,o4671-l16880,/ɒks/ | /ɒks/,full,<b>a</b><b>a</b>,pers00337,o4671-w0020
nice | ice," Views the green holly veil'd in network nice,",o4671-l16890, Her vermil clusters twinkling in the ice;,o4671-l16895,/aɪs/ | /aɪs/,full,<b>a</b><b>a</b>,pers00337,o4671-w0020
ice | nice, Her vermil clusters twinkling in the ice;,o4671-l16895," Views the green holly veil'd in network nice,",o4671-l16890,/aɪs/ | /aɪs/,full,<b>a</b><b>a</b>,pers00337,o4671-w0020
floods | woods," Admires the lucid vales, and slumbering floods,",o4671-l16900," Fantastic cataracts, and crystal woods,",o4671-l16905,/ʌdz/ | /ʊdz/,half-pararhyme,<b>a</b><b>a</b>,pers00337,o4671-w0020
woods | floods," Fantastic cataracts, and crystal woods,",o4671-l16905," Admires the lucid vales, and slumbering floods,",o4671-l16900,/ʊdz/ | /ʌdz/,half-pararhyme,<b>a</b><b>a</b>,pers00337,o4671-w0020
between | scene," Transparent towns, with seas of milk between,",o4671-l16910, And eyes with transport the refulgent scene: —,o4671-l16915,/iːn/ | /iːn/,full,<b>a</b><b>a</b>,pers00337,o4671-w0020
scene | between, And eyes with transport the refulgent scene: —,o4671-l16915," Transparent towns, with seas of milk between,",o4671-l16910,/iːn/ | /iːn/,full,<b>a</b><b>a</b>,pers00337,o4671-w0020
trees | breeze," If breaks the sunshine o'er the spangled trees,",o4671-l16920," Or flits on tepid wing the western breeze,",o4671-l16925,/iːz/ | /iːz/,full,<b>a</b><b>a</b>,pers00337,o4671-w0020
breeze | trees," Or flits on tepid wing the western breeze,",o4671-l16925," If breaks the sunshine o'er the spangled trees,",o4671-l16920,/iːz/ | /iːz/,full,<b>a</b><b>a</b>,pers00337,o4671-w0020
glare | air," In liquid dews descends the transient glare,",o4671-l16930, And all the glittering pageant melts in air. ,o4671-l16935,/eə/ | /eə/,full,<b>a</b><b>a</b>,pers00337,o4671-w0020
air | glare, And all the glittering pageant melts in air. ,o4671-l16935," In liquid dews descends the transient glare,",o4671-l16930,/eə/ | /eə/,full,<b>a</b><b>a</b>,pers00337,o4671-w0020
snow | below,"Where Andes hides his cloud-wreath'd crest in snow,",o4671-l16940, And roots his base on burning sands below;,o4671-l16945,/əʊ/ | /əʊ/,full,<b>a</b><b>a</b>,pers00337,o4671-w0020
below | snow, And roots his base on burning sands below;,o4671-l16945,"Where Andes hides his cloud-wreath'd crest in snow,",o4671-l16940,/əʊ/ | /əʊ/,full,<b>a</b><b>a</b>,pers00337,o4671-w0020
maids | glades," CINCHONA, fairest of Peruvian maids,",o4671-l16950, To Health's bright Goddess in the breezy glades,o4671-l16955,/eɪdz/ | /eɪdz/,full,<b>a</b><b>a</b>,pers00337,o4671-w0020
glades | maids, To Health's bright Goddess in the breezy glades,o4671-l16955," CINCHONA, fairest of Peruvian maids,",o4671-l16950,/eɪdz/ | /eɪdz/,full,<b>a</b><b>a</b>,pers00337,o4671-w0020
reared | preferred," On Quito's temperate plain an altar rear'd,",o4671-l16960," Trill'd the loud hymn, the solemn prayer preferr'd:",o4671-l16965,/ɪəd/ | /ɜːd/,half-pararhyme,<b>a</b><b>a</b>,pers00337,o4671-w0020
preferred | reared," Trill'd the loud hymn, the solemn prayer preferr'd:",o4671-l16965," On Quito's temperate plain an altar rear'd,",o4671-l16960,/ɜːd/ | /ɪəd/,half-pararhyme,<b>a</b><b>a</b>,pers00337,o4671-w0020
flower | bower," Each balmy bud she cull'd, and honey'd flower,",o4671-l16970, And hung with fragrant wreaths the sacred bower;,o4671-l16975,/æə/ | /aʊə/,half-pararhyme,<b>a</b><b>a</b>,pers00337,o4671-w0020
bower | flower, And hung with fragrant wreaths the sacred bower;,o4671-l16975," Each balmy bud she cull'd, and honey'd flower,",o4671-l16970,/aʊə/ | /æə/,half-pararhyme,<b>a</b><b>a</b>,pers00337,o4671-w0020
mine | shrine," Each pearly sea the search'd, and sparkling mine,",o4671-l16980, And piled their treasures on the gorgeous shrine;,o4671-l16985,/aɪn/ | /aɪn/,full,<b>a</b><b>a</b>,pers00337,o4671-w0020
shrine | mine, And piled their treasures on the gorgeous shrine;,o4671-l16985," Each pearly sea the search'd, and sparkling mine,",o4671-l16980,/aɪn/ | /aɪn/,full,<b>a</b><b>a</b>,pers00337,o4671-w0020
raised | blazed," Her suppliant voice for sickening Loxa raised,",o4671-l16990," Sweet breath'd the gale, and bright the censor blazed. ",o4671-l16995,/eɪzd/ | /eɪzd/,full,<b>a</b><b>a</b>,pers00337,o4671-w0020
blazed | raised," Sweet breath'd the gale, and bright the censor blazed. ",o4671-l16995," Her suppliant voice for sickening Loxa raised,",o4671-l16990,/eɪzd/ | /eɪzd/,full,<b>a</b><b>a</b>,pers00337,o4671-w0020
bend | defend,"— ""Divine HYGEIA! on thy votaries bend",o4671-l17000,"""Thy angel-looks, oh, hear us, and defend! ",o4671-l17005,/end/ | /end/,full,<b>a</b><b>a</b>,pers00337,o4671-w0020
defend | bend,"""Thy angel-looks, oh, hear us, and defend! ",o4671-l17005,"— ""Divine HYGEIA! on thy votaries bend",o4671-l17000,/end/ | /end/,full,<b>a</b><b>a</b>,pers00337,o4671-w0020
glare | hair," ""While streaming o'er the night with baleful glare",o4671-l17010,"""The star of Autumn rays his misty hair;",o4671-l17015,/eə/ | /eə/,full,<b>a</b><b>a</b>,pers00337,o4671-w0020
hair | glare,"""The star of Autumn rays his misty hair;",o4671-l17015," ""While streaming o'er the night with baleful glare",o4671-l17010,/eə/ | /eə/,full,<b>a</b><b>a</b>,pers00337,o4671-w0020
springs | wings," ""Fierce from his fens the Giant AGUE springs,",o4671-l17020,"""And wrapp'd in fogs descends on vampire wings;",o4671-l17025,/ɪŋz/ | /ɪŋz/,full,<b>a</b><b>a</b>,pers00337,o4671-w0020
wings | springs,"""And wrapp'd in fogs descends on vampire wings;",o4671-l17025," ""Fierce from his fens the Giant AGUE springs,",o4671-l17020,/ɪŋz/ | /ɪŋz/,full,<b>a</b><b>a</b>,pers00337,o4671-w0020
reels | heels," ""Before, with shuddering limbs cold Tremor reels,",o4671-l17030,"""And Fever's burning nostril dogs his heels;",o4671-l17035,/iːlz/ | /iːlz/,full,<b>a</b><b>a</b>,pers00337,o4671-w0020
