r_word,line_1,line_1_id,line_2,line_2_id,r_sounds,r_degree,r_scheme,authors_id,poem_id
advance | france,Saw Art's fair empire o'er her shores advance:,o5155-l07345,"With gradual steps, and slow, exacter France",o5155-l07340,/ɑːns/ | /ɑːns/,full,<b>a</b><b>a</b>,pers00048,o5155-w0060
knew | drew,"By length of toil a bright perfection knew,",o5155-l07350,"Correctly bold, and just in all she drew.",o5155-l07355,/uː/ | /uː/,full,<b>a</b><b>a</b>,pers00048,o5155-w0060
drew | knew,"Correctly bold, and just in all she drew.",o5155-l07355,"By length of toil a bright perfection knew,",o5155-l07350,/uː/ | /uː/,full,<b>a</b><b>a</b>,pers00048,o5155-w0060
fired | inspired,"Till late Corneille, with Lucan's spirit fir'd,",o5155-l07360,"Breath'd the free strain, as Rome and He inspir'd:",o5155-l07365,/æəd/ | /æəd/,full,<b>a</b><b>a</b>,pers00048,o5155-w0060
inspired | fired,"Breath'd the free strain, as Rome and He inspir'd:",o5155-l07365,"Till late Corneille, with Lucan's spirit fir'd,",o5155-l07360,/æəd/ | /æəd/,full,<b>a</b><b>a</b>,pers00048,o5155-w0060
racine | line,And classic judgment gain'd to sweet Racine,o5155-l07370,The temp'rate strength of Maro's chaster line.,o5155-l07375,/æsiːn/ | /aɪn/,half-pararhyme,<b>a</b><b>a</b>,pers00048,o5155-w0060
line | racine,The temp'rate strength of Maro's chaster line.,o5155-l07375,And classic judgment gain'd to sweet Racine,o5155-l07370,/aɪn/ | /æsiːn/,half-pararhyme,<b>a</b><b>a</b>,pers00048,o5155-w0060
spread | head,"But wilder far the British laurel spread,",o5155-l07380,And wreaths less artful crown our poet's head.,o5155-l07385,/ed/ | /ed/,full,<b>a</b><b>a</b>,pers00048,o5155-w0060
head | spread,And wreaths less artful crown our poet's head.,o5155-l07385,"But wilder far the British laurel spread,",o5155-l07380,/ed/ | /ed/,full,<b>a</b><b>a</b>,pers00048,o5155-w0060
give | live,Yet He alone to ev'ry scene could give,o5155-l07390,"Th' historian's truth, and bid the manners live.",o5155-l07395,/ɪv/ | /ɪv/,full,<b>a</b><b>a</b>,pers00048,o5155-w0060
live | give,"Th' historian's truth, and bid the manners live.",o5155-l07395,Yet He alone to ev'ry scene could give,o5155-l07390,/ɪv/ | /ɪv/,full,<b>a</b><b>a</b>,pers00048,o5155-w0060
surprise | rise,"Wak'd at his call I view, with glad surprize,",o5155-l07400,Majestic forms of mighty monarchs rise.,o5155-l07405,/aɪz/ | /aɪz/,full,<b>a</b><b>a</b>,pers00048,o5155-w0060
rise | surprise,Majestic forms of mighty monarchs rise.,o5155-l07405,"Wak'd at his call I view, with glad surprize,",o5155-l07400,/aɪz/ | /aɪz/,full,<b>a</b><b>a</b>,pers00048,o5155-w0060
alarms | arms,"There Henry's trumpets spread their loud alarms,",o5155-l07410,And laurel'd Conquest waits her hero's arms.,o5155-l07415,/ɑːmz/ | /ɑːmz/,full,<b>a</b><b>a</b>,pers00048,o5155-w0060
arms | alarms,And laurel'd Conquest waits her hero's arms.,o5155-l07415,"There Henry's trumpets spread their loud alarms,",o5155-l07410,/ɑːmz/ | /ɑːmz/,full,<b>a</b><b>a</b>,pers00048,o5155-w0060
sigh | die,"Here gentler Edward claims a pitying sigh,",o5155-l07420,"Scarce born to honours, and so soon to die!",o5155-l07425,/aɪ/ | /aɪ/,full,<b>a</b><b>a</b>,pers00048,o5155-w0060
die | sigh,"Scarce born to honours, and so soon to die!",o5155-l07425,"Here gentler Edward claims a pitying sigh,",o5155-l07420,/aɪ/ | /aɪ/,full,<b>a</b><b>a</b>,pers00048,o5155-w0060
bring | king,"Yet shall thy throne, unhappy infant, bring",o5155-l07430,No beam of comfort to the guilty king:,o5155-l07435,/ɪŋ/ | /ɪŋ/,full,<b>a</b><b>a</b>,pers00048,o5155-w0060
king | bring,No beam of comfort to the guilty king:,o5155-l07435,"Yet shall thy throne, unhappy infant, bring",o5155-l07430,/ɪŋ/ | /ɪŋ/,full,<b>a</b><b>a</b>,pers00048,o5155-w0060
bleed | deed,"The time shall come, when Glo'ster's heart shall bleed",o5155-l07440,"In life's last hours, with horror of the deed:",o5155-l07445,/iːd/ | /iːd/,full,<b>a</b><b>a</b>,pers00048,o5155-w0060
deed | bleed,"In life's last hours, with horror of the deed:",o5155-l07445,"The time shall come, when Glo'ster's heart shall bleed",o5155-l07440,/iːd/ | /iːd/,full,<b>a</b><b>a</b>,pers00048,o5155-w0060
present | tent,When dreary visions shall at last present,o5155-l07450,"Thy vengeful image in the midnight tent,",o5155-l07455,/eznt/ | /ent/,half-vowelrhyme,<b>a</b><b>a</b>,pers00048,o5155-w0060
tent | present,"Thy vengeful image in the midnight tent,",o5155-l07455,When dreary visions shall at last present,o5155-l07450,/ent/ | /eznt/,half-vowelrhyme,<b>a</b><b>a</b>,pers00048,o5155-w0060
bear | spear,"Thy hand unseen the secret death shall bear,",o5155-l07460,"Blunt the weak sword, and break th' oppressive spear.",o5155-l07465,/eə/ | /ɪə/,half-pararhyme,<b>a</b><b>a</b>,pers00048,o5155-w0060
spear | bear,"Blunt the weak sword, and break th' oppressive spear.",o5155-l07465,"Thy hand unseen the secret death shall bear,",o5155-l07460,/ɪə/ | /eə/,half-pararhyme,<b>a</b><b>a</b>,pers00048,o5155-w0060
find | mind,"Where-e'er we turn, by Fancy charm'd, we find",o5155-l07470,Some sweet illusion of the cheated mind.,o5155-l07475,/aɪnd/ | /aɪnd/,full,<b>a</b><b>a</b>,pers00048,o5155-w0060
mind | find,Some sweet illusion of the cheated mind.,o5155-l07475,"Where-e'er we turn, by Fancy charm'd, we find",o5155-l07470,/aɪnd/ | /aɪnd/,full,<b>a</b><b>a</b>,pers00048,o5155-w0060
rove | grove,"Oft, wild of wing, she calls the soul to rove",o5155-l07480,"With humbler nature, in the rural grove;",o5155-l07485,/əʊv/ | /əʊv/,full,<b>a</b><b>a</b>,pers00048,o5155-w0060
grove | rove,"With humbler nature, in the rural grove;",o5155-l07485,"Oft, wild of wing, she calls the soul to rove",o5155-l07480,/əʊv/ | /əʊv/,full,<b>a</b><b>a</b>,pers00048,o5155-w0060
scene | green,"Where swains contented own the quiet scene,",o5155-l07490,And twilight fairies tread the circled green:,o5155-l07495,/iːn/ | /iːn/,full,<b>a</b><b>a</b>,pers00048,o5155-w0060
green | scene,And twilight fairies tread the circled green:,o5155-l07495,"Where swains contented own the quiet scene,",o5155-l07490,/iːn/ | /iːn/,full,<b>a</b><b>a</b>,pers00048,o5155-w0060
smile | isle,"Dress'd by her hand, the Woods and Vallies smile,",o5155-l07500,And Spring diffusive decks th' inchanted isle. ,o5155-l07505,/aɪl/ | /aɪl/,full,<b>a</b><b>a</b>,pers00048,o5155-w0060
isle | smile,And Spring diffusive decks th' inchanted isle. ,o5155-l07505,"Dress'd by her hand, the Woods and Vallies smile,",o5155-l07500,/aɪl/ | /aɪl/,full,<b>a</b><b>a</b>,pers00048,o5155-w0060
blessed | breast,"O more than all in pow'rful genius blest,",o5155-l07510,"Come, take thine empire o'er the willing breast!",o5155-l07515,/est/ | /est/,full,<b>a</b><b>a</b>,pers00048,o5155-w0060
breast | blessed,"Come, take thine empire o'er the willing breast!",o5155-l07515,"O more than all in pow'rful genius blest,",o5155-l07510,/est/ | /est/,full,<b>a</b><b>a</b>,pers00048,o5155-w0060
feel | heal,"Whate'er the wounds this youthful heart shall feel,",o5155-l07520,"Thy songs support me, and thy morals heal!",o5155-l07525,/iːl/ | /iːl/,full,<b>a</b><b>a</b>,pers00048,o5155-w0060
heal | feel,"Thy songs support me, and thy morals heal!",o5155-l07525,"Whate'er the wounds this youthful heart shall feel,",o5155-l07520,/iːl/ | /iːl/,full,<b>a</b><b>a</b>,pers00048,o5155-w0060
raise | lays,"There ev'ry thought the poet's warmth may raise,",o5155-l07530,There native musick dwells in all the lays.,o5155-l07535,/eɪz/ | /eɪz/,full,<b>a</b><b>a</b>,pers00048,o5155-w0060
lays | raise,There native musick dwells in all the lays.,o5155-l07535,"There ev'ry thought the poet's warmth may raise,",o5155-l07530,/eɪz/ | /eɪz/,full,<b>a</b><b>a</b>,pers00048,o5155-w0060
persuade | aid,O might some verse with happiest skill persuade,o5155-l07540,Expressive Picture to adopt thine aid!,o5155-l07545,/eɪd/ | /eɪd/,full,<b>a</b><b>a</b>,pers00048,o5155-w0060
aid | persuade,Expressive Picture to adopt thine aid!,o5155-l07545,O might some verse with happiest skill persuade,o5155-l07540,/eɪd/ | /eɪd/,full,<b>a</b><b>a</b>,pers00048,o5155-w0060
page | age,What wond'rous draughts might rise from ev'ry page!,o5155-l07550,What other Raphaels charm a distant age!,o5155-l07555,/eɪdʒ/ | /eɪdʒ/,full,<b>a</b><b>a</b>,pers00048,o5155-w0060
age | page,What other Raphaels charm a distant age!,o5155-l07555,What wond'rous draughts might rise from ev'ry page!,o5155-l07550,/eɪdʒ/ | /eɪdʒ/,full,<b>a</b><b>a</b>,pers00048,o5155-w0060
design | line,"Methinks ev'n now I view some free design,",o5155-l07560,Where breathing Nature lives in ev'ry line:,o5155-l07565,/aɪn/ | /aɪn/,full,<b>a</b><b>a</b>,pers00048,o5155-w0060
line | design,Where breathing Nature lives in ev'ry line:,o5155-l07565,"Methinks ev'n now I view some free design,",o5155-l07560,/aɪn/ | /aɪn/,full,<b>a</b><b>a</b>,pers00048,o5155-w0060
decay | away,"Chaste and subdu'd the modest lights decay,",o5155-l07570,"Steal into shades, and mildly melt away.",o5155-l07575,/eɪ/ | /eɪ/,full,<b>a</b><b>a</b>,pers00048,o5155-w0060
away | decay,"Steal into shades, and mildly melt away.",o5155-l07575,"Chaste and subdu'd the modest lights decay,",o5155-l07570,/eɪ/ | /eɪ/,full,<b>a</b><b>a</b>,pers00048,o5155-w0060
approved | loved,"— And see, where Anthony in tears approv'd,",o5155-l07580,Guard the pale relicks of the chief he lov'd:,o5155-l07585,/uːvd/ | /ʌvd/,half-pararhyme,<b>a</b><b>a</b>,pers00048,o5155-w0060
loved | approved,Guard the pale relicks of the chief he lov'd:,o5155-l07585,"— And see, where Anthony in tears approv'd,",o5155-l07580,/ʌvd/ | /uːvd/,half-pararhyme,<b>a</b><b>a</b>,pers00048,o5155-w0060
bend | friend,"Over the cold corse the warrior seems to bend,",o5155-l07590,"Deep sunk in grief, and mourns his murder'd friend!",o5155-l07595,/end/ | /end/,full,<b>a</b><b>a</b>,pers00048,o5155-w0060
friend | bend,"Deep sunk in grief, and mourns his murder'd friend!",o5155-l07595,"Over the cold corse the warrior seems to bend,",o5155-l07590,/end/ | /end/,full,<b>a</b><b>a</b>,pers00048,o5155-w0060
around | wound,"Still as they press, he calls on all around,",o5155-l07600,"Lifts the torn robe, and points the bleeding wound.",o5155-l07605,/aʊnd/ | /uːnd/,half-pararhyme,<b>a</b><b>a</b>,pers00048,o5155-w0060
wound | around,"Lifts the torn robe, and points the bleeding wound.",o5155-l07605,"Still as they press, he calls on all around,",o5155-l07600,/uːnd/ | /aʊnd/,half-pararhyme,<b>a</b><b>a</b>,pers00048,o5155-w0060
bear | air,"But who is he, whose brows exalted bear",o5155-l07610,"A wrath impatient, and a fiercer air?",o5155-l07615,/eə/ | /eə/,full,<b>a</b><b>a</b>,pers00048,o5155-w0060
air | bear,"A wrath impatient, and a fiercer air?",o5155-l07615,"But who is he, whose brows exalted bear",o5155-l07610,/eə/ | /eə/,full,<b>a</b><b>a</b>,pers00048,o5155-w0060
feel | steel,"Awake to all that injur'd worth can feel,",o5155-l07620,On his own Rome he turns th' avenging steel.,o5155-l07625,/iːl/ | /iːl/,full,<b>a</b><b>a</b>,pers00048,o5155-w0060
steel | feel,On his own Rome he turns th' avenging steel.,o5155-l07625,"Awake to all that injur'd worth can feel,",o5155-l07620,/iːl/ | /iːl/,full,<b>a</b><b>a</b>,pers00048,o5155-w0060
fall | wall,"Yet shall not War's insatiate fury fall,",o5155-l07630,(So heav'n ordains it) on the destin'd wall.,o5155-l07635,/ɔːl/ | /ɔːl/,full,<b>a</b><b>a</b>,pers00048,o5155-w0060
wall | fall,(So heav'n ordains it) on the destin'd wall.,o5155-l07635,"Yet shall not War's insatiate fury fall,",o5155-l07630,/ɔːl/ | /ɔːl/,full,<b>a</b><b>a</b>,pers00048,o5155-w0060
train | plain,See the fond mother 'midst the plaintive train,o5155-l07640,"Hung on his knees, and prostrate on the plain!",o5155-l07645,/eɪn/ | /eɪn/,full,<b>a</b><b>a</b>,pers00048,o5155-w0060
plain | train,"Hung on his knees, and prostrate on the plain!",o5155-l07645,See the fond mother 'midst the plaintive train,o5155-l07640,/eɪn/ | /eɪn/,full,<b>a</b><b>a</b>,pers00048,o5155-w0060
hide | pride,"Touch'd to the soul, in vain he strives to hide",o5155-l07650,"The son's affection, in the Roman's pride:",o5155-l07655,/aɪd/ | /aɪd/,full,<b>a</b><b>a</b>,pers00048,o5155-w0060
pride | hide,"The son's affection, in the Roman's pride:",o5155-l07655,"Touch'd to the soul, in vain he strives to hide",o5155-l07650,/aɪd/ | /aɪd/,full,<b>a</b><b>a</b>,pers00048,o5155-w0060
rise | eyes,"O'er all the man conflicting passions rise,",o5155-l07660,"Rage grasps the sword, while Pity melts the eyes.",o5155-l07665,/aɪz/ | /aɪz/,full,<b>a</b><b>a</b>,pers00048,o5155-w0060
eyes | rise,"Rage grasps the sword, while Pity melts the eyes.",o5155-l07665,"O'er all the man conflicting passions rise,",o5155-l07660,/aɪz/ | /aɪz/,full,<b>a</b><b>a</b>,pers00048,o5155-w0060
inspires | fires,"Thus, gen'rous Critick, as thy Bard inspires,",o5155-l07670,The sister Arts shall nurse their drooping fires;,o5155-l07675,/æəz/ | /æəz/,full,<b>a</b><b>a</b>,pers00048,o5155-w0060
fires | inspires,The sister Arts shall nurse their drooping fires;,o5155-l07675,"Thus, gen'rous Critick, as thy Bard inspires,",o5155-l07670,/æəz/ | /æəz/,full,<b>a</b><b>a</b>,pers00048,o5155-w0060
bring | string,"Each from his scenes her stores alternate bring,",o5155-l07680,"Blend the fair tints, or wake the vocal string:",o5155-l07685,/ɪŋ/ | /ɪŋ/,full,<b>a</b><b>a</b>,pers00048,o5155-w0060
string | bring,"Blend the fair tints, or wake the vocal string:",o5155-l07685,"Each from his scenes her stores alternate bring,",o5155-l07680,/ɪŋ/ | /ɪŋ/,full,<b>a</b><b>a</b>,pers00048,o5155-w0060
wind | kind,"Those Sibyl-leaves, the sport of ev'ry wind,",o5155-l07690,(For poets ever were a careless kind),o5155-l07695,/ɪnd/ | /aɪnd/,half-pararhyme,<b>a</b><b>a</b>,pers00048,o5155-w0060
kind | wind,(For poets ever were a careless kind),o5155-l07695,"Those Sibyl-leaves, the sport of ev'ry wind,",o5155-l07690,/aɪnd/ | /ɪnd/,half-pararhyme,<b>a</b><b>a</b>,pers00048,o5155-w0060
demand | hand,"By thee dispos'd, no farther toil demand,",o5155-l07700,"But, just to Nature, own thy forming hand.",o5155-l07705,/ɑːnd/ | /ænd/,half-pararhyme,<b>a</b><b>a</b>,pers00048,o5155-w0060
hand | demand,"But, just to Nature, own thy forming hand.",o5155-l07705,"By thee dispos'd, no farther toil demand,",o5155-l07700,/ænd/ | /ɑːnd/,half-pararhyme,<b>a</b><b>a</b>,pers00048,o5155-w0060
unknown | alone,"So spread o'er Greece, th' harmonious whole unknown,",o5155-l07710,Ev'n Homer's numbers charm'd by parts alone.,o5155-l07715,/əʊn/ | /əʊn/,full,<b>a</b><b>a</b>,pers00048,o5155-w0060
alone | unknown,Ev'n Homer's numbers charm'd by parts alone.,o5155-l07715,"So spread o'er Greece, th' harmonious whole unknown,",o5155-l07710,/əʊn/ | /əʊn/,full,<b>a</b><b>a</b>,pers00048,o5155-w0060
more | shore,"Their own Ulysses scarce had wander'd more,",o5155-l07720,By winds and water cast on ev'ry shore:,o5155-l07725,/ɔː/ | /ɔː/,full,<b>a</b><b>a</b>,pers00048,o5155-w0060
shore | more,By winds and water cast on ev'ry shore:,o5155-l07725,"Their own Ulysses scarce had wander'd more,",o5155-l07720,/ɔː/ | /ɔː/,full,<b>a</b><b>a</b>,pers00048,o5155-w0060
joined | mind,"When rais'd by Fate, some former HANMER join'd",o5155-l07730,Each beauteous image of the boundless mind:,o5155-l07735,/ɔɪnd/ | /aɪnd/,half-pararhyme,<b>a</b><b>a</b>,pers00048,o5155-w0060
mind | joined,Each beauteous image of the boundless mind:,o5155-l07735,"When rais'd by Fate, some former HANMER join'd",o5155-l07730,/aɪnd/ | /ɔɪnd/,half-pararhyme,<b>a</b><b>a</b>,pers00048,o5155-w0060
claim | name,"And bade, like thee, his Athens ever claim",o5155-l07740,A fond alliance with the Poet's name.,o5155-l07745,/eɪm/ | /eɪm/,full,<b>a</b><b>a</b>,pers00048,o5155-w0060
name | claim,A fond alliance with the Poet's name.,o5155-l07745,"And bade, like thee, his Athens ever claim",o5155-l07740,/eɪm/ | /eɪm/,full,<b>a</b><b>a</b>,pers00048,o5155-w0060
tomb | bloom,TO fair Fidele's grassy tomb,o5155-l07750,"Each op'ning sweet, of earliest bloom,",o5155-l07760,/uːm/ | /uːm/,full,<b>a</b>b<b>a</b>b,pers00048,o5155-w0070
bring | spring,"Soft maids, and village hinds shall bring",o5155-l07755,And rifle all the breathing Spring.,o5155-l07765,/ɪŋ/ | /ɪŋ/,full,a<b>b</b>a<b>b</b>,pers00048,o5155-w0070
bloom | tomb,"Each op'ning sweet, of earliest bloom,",o5155-l07760,TO fair Fidele's grassy tomb,o5155-l07750,/uːm/ | /uːm/,full,<b>a</b>b<b>a</b>b,pers00048,o5155-w0070
spring | bring,And rifle all the breathing Spring.,o5155-l07765,"Soft maids, and village hinds shall bring",o5155-l07755,/ɪŋ/ | /ɪŋ/,full,a<b>b</b>a<b>b</b>,pers00048,o5155-w0070
appear | here,No wailing ghost shall dare appear,o5155-l07770,"But shepherd lads assemble here,",o5155-l07780,/ɪə/ | /ɪə/,full,<b>a</b>b<b>a</b>b,pers00048,o5155-w0070
grove | love,To vex with shrieks this quiet grove:,o5155-l07775,And melting virgins own their love.,o5155-l07785,/əʊv/ | /ʌv/,half-pararhyme,a<b>b</b>a<b>b</b>,pers00048,o5155-w0070
here | appear,"But shepherd lads assemble here,",o5155-l07780,No wailing ghost shall dare appear,o5155-l07770,/ɪə/ | /ɪə/,full,<b>a</b>b<b>a</b>b,pers00048,o5155-w0070
love | grove,And melting virgins own their love.,o5155-l07785,To vex with shrieks this quiet grove:,o5155-l07775,/ʌv/ | /əʊv/,half-pararhyme,a<b>b</b>a<b>b</b>,pers00048,o5155-w0070
seen | green,"No wither'd witch shall here be seen,",o5155-l07790,"The female fays shall haunt the green,",o5155-l07800,/iːn/ | /iːn/,full,<b>a</b>b<b>a</b>b,pers00048,o5155-w0070
crew | dew,No goblins lead their nightly crew:,o5155-l07795,And dress thy grave with pearly dew!,o5155-l07805,/uː/ | /uː/,full,a<b>b</b>a<b>b</b>,pers00048,o5155-w0070
green | seen,"The female fays shall haunt the green,",o5155-l07800,"No wither'd witch shall here be seen,",o5155-l07790,/iːn/ | /iːn/,full,<b>a</b>b<b>a</b>b,pers00048,o5155-w0070
dew | crew,And dress thy grave with pearly dew!,o5155-l07805,No goblins lead their nightly crew:,o5155-l07795,/uː/ | /uː/,full,a<b>b</b>a<b>b</b>,pers00048,o5155-w0070
hours | flowers,The red-breast oft at ev'ning hours,o5155-l07810,"With hoary moss, and gather'd flow'rs,",o5155-l07820,/æəz/ | /æəz/,full,<b>a</b>b<b>a</b>b,pers00048,o5155-w0070
aid | laid,Shall kindly lend his little aid:,o5155-l07815,To deck the ground where thou art laid.,o5155-l07825,/eɪd/ | /eɪd/,full,a<b>b</b>a<b>b</b>,pers00048,o5155-w0070
flowers | hours,"With hoary moss, and gather'd flow'rs,",o5155-l07820,The red-breast oft at ev'ning hours,o5155-l07810,/æəz/ | /æəz/,full,<b>a</b>b<b>a</b>b,pers00048,o5155-w0070
laid | aid,To deck the ground where thou art laid.,o5155-l07825,Shall kindly lend his little aid:,o5155-l07815,/eɪd/ | /eɪd/,full,a<b>b</b>a<b>b</b>,pers00048,o5155-w0070
rain | plain,"When howling winds, and beating rain,",o5155-l07830,"Or 'midst the chace on ev'ry plain,",o5155-l07840,/eɪn/ | /eɪn/,full,<b>a</b>b<b>a</b>b,pers00048,o5155-w0070
cell | dwell,In tempests shake the sylvan cell:,o5155-l07835,The tender thought on thee shall dwell.,o5155-l07845,/el/ | /el/,full,a<b>b</b>a<b>b</b>,pers00048,o5155-w0070
plain | rain,"Or 'midst the chace on ev'ry plain,",o5155-l07840,"When howling winds, and beating rain,",o5155-l07830,/eɪn/ | /eɪn/,full,<b>a</b>b<b>a</b>b,pers00048,o5155-w0070
dwell | cell,The tender thought on thee shall dwell.,o5155-l07845,In tempests shake the sylvan cell:,o5155-l07835,/el/ | /el/,full,a<b>b</b>a<b>b</b>,pers00048,o5155-w0070
restore | more,"Each lonely scene shall thee restore,",o5155-l07850,"Belov'd, till life could charm no more;",o5155-l07860,/ɔː/ | /ɔː/,full,<b>a</b>b<b>a</b>b,pers00048,o5155-w0070
shed | dead,For thee the tear be duly shed:,o5155-l07855,"And mourn'd, till Pity's self be dead.",o5155-l07865,/ed/ | /ed/,full,a<b>b</b>a<b>b</b>,pers00048,o5155-w0070
more | restore,"Belov'd, till life could charm no more;",o5155-l07860,"Each lonely scene shall thee restore,",o5155-l07850,/ɔː/ | /ɔː/,full,<b>a</b>b<b>a</b>b,pers00048,o5155-w0070
dead | shed,"And mourn'd, till Pity's self be dead.",o5155-l07865,For thee the tear be duly shed:,o5155-l07855,/ed/ | /ed/,full,a<b>b</b>a<b>b</b>,pers00048,o5155-w0070
designed | mind,"FArewell, for clearer ken design'd,",o4985-l03930, The dim-discover'd tracts of mind:,o4985-l03935,/aɪnd/ | /aɪnd/,full,<b>a</b><b>a</b>,pers00048,o4985-w0100
mind | designed, The dim-discover'd tracts of mind:,o4985-l03935,"FArewell, for clearer ken design'd,",o4985-l03930,/aɪnd/ | /aɪnd/,full,<b>a</b><b>a</b>,pers00048,o4985-w0100
retired | required," Truths which, from action's paths retir'd,",o4985-l03940, My silent search in vain requir'd! ,o4985-l03945,/æəd/ | /æəd/,full,<b>a</b><b>a</b>,pers00048,o4985-w0100
required | retired, My silent search in vain requir'd! ,o4985-l03945," Truths which, from action's paths retir'd,",o4985-l03940,/æəd/ | /æəd/,full,<b>a</b><b>a</b>,pers00048,o4985-w0100
explores | shores,"No more my sail that deep explores,",o4985-l03950," No more I search those magic shores,",o4985-l03955,/ɔːz/ | /ɔːz/,full,<b>a</b><b>a</b>,pers00048,o4985-w0100
shores | explores," No more I search those magic shores,",o4985-l03955,"No more my sail that deep explores,",o4985-l03950,/ɔːz/ | /ɔːz/,full,<b>a</b><b>a</b>,pers00048,o4985-w0100
soul | roll," What regions part the world of soul,",o4985-l03960," Or whence thy streams, Opinion, roll:",o4985-l03965,/əʊl/ | /əʊl/,full,<b>a</b><b>a</b>,pers00048,o4985-w0100
roll | soul," Or whence thy streams, Opinion, roll:",o4985-l03965," What regions part the world of soul,",o4985-l03960,/əʊl/ | /əʊl/,full,<b>a</b><b>a</b>,pers00048,o4985-w0100
field | shield," If e'er I round such fairy field,",o4985-l03970," Some Power impart the spear and shield,",o4985-l03975,/iːld/ | /iːld/,full,<b>a</b><b>a</b>,pers00048,o4985-w0100
shield | field," Some Power impart the spear and shield,",o4985-l03975," If e'er I round such fairy field,",o4985-l03970,/iːld/ | /iːld/,full,<b>a</b><b>a</b>,pers00048,o4985-w0100
fly | die," At which the wizzard Passions fly,",o4985-l03980, By which the giant Follies die! ,o4985-l03985,/aɪ/ | /aɪ/,full,<b>a</b><b>a</b>,pers00048,o4985-w0100
die | fly, By which the giant Follies die! ,o4985-l03985," At which the wizzard Passions fly,",o4985-l03980,/aɪ/ | /aɪ/,full,<b>a</b><b>a</b>,pers00048,o4985-w0100
seen | green,"Farewell the porch, whose roof is seen,",o4985-l03990, Arch'd with th' enlivening olive's green:,o4985-l03995,/iːn/ | /iːn/,full,<b>a</b><b>a</b>,pers00048,o4985-w0100
green | seen, Arch'd with th' enlivening olive's green:,o4985-l03995,"Farewell the porch, whose roof is seen,",o4985-l03990,/iːn/ | /iːn/,full,<b>a</b><b>a</b>,pers00048,o4985-w0100
vest | dressed," Where Science prank'd in tissu'd vest,",o4985-l04000," By Reason, Pride, and Fancy drest,",o4985-l04005,/est/ | /est/,full,<b>a</b><b>a</b>,pers00048,o4985-w0100
dressed | vest," By Reason, Pride, and Fancy drest,",o4985-l04005," Where Science prank'd in tissu'd vest,",o4985-l04000,/est/ | /est/,full,<b>a</b><b>a</b>,pers00048,o4985-w0100
arrayed | shade," Comes like a bride, so trim array'd,",o4985-l04010, To wed with Doubt in Plato's shade! ,o4985-l04015,/eɪd/ | /eɪd/,full,<b>a</b><b>a</b>,pers00048,o4985-w0100
shade | arrayed, To wed with Doubt in Plato's shade! ,o4985-l04015," Comes like a bride, so trim array'd,",o4985-l04010,/eɪd/ | /eɪd/,full,<b>a</b><b>a</b>,pers00048,o4985-w0100
sight | invite,"Youth of the quick uncheated sight,",o4985-l04020," Thy walks, Observance, more invite! ",o4985-l04025,/aɪt/ | /ɪnvaɪt/,half-vowelrhyme,<b>a</b><b>a</b>,pers00048,o4985-w0100
invite | sight," Thy walks, Observance, more invite! ",o4985-l04025,"Youth of the quick uncheated sight,",o4985-l04020,/ɪnvaɪt/ | /aɪt/,half-vowelrhyme,<b>a</b><b>a</b>,pers00048,o4985-w0100
range | change,"O thou, who lov'st that ampler range,",o4985-l04030," Where life's wide prospects round thee change,",o4985-l04035,/eɪndʒ/ | /eɪndʒ/,full,<b>a</b><b>a</b>,pers00048,o4985-w0100
change | range," Where life's wide prospects round thee change,",o4985-l04035,"O thou, who lov'st that ampler range,",o4985-l04030,/eɪndʒ/ | /eɪndʒ/,full,<b>a</b><b>a</b>,pers00048,o4985-w0100
allied | aside," And, with her mingling sons allied,",o4985-l04040, Throw'st the prattling page aside:,o4985-l04045,/aɪd/ | /aɪd/,full,<b>a</b><b>a</b>,pers00048,o4985-w0100
aside | allied, Throw'st the prattling page aside:,o4985-l04045," And, with her mingling sons allied,",o4985-l04040,/aɪd/ | /aɪd/,full,<b>a</b><b>a</b>,pers00048,o4985-w0100
impart | heart," To me in converse sweet impart,",o4985-l04050," To read in man the native heart,",o4985-l04055,/ɑːt/ | /ɑːt/,full,<b>a</b><b>a</b>,pers00048,o4985-w0100
heart | impart," To read in man the native heart,",o4985-l04055," To me in converse sweet impart,",o4985-l04050,/ɑːt/ | /ɑːt/,full,<b>a</b><b>a</b>,pers00048,o4985-w0100
found | around," To learn, where Science sure is found,",o4985-l04060, From Nature as she lives around:,o4985-l04065,/aʊnd/ | /aʊnd/,full,<b>a</b><b>a</b>,pers00048,o4985-w0100
around | found, From Nature as she lives around:,o4985-l04065," To learn, where Science sure is found,",o4985-l04060,/aʊnd/ | /aʊnd/,full,<b>a</b><b>a</b>,pers00048,o4985-w0100
true | view," And gazing oft her mirror true,",o4985-l04070, By turns each shifting image view! ,o4985-l04075,/uː/ | /uː/,full,<b>a</b><b>a</b>,pers00048,o4985-w0100
view | true, By turns each shifting image view! ,o4985-l04075," And gazing oft her mirror true,",o4985-l04070,/uː/ | /uː/,full,<b>a</b><b>a</b>,pers00048,o4985-w0100
lore | before,Till meddling Art's officious lore,o4985-l04080," Reverse the lessons taught before,",o4985-l04085,/ɔː/ | /ɔː/,full,<b>a</b><b>a</b>,pers00048,o4985-w0100
