r_word,line_1,line_1_id,line_2,line_2_id,r_sounds,r_degree,r_scheme,authors_id,poem_id
died | wide," Till Aaron, fighting, fell and died,",pcr18-l25885,"'T was false — we wander'd far and wide,",pcr18-l25875,/aɪd/ | /aɪd/,full,<b>a</b>b<b>a</b>b,pers00275,pcr18-w0080
again | fen, And I became a wife again. ,pcr18-l25890," Through town and country, field and fen,",pcr18-l25880,/en/ | /en/,full,a<b>b</b>a<b>b</b>,pers00275,pcr18-w0080
sold | gold,I then was young: — my husband sold,pcr18-l25895," He gave me oft for sinful gold,",pcr18-l25905,/əʊld/ | /əʊld/,full,<b>a</b>b<b>a</b>bab,pers00275,pcr18-w0080
sold | behold,I then was young: — my husband sold,pcr18-l25895," Behold me, Heaven! my pains behold,",pcr18-l25915,/əʊld/ | /əʊld/,full,<b>a</b>bab<b>a</b>b,pers00275,pcr18-w0080
price | vice," My fancied charms for wicked price,",pcr18-l25900," The slave, but not the friend of vice: —",pcr18-l25910,/aɪs/ | /aɪsi/,half-vowelrhyme,a<b>b</b>a<b>b</b>ab,pers00275,pcr18-w0080
price | suffice," My fancied charms for wicked price,",pcr18-l25900, And let them for my sins suffice! ,pcr18-l25920,/aɪs/ | /aɪs/,full,a<b>b</b>aba<b>b</b>,pers00275,pcr18-w0080
gold | sold," He gave me oft for sinful gold,",pcr18-l25905,I then was young: — my husband sold,pcr18-l25895,/əʊld/ | /əʊld/,full,<b>a</b>b<b>a</b>bab,pers00275,pcr18-w0080
gold | behold," He gave me oft for sinful gold,",pcr18-l25905," Behold me, Heaven! my pains behold,",pcr18-l25915,/əʊld/ | /əʊld/,full,ab<b>a</b>b<b>a</b>b,pers00275,pcr18-w0080
vice | price," The slave, but not the friend of vice: —",pcr18-l25910," My fancied charms for wicked price,",pcr18-l25900,/aɪsi/ | /aɪs/,half-vowelrhyme,a<b>b</b>a<b>b</b>ab,pers00275,pcr18-w0080
vice | suffice," The slave, but not the friend of vice: —",pcr18-l25910, And let them for my sins suffice! ,pcr18-l25920,/aɪsi/ | /aɪs/,half-vowelrhyme,aba<b>b</b>a<b>b</b>,pers00275,pcr18-w0080
behold | sold," Behold me, Heaven! my pains behold,",pcr18-l25915,I then was young: — my husband sold,pcr18-l25895,/əʊld/ | /əʊld/,full,<b>a</b>bab<b>a</b>b,pers00275,pcr18-w0080
behold | gold," Behold me, Heaven! my pains behold,",pcr18-l25915," He gave me oft for sinful gold,",pcr18-l25905,/əʊld/ | /əʊld/,full,ab<b>a</b>b<b>a</b>b,pers00275,pcr18-w0080
suffice | price, And let them for my sins suffice! ,pcr18-l25920," My fancied charms for wicked price,",pcr18-l25900,/aɪs/ | /aɪs/,full,a<b>b</b>aba<b>b</b>,pers00275,pcr18-w0080
suffice | vice, And let them for my sins suffice! ,pcr18-l25920," The slave, but not the friend of vice: —",pcr18-l25910,/aɪs/ | /aɪsi/,half-vowelrhyme,aba<b>b</b>a<b>b</b>,pers00275,pcr18-w0080
gain | pain,"The wretch who lent me thus for gain,",pcr18-l25925, Then came disease; and brought me pain: —,pcr18-l25935,/eɪn/ | /eɪn/,full,<b>a</b>b<b>a</b>bab,pers00275,pcr18-w0080
gain | vain,"The wretch who lent me thus for gain,",pcr18-l25925,"For though I grieve, my grief is vain,",pcr18-l25945,/eɪn/ | /eɪn/,full,<b>a</b>bab<b>a</b>b,pers00275,pcr18-w0080
fled | dead, Despised me when my youth was fled;,pcr18-l25930," Come, Death, and bear me to the dead! ",pcr18-l25940,/ed/ | /ed/,full,a<b>b</b>a<b>b</b>ab,pers00275,pcr18-w0080
fled | shed, Despised me when my youth was fled;,pcr18-l25930, And fruitless all the tears I shed. ,pcr18-l25950,/ed/ | /ed/,full,a<b>b</b>aba<b>b</b>,pers00275,pcr18-w0080
pain | gain, Then came disease; and brought me pain: —,pcr18-l25935,"The wretch who lent me thus for gain,",pcr18-l25925,/eɪn/ | /eɪn/,full,<b>a</b>b<b>a</b>bab,pers00275,pcr18-w0080
pain | vain, Then came disease; and brought me pain: —,pcr18-l25935,"For though I grieve, my grief is vain,",pcr18-l25945,/eɪn/ | /eɪn/,full,ab<b>a</b>b<b>a</b>b,pers00275,pcr18-w0080
dead | fled," Come, Death, and bear me to the dead! ",pcr18-l25940, Despised me when my youth was fled;,pcr18-l25930,/ed/ | /ed/,full,a<b>b</b>a<b>b</b>ab,pers00275,pcr18-w0080
dead | shed," Come, Death, and bear me to the dead! ",pcr18-l25940, And fruitless all the tears I shed. ,pcr18-l25950,/ed/ | /ed/,full,aba<b>b</b>a<b>b</b>,pers00275,pcr18-w0080
vain | gain,"For though I grieve, my grief is vain,",pcr18-l25945,"The wretch who lent me thus for gain,",pcr18-l25925,/eɪn/ | /eɪn/,full,<b>a</b>bab<b>a</b>b,pers00275,pcr18-w0080
vain | pain,"For though I grieve, my grief is vain,",pcr18-l25945, Then came disease; and brought me pain: —,pcr18-l25935,/eɪn/ | /eɪn/,full,ab<b>a</b>b<b>a</b>b,pers00275,pcr18-w0080
shed | fled, And fruitless all the tears I shed. ,pcr18-l25950, Despised me when my youth was fled;,pcr18-l25930,/ed/ | /ed/,full,a<b>b</b>aba<b>b</b>,pers00275,pcr18-w0080
shed | dead, And fruitless all the tears I shed. ,pcr18-l25950," Come, Death, and bear me to the dead! ",pcr18-l25940,/ed/ | /ed/,full,aba<b>b</b>a<b>b</b>,pers00275,pcr18-w0080
trained | pained,"True, I was not to virtue train'd,",pcr18-l25955," By each offence my heart was pain'd,",pcr18-l25965,/eɪnd/ | /eɪnd/,full,<b>a</b>b<b>a</b>bab,pers00275,pcr18-w0080
trained | disdained,"True, I was not to virtue train'd,",pcr18-l25955," My better thoughts my life disdain'd,",pcr18-l25975,/eɪnd/ | /eɪnd/,full,<b>a</b>bab<b>a</b>b,pers00275,pcr18-w0080
ill | still, Yet well I knew my deeds were ill;,pcr18-l25960," I wept, but I offended still;",pcr18-l25970,/ɪl/ | /ɪl/,full,a<b>b</b>a<b>b</b>ab,pers00275,pcr18-w0080
ill | will, Yet well I knew my deeds were ill;,pcr18-l25960, But yet the viler led my will. ,pcr18-l25980,/ɪl/ | /ɪl/,full,a<b>b</b>aba<b>b</b>,pers00275,pcr18-w0080
pained | trained," By each offence my heart was pain'd,",pcr18-l25965,"True, I was not to virtue train'd,",pcr18-l25955,/eɪnd/ | /eɪnd/,full,<b>a</b>b<b>a</b>bab,pers00275,pcr18-w0080
pained | disdained," By each offence my heart was pain'd,",pcr18-l25965," My better thoughts my life disdain'd,",pcr18-l25975,/eɪnd/ | /eɪnd/,full,ab<b>a</b>b<b>a</b>b,pers00275,pcr18-w0080
still | ill," I wept, but I offended still;",pcr18-l25970, Yet well I knew my deeds were ill;,pcr18-l25960,/ɪl/ | /ɪl/,full,a<b>b</b>a<b>b</b>ab,pers00275,pcr18-w0080
still | will," I wept, but I offended still;",pcr18-l25970, But yet the viler led my will. ,pcr18-l25980,/ɪl/ | /ɪl/,full,aba<b>b</b>a<b>b</b>,pers00275,pcr18-w0080
disdained | trained," My better thoughts my life disdain'd,",pcr18-l25975,"True, I was not to virtue train'd,",pcr18-l25955,/eɪnd/ | /eɪnd/,full,<b>a</b>bab<b>a</b>b,pers00275,pcr18-w0080
disdained | pained," My better thoughts my life disdain'd,",pcr18-l25975," By each offence my heart was pain'd,",pcr18-l25965,/eɪnd/ | /eɪnd/,full,ab<b>a</b>b<b>a</b>b,pers00275,pcr18-w0080
will | ill, But yet the viler led my will. ,pcr18-l25980, Yet well I knew my deeds were ill;,pcr18-l25960,/ɪl/ | /ɪl/,full,a<b>b</b>aba<b>b</b>,pers00275,pcr18-w0080
will | still, But yet the viler led my will. ,pcr18-l25980," I wept, but I offended still;",pcr18-l25970,/ɪl/ | /ɪl/,full,aba<b>b</b>a<b>b</b>,pers00275,pcr18-w0080
more | poor,"My husband died, and now no more",pcr18-l25985," A widow'd vagrant, vile and poor,",pcr18-l25995,/ɔː/ | /ɔː/,full,<b>a</b>b<b>a</b>b,pers00275,pcr18-w0080
hand | command," My smile was sought, or ask'd my hand,",pcr18-l25990, Beneath a vagrant's vile command. ,pcr18-l26000,/ænd/ | /ɑːnd/,half-pararhyme,a<b>b</b>a<b>b</b>,pers00275,pcr18-w0080
poor | more," A widow'd vagrant, vile and poor,",pcr18-l25995,"My husband died, and now no more",pcr18-l25985,/ɔː/ | /ɔː/,full,<b>a</b>b<b>a</b>b,pers00275,pcr18-w0080
command | hand, Beneath a vagrant's vile command. ,pcr18-l26000," My smile was sought, or ask'd my hand,",pcr18-l25990,/ɑːnd/ | /ænd/,half-pararhyme,a<b>b</b>a<b>b</b>,pers00275,pcr18-w0080
round | found,"Ceaseless I roved the country round,",pcr18-l26005," And long a poor subsistence found,",pcr18-l26015,/aʊnd/ | /aʊnd/,full,<b>a</b>b<b>a</b>b,pers00275,pcr18-w0080
arts | hearts," To win my bread by fraudful arts,",pcr18-l26010, By spreading nets for simple hearts. ,pcr18-l26020,/ɑːts/ | /ɑːts/,full,a<b>b</b>a<b>b</b>,pers00275,pcr18-w0080
found | round," And long a poor subsistence found,",pcr18-l26015,"Ceaseless I roved the country round,",pcr18-l26005,/aʊnd/ | /aʊnd/,full,<b>a</b>b<b>a</b>b,pers00275,pcr18-w0080
hearts | arts, By spreading nets for simple hearts. ,pcr18-l26020," To win my bread by fraudful arts,",pcr18-l26010,/ɑːts/ | /ɑːts/,full,a<b>b</b>a<b>b</b>,pers00275,pcr18-w0080
despised | prised,"Though poor, and abject, and despised,",pcr18-l26025," I gave the young the love they prized,",pcr18-l26035,/aɪzd/ | /aɪzd/,full,<b>a</b>b<b>a</b>bab,pers00275,pcr18-w0080
despised | devised,"Though poor, and abject, and despised,",pcr18-l26025," Schemes for the doubtful I devised,",pcr18-l26045,/aɪzd/ | /aɪzd/,full,<b>a</b>bab<b>a</b>b,pers00275,pcr18-w0080
told | old, Their fortunes to the crowd I told;,pcr18-l26030, And promised wealth to bless the old;,pcr18-l26040,/əʊld/ | /əʊld/,full,a<b>b</b>a<b>b</b>ab,pers00275,pcr18-w0080
told | sold, Their fortunes to the crowd I told;,pcr18-l26030, And charms for the forsaken sold. ,pcr18-l26050,/əʊld/ | /əʊld/,full,a<b>b</b>aba<b>b</b>,pers00275,pcr18-w0080
prised | despised," I gave the young the love they prized,",pcr18-l26035,"Though poor, and abject, and despised,",pcr18-l26025,/aɪzd/ | /aɪzd/,full,<b>a</b>b<b>a</b>bab,pers00275,pcr18-w0080
prised | devised," I gave the young the love they prized,",pcr18-l26035," Schemes for the doubtful I devised,",pcr18-l26045,/aɪzd/ | /aɪzd/,full,ab<b>a</b>b<b>a</b>b,pers00275,pcr18-w0080
old | told, And promised wealth to bless the old;,pcr18-l26040, Their fortunes to the crowd I told;,pcr18-l26030,/əʊld/ | /əʊld/,full,a<b>b</b>a<b>b</b>ab,pers00275,pcr18-w0080
old | sold, And promised wealth to bless the old;,pcr18-l26040, And charms for the forsaken sold. ,pcr18-l26050,/əʊld/ | /əʊld/,full,aba<b>b</b>a<b>b</b>,pers00275,pcr18-w0080
devised | despised," Schemes for the doubtful I devised,",pcr18-l26045,"Though poor, and abject, and despised,",pcr18-l26025,/aɪzd/ | /aɪzd/,full,<b>a</b>bab<b>a</b>b,pers00275,pcr18-w0080
devised | prised," Schemes for the doubtful I devised,",pcr18-l26045," I gave the young the love they prized,",pcr18-l26035,/aɪzd/ | /aɪzd/,full,ab<b>a</b>b<b>a</b>b,pers00275,pcr18-w0080
sold | told, And charms for the forsaken sold. ,pcr18-l26050, Their fortunes to the crowd I told;,pcr18-l26030,/əʊld/ | /əʊld/,full,a<b>b</b>aba<b>b</b>,pers00275,pcr18-w0080
sold | old, And charms for the forsaken sold. ,pcr18-l26050, And promised wealth to bless the old;,pcr18-l26040,/əʊld/ | /əʊld/,full,aba<b>b</b>a<b>b</b>,pers00275,pcr18-w0080
confined | mind,At length for arts like these confined,pcr18-l26055," I soon perceived a kindred mind,",pcr18-l26065,/aɪnd/ | /aɪnd/,full,<b>a</b>b<b>a</b>b,pers00275,pcr18-w0080
crew | knew," In prison with a lawless crew,",pcr18-l26060, And there my long-lost daughter knew;,pcr18-l26070,/uː/ | /uː/,full,a<b>b</b>a<b>b</b>,pers00275,pcr18-w0080
mind | confined," I soon perceived a kindred mind,",pcr18-l26065,At length for arts like these confined,pcr18-l26055,/aɪnd/ | /aɪnd/,full,<b>a</b>b<b>a</b>b,pers00275,pcr18-w0080
knew | crew, And there my long-lost daughter knew;,pcr18-l26070," In prison with a lawless crew,",pcr18-l26060,/uː/ | /uː/,full,a<b>b</b>a<b>b</b>,pers00275,pcr18-w0080
gave | brave,"His father's child, whom Aaron gave",pcr18-l26075," The miseries of the world to brave,",pcr18-l26085,/eɪv/ | /eɪv/,full,<b>a</b>b<b>a</b>b,pers00275,pcr18-w0080
clan | man," To wander with a distant clan,",pcr18-l26080, And be the slave of vice and man. ,pcr18-l26090,/æn/ | /æn/,full,a<b>b</b>a<b>b</b>,pers00275,pcr18-w0080
brave | gave," The miseries of the world to brave,",pcr18-l26085,"His father's child, whom Aaron gave",pcr18-l26075,/eɪv/ | /eɪv/,full,<b>a</b>b<b>a</b>b,pers00275,pcr18-w0080
man | clan, And be the slave of vice and man. ,pcr18-l26090," To wander with a distant clan,",pcr18-l26080,/æn/ | /æn/,full,a<b>b</b>a<b>b</b>,pers00275,pcr18-w0080
pain | main,"She knew my name — we met in pain,",pcr18-l26095,"She sail'd a convict o'er the main,",pcr18-l26105,/eɪn/ | /eɪn/,full,<b>a</b>b<b>a</b>b,pers00275,pcr18-w0080
express | distress, Our parting pangs can I express? ,pcr18-l26100, And left an heir to her distress. ,pcr18-l26110,/es/ | /es/,full,a<b>b</b>a<b>b</b>,pers00275,pcr18-w0080
main | pain,"She sail'd a convict o'er the main,",pcr18-l26105,"She knew my name — we met in pain,",pcr18-l26095,/eɪn/ | /eɪn/,full,<b>a</b>b<b>a</b>b,pers00275,pcr18-w0080
distress | express, And left an heir to her distress. ,pcr18-l26110, Our parting pangs can I express? ,pcr18-l26100,/es/ | /es/,full,a<b>b</b>a<b>b</b>,pers00275,pcr18-w0080
pain | disdain,"This is that heir to shame and pain,",pcr18-l26115, A world of trouble and disdain:,pcr18-l26125,/eɪn/ | /eɪn/,full,<b>a</b>b<b>a</b>bab,pers00275,pcr18-w0080
pain | vain,"This is that heir to shame and pain,",pcr18-l26115," Or stretch her feeble hands in vain,",pcr18-l26135,/eɪn/ | /eɪn/,full,<b>a</b>bab<b>a</b>b,pers00275,pcr18-w0080
descry | die, For whom I only could descry,pcr18-l26120," Yet, could I bear to see her die,",pcr18-l26130,/aɪ/ | /aɪ/,full,a<b>b</b>a<b>b</b>ab,pers00275,pcr18-w0080
descry | supply, For whom I only could descry,pcr18-l26120," And, weeping, beg of me supply? ",pcr18-l26140,/aɪ/ | /ʌpli/,half-pararhyme,a<b>b</b>aba<b>b</b>,pers00275,pcr18-w0080
disdain | pain, A world of trouble and disdain:,pcr18-l26125,"This is that heir to shame and pain,",pcr18-l26115,/eɪn/ | /eɪn/,full,<b>a</b>b<b>a</b>bab,pers00275,pcr18-w0080
disdain | vain, A world of trouble and disdain:,pcr18-l26125," Or stretch her feeble hands in vain,",pcr18-l26135,/eɪn/ | /eɪn/,full,ab<b>a</b>b<b>a</b>b,pers00275,pcr18-w0080
die | descry," Yet, could I bear to see her die,",pcr18-l26130, For whom I only could descry,pcr18-l26120,/aɪ/ | /aɪ/,full,a<b>b</b>a<b>b</b>ab,pers00275,pcr18-w0080
die | supply," Yet, could I bear to see her die,",pcr18-l26130," And, weeping, beg of me supply? ",pcr18-l26140,/aɪ/ | /ʌpli/,half-pararhyme,aba<b>b</b>a<b>b</b>,pers00275,pcr18-w0080
vain | pain," Or stretch her feeble hands in vain,",pcr18-l26135,"This is that heir to shame and pain,",pcr18-l26115,/eɪn/ | /eɪn/,full,<b>a</b>bab<b>a</b>b,pers00275,pcr18-w0080
vain | disdain," Or stretch her feeble hands in vain,",pcr18-l26135, A world of trouble and disdain:,pcr18-l26125,/eɪn/ | /eɪn/,full,ab<b>a</b>b<b>a</b>b,pers00275,pcr18-w0080
supply | descry," And, weeping, beg of me supply? ",pcr18-l26140, For whom I only could descry,pcr18-l26120,/ʌpli/ | /aɪ/,half-pararhyme,a<b>b</b>aba<b>b</b>,pers00275,pcr18-w0080
supply | die," And, weeping, beg of me supply? ",pcr18-l26140," Yet, could I bear to see her die,",pcr18-l26130,/ʌpli/ | /aɪ/,half-pararhyme,aba<b>b</b>a<b>b</b>,pers00275,pcr18-w0080
knew | crew,No! though the fate thy mother knew,pcr18-l26145," Have wander'd all a lawless crew,",pcr18-l26155,/uː/ | /uː/,full,<b>a</b>b<b>a</b>b,pers00275,pcr18-w0080
race | place, Was shameful! shameful though thy race,pcr18-l26150, Outcasts despised in every place;,pcr18-l26160,/eɪs/ | /eɪs/,full,a<b>b</b>a<b>b</b>,pers00275,pcr18-w0080
crew | knew," Have wander'd all a lawless crew,",pcr18-l26155,No! though the fate thy mother knew,pcr18-l26145,/uː/ | /uː/,full,<b>a</b>b<b>a</b>b,pers00275,pcr18-w0080
place | race, Outcasts despised in every place;,pcr18-l26160, Was shameful! shameful though thy race,pcr18-l26150,/eɪs/ | /eɪs/,full,a<b>b</b>a<b>b</b>,pers00275,pcr18-w0080
tide | purified,"Yet as the dark and muddy tide,",pcr18-l26165," Becomes more pure and purified,",pcr18-l26175,/aɪd/ | /ʊərɪfaɪd/,half-pararhyme,<b>a</b>b<b>a</b>b,pers00275,pcr18-w0080
source | course," When far from its polluted source,",pcr18-l26170, Flows in a clear and happy course;,pcr18-l26180,/ɔːs/ | /ɔːs/,full,a<b>b</b>a<b>b</b>,pers00275,pcr18-w0080
purified | tide," Becomes more pure and purified,",pcr18-l26175,"Yet as the dark and muddy tide,",pcr18-l26165,/ʊərɪfaɪd/ | /aɪd/,half-pararhyme,<b>a</b>b<b>a</b>b,pers00275,pcr18-w0080
course | source, Flows in a clear and happy course;,pcr18-l26180," When far from its polluted source,",pcr18-l26170,/ɔːs/ | /ɔːs/,full,a<b>b</b>a<b>b</b>,pers00275,pcr18-w0080
end | extend,"In thee, dear infant! so may end",pcr18-l26185,"And thy pure course will then extend,",pcr18-l26195,/end/ | /end/,full,<b>a</b>b<b>a</b>b,pers00275,pcr18-w0080
cease | peace," Our shame, in thee our sorrows cease! ",pcr18-l26190," In floods of joy, o'er vales of peace. ",pcr18-l26200,/iːs/ | /iːs/,full,a<b>b</b>a<b>b</b>,pers00275,pcr18-w0080
extend | end,"And thy pure course will then extend,",pcr18-l26195,"In thee, dear infant! so may end",pcr18-l26185,/end/ | /end/,full,<b>a</b>b<b>a</b>b,pers00275,pcr18-w0080
peace | cease," In floods of joy, o'er vales of peace. ",pcr18-l26200," Our shame, in thee our sorrows cease! ",pcr18-l26190,/iːs/ | /iːs/,full,a<b>b</b>a<b>b</b>,pers00275,pcr18-w0080
spare | share,"Oh! by the God who loves to spare,",pcr18-l26205," Let this loved child your mercy share,",pcr18-l26215,/eə/ | /eə/,full,<b>a</b>b<b>a</b>b,pers00275,pcr18-w0080
crave | grave, Deny me not the boon I crave;,pcr18-l26210, And let me find a peaceful grave;,pcr18-l26220,/eɪv/ | /ɑːv/,half-pararhyme,a<b>b</b>a<b>b</b>,pers00275,pcr18-w0080
share | spare," Let this loved child your mercy share,",pcr18-l26215,"Oh! by the God who loves to spare,",pcr18-l26205,/eə/ | /eə/,full,<b>a</b>b<b>a</b>b,pers00275,pcr18-w0080
grave | crave, And let me find a peaceful grave;,pcr18-l26220, Deny me not the boon I crave;,pcr18-l26210,/ɑːv/ | /eɪv/,half-pararhyme,a<b>b</b>a<b>b</b>,pers00275,pcr18-w0080
care | prepare,"Make her yet spotless soul your care,",pcr18-l26225," Her for a better fate prepare,",pcr18-l26235,/eə/ | /eə/,full,<b>a</b>b<b>a</b>b,pers00275,pcr18-w0080
have | save, And let my sins their portion have;,pcr18-l26230, And punish whom 'twere sin to save! ,pcr18-l26240,/æv/ | /eɪv/,half-pararhyme,a<b>b</b>a<b>b</b>,pers00275,pcr18-w0080
prepare | care," Her for a better fate prepare,",pcr18-l26235,"Make her yet spotless soul your care,",pcr18-l26225,/eə/ | /eə/,full,<b>a</b>b<b>a</b>b,pers00275,pcr18-w0080
save | have, And punish whom 'twere sin to save! ,pcr18-l26240, And let my sins their portion have;,pcr18-l26230,/eɪv/ | /æv/,half-pararhyme,a<b>b</b>a<b>b</b>,pers00275,pcr18-w0080
thought | brought,"Recall the word, renounce the thought,",pcr18-l26245,"There is to all a pardon brought,",pcr18-l26255,/ɔːt/ | /ɔːt/,full,<b>a</b>b<b>a</b>bab,pers00275,pcr18-w0080
thought | sought,"Recall the word, renounce the thought,",pcr18-l26245," 'T is full when found, 't is found if sought,",pcr18-l26265,/ɔːt/ | /ɔːt/,full,<b>a</b>bab<b>a</b>b,pers00275,pcr18-w0080
knee | free, Command thy heart and bend thy knee. ,pcr18-l26250," A ransom rich, assured and free;",pcr18-l26260,/iː/ | /iː/,full,a<b>b</b>a<b>b</b>ab,pers00275,pcr18-w0080
knee | thee, Command thy heart and bend thy knee. ,pcr18-l26250," Oh! seek it, till 'tis seal'd to thee. ",pcr18-l26270,/iː/ | /iː/,full,a<b>b</b>aba<b>b</b>,pers00275,pcr18-w0080
brought | thought,"There is to all a pardon brought,",pcr18-l26255,"Recall the word, renounce the thought,",pcr18-l26245,/ɔːt/ | /ɔːt/,full,<b>a</b>b<b>a</b>bab,pers00275,pcr18-w0080
brought | sought,"There is to all a pardon brought,",pcr18-l26255," 'T is full when found, 't is found if sought,",pcr18-l26265,/ɔːt/ | /ɔːt/,full,ab<b>a</b>b<b>a</b>b,pers00275,pcr18-w0080
free | knee," A ransom rich, assured and free;",pcr18-l26260, Command thy heart and bend thy knee. ,pcr18-l26250,/iː/ | /iː/,full,a<b>b</b>a<b>b</b>ab,pers00275,pcr18-w0080
free | thee," A ransom rich, assured and free;",pcr18-l26260," Oh! seek it, till 'tis seal'd to thee. ",pcr18-l26270,/iː/ | /iː/,full,aba<b>b</b>a<b>b</b>,pers00275,pcr18-w0080
sought | thought," 'T is full when found, 't is found if sought,",pcr18-l26265,"Recall the word, renounce the thought,",pcr18-l26245,/ɔːt/ | /ɔːt/,full,<b>a</b>bab<b>a</b>b,pers00275,pcr18-w0080
sought | brought," 'T is full when found, 't is found if sought,",pcr18-l26265,"There is to all a pardon brought,",pcr18-l26255,/ɔːt/ | /ɔːt/,full,ab<b>a</b>b<b>a</b>b,pers00275,pcr18-w0080
thee | knee," Oh! seek it, till 'tis seal'd to thee. ",pcr18-l26270, Command thy heart and bend thy knee. ,pcr18-l26250,/iː/ | /iː/,full,a<b>b</b>aba<b>b</b>,pers00275,pcr18-w0080
thee | free," Oh! seek it, till 'tis seal'd to thee. ",pcr18-l26270," A ransom rich, assured and free;",pcr18-l26260,/iː/ | /iː/,full,aba<b>b</b>a<b>b</b>,pers00275,pcr18-w0080
know | flow,But how my pardon shall I know? ,pcr18-l26275," By tears for sin that freely flow,",pcr18-l26285,/əʊ/ | /əʊ/,full,<b>a</b>b<b>a</b>b,pers00275,pcr18-w0080
sent | spent,"By feeling dread that 't is not sent,",pcr18-l26280," By grief, that all thy tears are spent,",pcr18-l26290,/ent/ | /ent/,full,a<b>b</b>a<b>b</b>,pers00275,pcr18-w0080
flow | know," By tears for sin that freely flow,",pcr18-l26285,But how my pardon shall I know? ,pcr18-l26275,/əʊ/ | /əʊ/,full,<b>a</b>b<b>a</b>b,pers00275,pcr18-w0080
spent | sent," By grief, that all thy tears are spent,",pcr18-l26290,"By feeling dread that 't is not sent,",pcr18-l26280,/ent/ | /ent/,full,a<b>b</b>a<b>b</b>,pers00275,pcr18-w0080
owe | show,"By thoughts on that great debt we owe,",pcr18-l26295," By suffering what thou canst not show,",pcr18-l26305,/əʊ/ | /əʊ/,full,<b>a</b>b<b>a</b>bab,pers00275,pcr18-w0080
owe | glow,"By thoughts on that great debt we owe,",pcr18-l26295," Till thou canst feel thy bosom glow,",pcr18-l26315,/əʊ/ | /əʊ/,full,<b>a</b>bab<b>a</b>b,pers00275,pcr18-w0080
lent | rent," With all the mercy God has lent,",pcr18-l26300," Yet showing how thine heart is rent,",pcr18-l26310,/ent/ | /ent/,full,a<b>b</b>a<b>b</b>ab,pers00275,pcr18-w0080
lent | repent," With all the mercy God has lent,",pcr18-l26300," And say, ""My Saviour, I repent!"" ",pcr18-l26320,/ent/ | /ent/,full,a<b>b</b>aba<b>b</b>,pers00275,pcr18-w0080
show | owe," By suffering what thou canst not show,",pcr18-l26305,"By thoughts on that great debt we owe,",pcr18-l26295,/əʊ/ | /əʊ/,full,<b>a</b>b<b>a</b>bab,pers00275,pcr18-w0080
show | glow," By suffering what thou canst not show,",pcr18-l26305," Till thou canst feel thy bosom glow,",pcr18-l26315,/əʊ/ | /əʊ/,full,ab<b>a</b>b<b>a</b>b,pers00275,pcr18-w0080
rent | lent," Yet showing how thine heart is rent,",pcr18-l26310," With all the mercy God has lent,",pcr18-l26300,/ent/ | /ent/,full,a<b>b</b>a<b>b</b>ab,pers00275,pcr18-w0080
rent | repent," Yet showing how thine heart is rent,",pcr18-l26310," And say, ""My Saviour, I repent!"" ",pcr18-l26320,/ent/ | /ent/,full,aba<b>b</b>a<b>b</b>,pers00275,pcr18-w0080
glow | owe," Till thou canst feel thy bosom glow,",pcr18-l26315,"By thoughts on that great debt we owe,",pcr18-l26295,/əʊ/ | /əʊ/,full,<b>a</b>bab<b>a</b>b,pers00275,pcr18-w0080
glow | show," Till thou canst feel thy bosom glow,",pcr18-l26315," By suffering what thou canst not show,",pcr18-l26305,/əʊ/ | /əʊ/,full,ab<b>a</b>b<b>a</b>b,pers00275,pcr18-w0080
repent | lent," And say, ""My Saviour, I repent!"" ",pcr18-l26320," With all the mercy God has lent,",pcr18-l26300,/ent/ | /ent/,full,a<b>b</b>aba<b>b</b>,pers00275,pcr18-w0080
repent | rent," And say, ""My Saviour, I repent!"" ",pcr18-l26320," Yet showing how thine heart is rent,",pcr18-l26310,/ent/ | /ent/,full,aba<b>b</b>a<b>b</b>,pers00275,pcr18-w0080
oppressed | rest,"When the sad soul, by care and grief oppress'd,",pcr18-l00035," Looks round the world, but looks in vain for rest;",pcr18-l00040,/est/ | /est/,full,<b>a</b><b>a</b>,pers00275,pcr18-w0010
rest | oppressed," Looks round the world, but looks in vain for rest;",pcr18-l00040,"When the sad soul, by care and grief oppress'd,",pcr18-l00035,/est/ | /est/,full,<b>a</b><b>a</b>,pers00275,pcr18-w0010
view | too," When every object that appears in view,",pcr18-l00045, Partakes her gloom and seems dejected too;,pcr18-l00050,/uː/ | /uː/,full,<b>a</b><b>a</b>,pers00275,pcr18-w0010
too | view, Partakes her gloom and seems dejected too;,pcr18-l00050," When every object that appears in view,",pcr18-l00045,/uː/ | /uː/,full,<b>a</b><b>a</b>,pers00275,pcr18-w0010
retire | expire, Where shall affliction from itself retire? ,pcr18-l00055,Where fade away and placidly expire? ,pcr18-l00060,/æə/ | /æə/,full,<b>a</b><b>a</b>,pers00275,pcr18-w0010
expire | retire,Where fade away and placidly expire? ,pcr18-l00060, Where shall affliction from itself retire? ,pcr18-l00055,/æə/ | /æə/,full,<b>a</b><b>a</b>,pers00275,pcr18-w0010
vain | plain,Alas! we fly to silent scenes in vain;,pcr18-l00065, Care blasts the honours of the flow'ry plain:,pcr18-l00070,/eɪn/ | /eɪn/,full,<b>a</b><b>a</b>,pers00275,pcr18-w0010
plain | vain, Care blasts the honours of the flow'ry plain:,pcr18-l00070,Alas! we fly to silent scenes in vain;,pcr18-l00065,/eɪn/ | /eɪn/,full,<b>a</b><b>a</b>,pers00275,pcr18-w0010
beam | stream," Care veils in clouds the sun's meridian beam,",pcr18-l00075," Sighs through the grove, and murmurs in the stream;",pcr18-l00080,/iːm/ | /iːm/,full,<b>a</b><b>a</b>,pers00275,pcr18-w0010
stream | beam," Sighs through the grove, and murmurs in the stream;",pcr18-l00080," Care veils in clouds the sun's meridian beam,",pcr18-l00075,/iːm/ | /iːm/,full,<b>a</b><b>a</b>,pers00275,pcr18-w0010
despair | air," For when the soul is labouring in despair,",pcr18-l00085, In vain the body breathes a purer air:,pcr18-l00090,/eə/ | /eə/,full,<b>a</b><b>a</b>,pers00275,pcr18-w0010
