r_word,line_1,line_1_id,line_2,line_2_id,r_sounds,r_degree,r_scheme,authors_id,poem_id
neck | cheque," Bend to your golden yoke his willing neck,",o4671-l10750," Charm with soft tones, with tender touches check,",o4671-l10745,/ek/ | /ek/,full,<b>a</b><b>a</b>,pers00337,o4671-w0010
restrain | rein," With silver curb his yielding teeth restrain,",o4671-l10755, And give to KIRWAN's hand the silken rein. ,o4671-l10760,/eɪn/ | /eɪn/,full,<b>a</b><b>a</b>,pers00337,o4671-w0010
rein | restrain, And give to KIRWAN's hand the silken rein. ,o4671-l10760," With silver curb his yielding teeth restrain,",o4671-l10755,/eɪn/ | /eɪn/,full,<b>a</b><b>a</b>,pers00337,o4671-w0010
between | serene,"— Pleased shall the Sage, the dragon-wings between,",o4671-l10765," Bend o'er discordant climes his eye serene,",o4671-l10770,/iːn/ | /iːn/,full,<b>a</b><b>a</b>,pers00337,o4671-w0010
serene | between," Bend o'er discordant climes his eye serene,",o4671-l10770,"— Pleased shall the Sage, the dragon-wings between,",o4671-l10765,/iːn/ | /iːn/,full,<b>a</b><b>a</b>,pers00337,o4671-w0010
vales | gales," With Lapland breezes cool Arabian vales,",o4671-l10775," And call to Hindostan antarctic gales,",o4671-l10780,/eɪlz/ | /eɪlz/,full,<b>a</b><b>a</b>,pers00337,o4671-w0010
gales | vales," And call to Hindostan antarctic gales,",o4671-l10780," With Lapland breezes cool Arabian vales,",o4671-l10775,/eɪlz/ | /eɪlz/,full,<b>a</b><b>a</b>,pers00337,o4671-w0010
brows | snows," Adorn with wreathed ears Kampschatca's brows,",o4671-l10785," And scatter roses on Zealandic snows,",o4671-l10790,/aʊz/ | /əʊz/,half-pararhyme,<b>a</b><b>a</b>,pers00337,o4671-w0010
snows | brows," And scatter roses on Zealandic snows,",o4671-l10790," Adorn with wreathed ears Kampschatca's brows,",o4671-l10785,/əʊz/ | /aʊz/,half-pararhyme,<b>a</b><b>a</b>,pers00337,o4671-w0010
share | air," Earth's wondering Zones the genial seasons share,",o4671-l10795," And nations hail him ""MONARCH OF THE AIR."" ",o4671-l10800,/eə/ | /eə/,full,<b>a</b><b>a</b>,pers00337,o4671-w0010
air | share," And nations hail him ""MONARCH OF THE AIR."" ",o4671-l10800," Earth's wondering Zones the genial seasons share,",o4671-l10795,/eə/ | /eə/,full,<b>a</b><b>a</b>,pers00337,o4671-w0010
wing | spring,"X. 1.  ""SYLPHS! as you hover on ethereal wing,",o4671-l10805, Brood the green children of parturient Spring! —,o4671-l10810,/ɪŋ/ | /ɪŋ/,full,<b>a</b><b>a</b>,pers00337,o4671-w0010
spring | wing, Brood the green children of parturient Spring! —,o4671-l10810,"X. 1.  ""SYLPHS! as you hover on ethereal wing,",o4671-l10805,/ɪŋ/ | /ɪŋ/,full,<b>a</b><b>a</b>,pers00337,o4671-w0010
rest | nest," Where in their bursting cells my Embryons rest,",o4671-l10815, I charge you guard the vegetable nest;,o4671-l10820,/est/ | /est/,full,<b>a</b><b>a</b>,pers00337,o4671-w0010
nest | rest, I charge you guard the vegetable nest;,o4671-l10820," Where in their bursting cells my Embryons rest,",o4671-l10815,/est/ | /est/,full,<b>a</b><b>a</b>,pers00337,o4671-w0010
swell | shell," Count with nice eye the myriad SEEDS, that swell",o4671-l10825," Each vaulted womb of husk, or pod, or shell;",o4671-l10830,/el/ | /el/,full,<b>a</b><b>a</b>,pers00337,o4671-w0010
shell | swell," Each vaulted womb of husk, or pod, or shell;",o4671-l10830," Count with nice eye the myriad SEEDS, that swell",o4671-l10825,/el/ | /el/,full,<b>a</b><b>a</b>,pers00337,o4671-w0010
hair | air," Feed with sweet juices, clothe with downy hair,",o4671-l10835," Or hang, inshrined, their little orbs in air. ",o4671-l10840,/eə/ | /eə/,full,<b>a</b><b>a</b>,pers00337,o4671-w0010
air | hair," Or hang, inshrined, their little orbs in air. ",o4671-l10840," Feed with sweet juices, clothe with downy hair,",o4671-l10835,/eə/ | /eə/,full,<b>a</b><b>a</b>,pers00337,o4671-w0010
sight | night," ""So, late descry'd by HERSCHEL's piercing sight,",o4671-l10845, Hang the bright squadrons of the twinkling Night;,o4671-l10850,/aɪt/ | /aɪt/,full,<b>a</b><b>a</b>,pers00337,o4671-w0010
night | sight, Hang the bright squadrons of the twinkling Night;,o4671-l10850," ""So, late descry'd by HERSCHEL's piercing sight,",o4671-l10845,/aɪt/ | /aɪt/,full,<b>a</b><b>a</b>,pers00337,o4671-w0010
zone | throne," Ten thousand marshall'd stars, a silver zone,",o4671-l10855, Effuse their blended lustres round her throne;,o4671-l10860,/əʊn/ | /əʊn/,full,<b>a</b><b>a</b>,pers00337,o4671-w0010
throne | zone, Effuse their blended lustres round her throne;,o4671-l10860," Ten thousand marshall'd stars, a silver zone,",o4671-l10855,/əʊn/ | /əʊn/,full,<b>a</b><b>a</b>,pers00337,o4671-w0010
conspire | fire," Suns call to suns, in lucid clouds conspire,",o4671-l10865, And light exterior skies with golden fire;,o4671-l10870,/aɪə/ | /æə/,half-pararhyme,<b>a</b><b>a</b>,pers00337,o4671-w0010
fire | conspire, And light exterior skies with golden fire;,o4671-l10870," Suns call to suns, in lucid clouds conspire,",o4671-l10865,/æə/ | /aɪə/,half-pararhyme,<b>a</b><b>a</b>,pers00337,o4671-w0010
sphere | year," Resistless rolls the illimitable sphere,",o4671-l10875, And one great circle forms the unmeasured year. ,o4671-l10880,/ɪə/ | /ɪə/,full,<b>a</b><b>a</b>,pers00337,o4671-w0010
year | sphere, And one great circle forms the unmeasured year. ,o4671-l10880," Resistless rolls the illimitable sphere,",o4671-l10875,/ɪə/ | /ɪə/,full,<b>a</b><b>a</b>,pers00337,o4671-w0010
prime | time,"— Roll on, YE STARS! exult in youthful prime,",o4671-l10885, Mark with bright curves the printless steps of Time;,o4671-l10890,/aɪm/ | /aɪm/,full,<b>a</b><b>a</b>,pers00337,o4671-w0010
time | prime, Mark with bright curves the printless steps of Time;,o4671-l10890,"— Roll on, YE STARS! exult in youthful prime,",o4671-l10885,/aɪm/ | /aɪm/,full,<b>a</b><b>a</b>,pers00337,o4671-w0010
approach | encroach," Near and more near your beamy cars approach,",o4671-l10895, And lessening orbs on lessening orbs encroach; —,o4671-l10900,/əʊtʃ/ | /əʊtʃ/,full,<b>a</b><b>a</b>,pers00337,o4671-w0010
encroach | approach, And lessening orbs on lessening orbs encroach; —,o4671-l10900," Near and more near your beamy cars approach,",o4671-l10895,/əʊtʃ/ | /əʊtʃ/,full,<b>a</b><b>a</b>,pers00337,o4671-w0010
yield | field," Flowers of the sky! ye too to age must yield,",o4671-l10905, Frail as your silken sisters of the field! ,o4671-l10910,/iːld/ | /iːld/,full,<b>a</b><b>a</b>,pers00337,o4671-w0010
field | yield, Frail as your silken sisters of the field! ,o4671-l10910," Flowers of the sky! ye too to age must yield,",o4671-l10905,/iːld/ | /iːld/,full,<b>a</b><b>a</b>,pers00337,o4671-w0010
rush | crush,"Star after star from Heaven's high arch shall rush,",o4671-l10915," Suns sink on suns, and systems systems crush,",o4671-l10920,/ʌʃ/ | /ʌʃ/,full,<b>a</b><b>a</b>,pers00337,o4671-w0010
crush | rush," Suns sink on suns, and systems systems crush,",o4671-l10920,"Star after star from Heaven's high arch shall rush,",o4671-l10915,/ʌʃ/ | /ʌʃ/,full,<b>a</b><b>a</b>,pers00337,o4671-w0010
fall | all," Headlong, extinct, to one dark centre fall,",o4671-l10925, And Death and Night and Chaos mingle all!,o4671-l10930,/ɔːl/ | /ɔːl/,full,<b>a</b><b>a</b>,pers00337,o4671-w0010
all | fall, And Death and Night and Chaos mingle all!,o4671-l10930," Headlong, extinct, to one dark centre fall,",o4671-l10925,/ɔːl/ | /ɔːl/,full,<b>a</b><b>a</b>,pers00337,o4671-w0010
storm | form," — Till o'er the wreck, emerging from the storm,",o4671-l10935," Immortal NATURE lifts her changeful form,",o4671-l10940,/ɔːm/ | /ɔːm/,full,<b>a</b><b>a</b>,pers00337,o4671-w0010
form | storm," Immortal NATURE lifts her changeful form,",o4671-l10940," — Till o'er the wreck, emerging from the storm,",o4671-l10935,/ɔːm/ | /ɔːm/,full,<b>a</b><b>a</b>,pers00337,o4671-w0010
flame | same," Mounts from her funeral pyre on wings of flame,",o4671-l10945," And soars and shines, another and the same. ",o4671-l10950,/eɪm/ | /eɪm/,full,<b>a</b><b>a</b>,pers00337,o4671-w0010
same | flame," And soars and shines, another and the same. ",o4671-l10950," Mounts from her funeral pyre on wings of flame,",o4671-l10945,/eɪm/ | /eɪm/,full,<b>a</b><b>a</b>,pers00337,o4671-w0010
rind | wind,"2.  ""Lo! on each SEED within its slender rind",o4671-l10955, Life's golden threads in endless circles wind;,o4671-l10960,/aɪnd/ | /ɪnd/,half-pararhyme,<b>a</b><b>a</b>,pers00337,o4671-w0010
wind | rind, Life's golden threads in endless circles wind;,o4671-l10960,"2.  ""Lo! on each SEED within its slender rind",o4671-l10955,/ɪnd/ | /aɪnd/,half-pararhyme,<b>a</b><b>a</b>,pers00337,o4671-w0010
rolled | unfold, Maze within maze the lucid webs are roll'd,o4671-l10965," And, as they burst, the living flame unfold. ",o4671-l10970,/əʊld/ | /əʊld/,full,<b>a</b><b>a</b>,pers00337,o4671-w0010
unfold | rolled," And, as they burst, the living flame unfold. ",o4671-l10970, Maze within maze the lucid webs are roll'd,o4671-l10965,/əʊld/ | /əʊld/,full,<b>a</b><b>a</b>,pers00337,o4671-w0010
contains | veins,"The pulpy acorn, ere it swells, contains",o4671-l10975, The Oak's vast branches in its milky veins;,o4671-l10980,/eɪnz/ | /eɪnz/,full,<b>a</b><b>a</b>,pers00337,o4671-w0010
veins | contains, The Oak's vast branches in its milky veins;,o4671-l10980,"The pulpy acorn, ere it swells, contains",o4671-l10975,/eɪnz/ | /eɪnz/,full,<b>a</b><b>a</b>,pers00337,o4671-w0010
fibre-line | design," Each ravel'd bud, fine film, and fibre-line",o4671-l10985, Traced with nice pencil on the small design. ,o4671-l10990,/aɪn/ | /aɪn/,full,<b>a</b><b>a</b>,pers00337,o4671-w0010
design | fibre-line, Traced with nice pencil on the small design. ,o4671-l10990," Each ravel'd bud, fine film, and fibre-line",o4671-l10985,/aɪn/ | /aɪn/,full,<b>a</b><b>a</b>,pers00337,o4671-w0010
compressed | breast,"The young Narcissus, in it's bulb compress'd,",o4671-l10995, Cradles a second nestling on its breast;,o4671-l11000,/est/ | /est/,full,<b>a</b><b>a</b>,pers00337,o4671-w0010
breast | compressed, Cradles a second nestling on its breast;,o4671-l11000,"The young Narcissus, in it's bulb compress'd,",o4671-l10995,/est/ | /est/,full,<b>a</b><b>a</b>,pers00337,o4671-w0010
lies | floret-eyes," In whose fine arms a younger embryon lies,",o4671-l11005," Folds its thin leaves, and shuts its floret-eyes;",o4671-l11010,/aɪz/ | /aɪz/,full,<b>a</b><b>a</b>,pers00337,o4671-w0010
floret-eyes | lies," Folds its thin leaves, and shuts its floret-eyes;",o4671-l11010," In whose fine arms a younger embryon lies,",o4671-l11005,/aɪz/ | /aɪz/,full,<b>a</b><b>a</b>,pers00337,o4671-w0010
dwell | shell," Grain within grain successive harvests dwell,",o4671-l11015, And boundless forests slumber in a shell. ,o4671-l11020,/el/ | /el/,full,<b>a</b><b>a</b>,pers00337,o4671-w0010
shell | dwell, And boundless forests slumber in a shell. ,o4671-l11020," Grain within grain successive harvests dwell,",o4671-l11015,/el/ | /el/,full,<b>a</b><b>a</b>,pers00337,o4671-w0010
towers | bowers,"— So yon grey precipice, and ivy'd towers,",o4671-l11025," Long winding meads, and intermingled bowers,",o4671-l11030,/aʊəz/ | /aʊəz/,full,<b>a</b><b>a</b>,pers00337,o4671-w0010
bowers | towers," Long winding meads, and intermingled bowers,",o4671-l11030,"— So yon grey precipice, and ivy'd towers,",o4671-l11025,/aʊəz/ | /aʊəz/,full,<b>a</b><b>a</b>,pers00337,o4671-w0010
bow | below," Green files of poplars, o'er the lake that bow,",o4671-l11035," And glimmering wheel, which rolls and foams below,",o4671-l11040,/əʊ/ | /əʊ/,full,<b>a</b><b>a</b>,pers00337,o4671-w0010
below | bow," And glimmering wheel, which rolls and foams below,",o4671-l11040," Green files of poplars, o'er the lake that bow,",o4671-l11035,/əʊ/ | /əʊ/,full,<b>a</b><b>a</b>,pers00337,o4671-w0010
lie | eye, In one bright point with nice distinction lie,o4671-l11045, Plan'd on the moving tablet of the eye. ,o4671-l11050,/aɪ/ | /aɪ/,full,<b>a</b><b>a</b>,pers00337,o4671-w0010
eye | lie, Plan'd on the moving tablet of the eye. ,o4671-l11050, In one bright point with nice distinction lie,o4671-l11045,/aɪ/ | /aɪ/,full,<b>a</b><b>a</b>,pers00337,o4671-w0010
extend | bend,"— So, fold on fold, Earth's wavy plains extend,",o4671-l11055," And, sphere in sphere, its hidden strata bend; —",o4671-l11060,/end/ | /end/,full,<b>a</b><b>a</b>,pers00337,o4671-w0010
bend | extend," And, sphere in sphere, its hidden strata bend; —",o4671-l11060,"— So, fold on fold, Earth's wavy plains extend,",o4671-l11055,/end/ | /end/,full,<b>a</b><b>a</b>,pers00337,o4671-w0010
expands | lands, Incumbent Spring her beamy plumes expands,o4671-l11065," O'er restless oceans, and impatient lands,",o4671-l11070,/ændz/ | /ændz/,full,<b>a</b><b>a</b>,pers00337,o4671-w0010
lands | expands," O'er restless oceans, and impatient lands,",o4671-l11070, Incumbent Spring her beamy plumes expands,o4671-l11065,/ændz/ | /ændz/,full,<b>a</b><b>a</b>,pers00337,o4671-w0010
ball | all," With genial lustres warms the mighty ball,",o4671-l11075," And the GREAT SEED evolves, disclosing ALL;",o4671-l11080,/ɔːl/ | /ɔːl/,full,<b>a</b><b>a</b>,pers00337,o4671-w0010
all | ball," And the GREAT SEED evolves, disclosing ALL;",o4671-l11080," With genial lustres warms the mighty ball,",o4671-l11075,/ɔːl/ | /ɔːl/,full,<b>a</b><b>a</b>,pers00337,o4671-w0010
poles | rolls," LIFE buds or breathes from Indus to the Poles,",o4671-l11085," And the vast surface kindles, as it rolls! ",o4671-l11090,/əʊlz/ | /əʊlz/,full,<b>a</b><b>a</b>,pers00337,o4671-w0010
rolls | poles," And the vast surface kindles, as it rolls! ",o4671-l11090," LIFE buds or breathes from Indus to the Poles,",o4671-l11085,/əʊlz/ | /əʊlz/,full,<b>a</b><b>a</b>,pers00337,o4671-w0010
land | bland,"3.  ""Come, YE SOFT SYLPHS! who sport on Latian land,",o4671-l11095," Come, sweet-lip'd Zephyr, and Favonius bland! ",o4671-l11100,/ænd/ | /ænd/,full,<b>a</b><b>a</b>,pers00337,o4671-w0010
bland | land," Come, sweet-lip'd Zephyr, and Favonius bland! ",o4671-l11100,"3.  ""Come, YE SOFT SYLPHS! who sport on Latian land,",o4671-l11095,/ænd/ | /ænd/,full,<b>a</b><b>a</b>,pers00337,o4671-w0010
shoot | root,"Teach the fine SEED, instinct with life, to shoot",o4671-l11105, On Earth's cold bosom its descending root;,o4671-l11110,/uːt/ | /uːt/,full,<b>a</b><b>a</b>,pers00337,o4671-w0010
root | shoot, On Earth's cold bosom its descending root;,o4671-l11110,"Teach the fine SEED, instinct with life, to shoot",o4671-l11105,/uːt/ | /uːt/,full,<b>a</b><b>a</b>,pers00337,o4671-w0010
stem | gem," With Pith elastic stretch its rising stem,",o4671-l11115," Part the twin Lobes, expand the throbbing Gem;",o4671-l11120,/em/ | /em/,full,<b>a</b><b>a</b>,pers00337,o4671-w0010
gem | stem," Part the twin Lobes, expand the throbbing Gem;",o4671-l11120," With Pith elastic stretch its rising stem,",o4671-l11115,/em/ | /em/,full,<b>a</b><b>a</b>,pers00337,o4671-w0010
plume | bloom," Clasp in your airy arms the aspiring Plume,",o4671-l11125," Fan with your balmy breath its kindling bloom,",o4671-l11130,/uːm/ | /uːm/,full,<b>a</b><b>a</b>,pers00337,o4671-w0010
bloom | plume," Fan with your balmy breath its kindling bloom,",o4671-l11130," Clasp in your airy arms the aspiring Plume,",o4671-l11125,/uːm/ | /uːm/,full,<b>a</b><b>a</b>,pers00337,o4671-w0010
unfold | gold," Each widening scale and bursting film unfold,",o4671-l11135," Swell the green cup, and tint the flower with gold;",o4671-l11140,/əʊld/ | /əʊld/,full,<b>a</b><b>a</b>,pers00337,o4671-w0010
gold | unfold," Swell the green cup, and tint the flower with gold;",o4671-l11140," Each widening scale and bursting film unfold,",o4671-l11135,/əʊld/ | /əʊld/,full,<b>a</b><b>a</b>,pers00337,o4671-w0010
ascends | bends," While in bright veins the silvery Sap ascends,",o4671-l11145, And refluent blood in milky eddies bends;,o4671-l11150,/endz/ | /endz/,full,<b>a</b><b>a</b>,pers00337,o4671-w0010
bends | ascends, And refluent blood in milky eddies bends;,o4671-l11150," While in bright veins the silvery Sap ascends,",o4671-l11145,/endz/ | /endz/,full,<b>a</b><b>a</b>,pers00337,o4671-w0010
play | day," While, spread in air, the leaves respiring play,",o4671-l11155, Or drink the golden quintessence of day. ,o4671-l11160,/eɪ/ | /eɪ/,full,<b>a</b><b>a</b>,pers00337,o4671-w0010
day | play, Or drink the golden quintessence of day. ,o4671-l11160," While, spread in air, the leaves respiring play,",o4671-l11155,/eɪ/ | /eɪ/,full,<b>a</b><b>a</b>,pers00337,o4671-w0010
isle | nile,— So from his shell on Delta's shower-less isle,o4671-l11165, Bursts into life the Monster of the Nile;,o4671-l11170,/aɪl/ | /aɪl/,full,<b>a</b><b>a</b>,pers00337,o4671-w0010
nile | isle, Bursts into life the Monster of the Nile;,o4671-l11170,— So from his shell on Delta's shower-less isle,o4671-l11165,/aɪl/ | /aɪl/,full,<b>a</b><b>a</b>,pers00337,o4671-w0010
cobweb-threads | spreads, First in translucent lymph with cobweb-threads,o4671-l11175," The Brain's fine floating tissue swells, and spreads;",o4671-l11180,/edz/ | /edz/,full,<b>a</b><b>a</b>,pers00337,o4671-w0010
spreads | cobweb-threads," The Brain's fine floating tissue swells, and spreads;",o4671-l11180, First in translucent lymph with cobweb-threads,o4671-l11175,/edz/ | /edz/,full,<b>a</b><b>a</b>,pers00337,o4671-w0010
descends | bends," Nerve after nerve the glistening spine descends,",o4671-l11185," The red Heart dances, the Aorta bends;",o4671-l11190,/endz/ | /endz/,full,<b>a</b><b>a</b>,pers00337,o4671-w0010
bends | descends," The red Heart dances, the Aorta bends;",o4671-l11190," Nerve after nerve the glistening spine descends,",o4671-l11185,/endz/ | /endz/,full,<b>a</b><b>a</b>,pers00337,o4671-w0010
glides | tides," Through each new gland the purple current glides,",o4671-l11195, New veins meandering drink the refluent tides;,o4671-l11200,/aɪdz/ | /aɪdz/,full,<b>a</b><b>a</b>,pers00337,o4671-w0010
tides | glides, New veins meandering drink the refluent tides;,o4671-l11200," Through each new gland the purple current glides,",o4671-l11195,/aɪdz/ | /aɪdz/,full,<b>a</b><b>a</b>,pers00337,o4671-w0010
scale | mail," Edge over edge expands the hardening scale,",o4671-l11205, And sheaths his slimy skin in silver mail. ,o4671-l11210,/eɪl/ | /eɪl/,full,<b>a</b><b>a</b>,pers00337,o4671-w0010
mail | scale, And sheaths his slimy skin in silver mail. ,o4671-l11210," Edge over edge expands the hardening scale,",o4671-l11205,/eɪl/ | /eɪl/,full,<b>a</b><b>a</b>,pers00337,o4671-w0010
sand | strand,"— Erewhile, emerging from the brooding sand,",o4671-l11215," With Tyger-paw He prints the brineless strand,",o4671-l11220,/ænd/ | /ænd/,full,<b>a</b><b>a</b>,pers00337,o4671-w0010
strand | sand," With Tyger-paw He prints the brineless strand,",o4671-l11220,"— Erewhile, emerging from the brooding sand,",o4671-l11215,/ænd/ | /ænd/,full,<b>a</b><b>a</b>,pers00337,o4671-w0010
swims | limbs," High on the flood with speckled bosom swims,",o4671-l11225," Helm'd with broad tail, and oar'd with giant limbs;",o4671-l11230,/ɪmz/ | /ɪmz/,full,<b>a</b><b>a</b>,pers00337,o4671-w0010
limbs | swims," Helm'd with broad tail, and oar'd with giant limbs;",o4671-l11230," High on the flood with speckled bosom swims,",o4671-l11225,/ɪmz/ | /ɪmz/,full,<b>a</b><b>a</b>,pers00337,o4671-w0010
claws | jaws," Rolls his fierce eye-balls, clasps his iron claws,",o4671-l11235, And champs with gnashing teeth his massy jaws;,o4671-l11240,/ɔːz/ | /ɔːz/,full,<b>a</b><b>a</b>,pers00337,o4671-w0010
jaws | claws, And champs with gnashing teeth his massy jaws;,o4671-l11240," Rolls his fierce eye-balls, clasps his iron claws,",o4671-l11235,/ɔːz/ | /ɔːz/,full,<b>a</b><b>a</b>,pers00337,o4671-w0010
shores | adores," Old Nilus sighs along his cane-crown'd shores,",o4671-l11245, And swarthy Memphis trembles and adores. ,o4671-l11250,/ɔːz/ | /ɔːz/,full,<b>a</b><b>a</b>,pers00337,o4671-w0010
adores | shores, And swarthy Memphis trembles and adores. ,o4671-l11250," Old Nilus sighs along his cane-crown'd shores,",o4671-l11245,/ɔːz/ | /ɔːz/,full,<b>a</b><b>a</b>,pers00337,o4671-w0010
groves | loves,"XI.  ""Come, YE SOFT SYLPHS! who fan the Paphian groves,",o4671-l11255, And bear on sportive wings the callow Loves;,o4671-l11260,/əʊvz/ | /ʌvz/,half-pararhyme,<b>a</b><b>a</b>,pers00337,o4671-w0010
loves | groves, And bear on sportive wings the callow Loves;,o4671-l11260,"XI.  ""Come, YE SOFT SYLPHS! who fan the Paphian groves,",o4671-l11255,/ʌvz/ | /əʊvz/,half-pararhyme,<b>a</b><b>a</b>,pers00337,o4671-w0010
blows | repose," Call with sweet whisper, in each gale that blows,",o4671-l11265, The slumbering Snow-drop from her long repose;,o4671-l11270,/əʊz/ | /əʊz/,full,<b>a</b><b>a</b>,pers00337,o4671-w0010
repose | blows, The slumbering Snow-drop from her long repose;,o4671-l11270," Call with sweet whisper, in each gale that blows,",o4671-l11265,/əʊz/ | /əʊz/,full,<b>a</b><b>a</b>,pers00337,o4671-w0010
bed | head," Charm the pale Primrose from her clay-cold bed,",o4671-l11275, Unveil the bashful Violet's tremulous head;,o4671-l11280,/ed/ | /ed/,full,<b>a</b><b>a</b>,pers00337,o4671-w0010
head | bed, Unveil the bashful Violet's tremulous head;,o4671-l11280," Charm the pale Primrose from her clay-cold bed,",o4671-l11275,/ed/ | /ed/,full,<b>a</b><b>a</b>,pers00337,o4671-w0010
breaks | cheeks," While from her bud the playful Tulip breaks,",o4671-l11285, And young Carnations peep with blushing cheeks;,o4671-l11290,/eɪks/ | /iːks/,half-pararhyme,<b>a</b><b>a</b>,pers00337,o4671-w0010
cheeks | breaks, And young Carnations peep with blushing cheeks;,o4671-l11290," While from her bud the playful Tulip breaks,",o4671-l11285,/iːks/ | /eɪks/,half-pararhyme,<b>a</b><b>a</b>,pers00337,o4671-w0010
cold | fold, Bid the closed Petals from nocturnal cold,o4671-l11295," The virgin Style in silken curtains fold,",o4671-l11300,/əʊld/ | /əʊld/,full,<b>a</b><b>a</b>,pers00337,o4671-w0010
fold | cold," The virgin Style in silken curtains fold,",o4671-l11300, Bid the closed Petals from nocturnal cold,o4671-l11295,/əʊld/ | /əʊld/,full,<b>a</b><b>a</b>,pers00337,o4671-w0010
dews | hues," Shake into viewless air the morning dews,",o4671-l11305, And wave in light their iridescent hues;,o4671-l11310,/uːz/ | /uːz/,full,<b>a</b><b>a</b>,pers00337,o4671-w0010
hues | dews, And wave in light their iridescent hues;,o4671-l11310," Shake into viewless air the morning dews,",o4671-l11305,/uːz/ | /uːz/,full,<b>a</b><b>a</b>,pers00337,o4671-w0010
trust | dust, While from on high the bursting Anthers trust,o4671-l11315, To the mild breezes their prolific dust;,o4671-l11320,/ʌst/ | /ʌst/,full,<b>a</b><b>a</b>,pers00337,o4671-w0010
dust | trust, To the mild breezes their prolific dust;,o4671-l11320, While from on high the bursting Anthers trust,o4671-l11315,/ʌst/ | /ʌst/,full,<b>a</b><b>a</b>,pers00337,o4671-w0010
fair | air," Or bend in rapture o'er the central Fair,",o4671-l11325," Love out their hour, and leave their lives in air. ",o4671-l11330,/eə/ | /eə/,full,<b>a</b><b>a</b>,pers00337,o4671-w0010
air | fair," Love out their hour, and leave their lives in air. ",o4671-l11330," Or bend in rapture o'er the central Fair,",o4671-l11325,/eə/ | /eə/,full,<b>a</b><b>a</b>,pers00337,o4671-w0010
worm | larva-form,"So in his silken sepulchre the Worm,",o4671-l11335," Warm'd with new life, unfolds his larva-form;",o4671-l11340,/ɜːm/ | /ɔːm/,half-pararhyme,<b>a</b><b>a</b>,pers00337,o4671-w0010
larva-form | worm," Warm'd with new life, unfolds his larva-form;",o4671-l11340,"So in his silken sepulchre the Worm,",o4671-l11335,/ɔːm/ | /ɜːm/,half-pararhyme,<b>a</b><b>a</b>,pers00337,o4671-w0010
moves | loves," Erewhile aloft in wanton circles moves,",o4671-l11345, And woos on Hymen-wings his velvet loves. ,o4671-l11350,/uːvz/ | /ʌvz/,half-pararhyme,<b>a</b><b>a</b>,pers00337,o4671-w0010
loves | moves, And woos on Hymen-wings his velvet loves. ,o4671-l11350," Erewhile aloft in wanton circles moves,",o4671-l11345,/ʌvz/ | /uːvz/,half-pararhyme,<b>a</b><b>a</b>,pers00337,o4671-w0010
rude | protrude,"XII. 1.  ""If prouder branches with exuberance rude",o4671-l11355," Point their green gems, their barren shoots protrude;",o4671-l11360,/uːd/ | /uːd/,full,<b>a</b><b>a</b>,pers00337,o4671-w0010
protrude | rude," Point their green gems, their barren shoots protrude;",o4671-l11360,"XII. 1.  ""If prouder branches with exuberance rude",o4671-l11355,/uːd/ | /uːd/,full,<b>a</b><b>a</b>,pers00337,o4671-w0010
bind | rind," Wound them, ye SYLPHS! with little knives, or bind",o4671-l11365, A wiry ringlet round the swelling rind;,o4671-l11370,/aɪnd/ | /aɪnd/,full,<b>a</b><b>a</b>,pers00337,o4671-w0010
rind | bind, A wiry ringlet round the swelling rind;,o4671-l11370," Wound them, ye SYLPHS! with little knives, or bind",o4671-l11365,/aɪnd/ | /aɪnd/,full,<b>a</b><b>a</b>,pers00337,o4671-w0010
below | bough," Bisect with chissel fine the root below,",o4671-l11375, Or bend to earth the inhospitable bough. ,o4671-l11380,/əʊ/ | /aʊ/,half-pararhyme,<b>a</b><b>a</b>,pers00337,o4671-w0010
bough | below, Or bend to earth the inhospitable bough. ,o4671-l11380," Bisect with chissel fine the root below,",o4671-l11375,/aʊ/ | /əʊ/,half-pararhyme,<b>a</b><b>a</b>,pers00337,o4671-w0010
power | flower,So shall each germ with new prolific power,o4671-l11385," Delay the leaf-bud, and expand the flower;",o4671-l11390,/aʊə/ | /æə/,half-pararhyme,<b>a</b><b>a</b>,pers00337,o4671-w0010
flower | power," Delay the leaf-bud, and expand the flower;",o4671-l11390,So shall each germ with new prolific power,o4671-l11385,/æə/ | /aʊə/,half-pararhyme,<b>a</b><b>a</b>,pers00337,o4671-w0010
