r_word,line_1,line_1_id,line_2,line_2_id,r_sounds,r_degree,r_scheme,authors_id,poem_id
tyre, Whose Fancy dwells upon a wealthy 'Squire:,o5125-l05720," Her wounded Ears their hateful Whinings tire,",o5125-l05715,/aɪə/ | /æə/,half-pararhyme,<b>a</b><b>a</b>,pers00154,o5125-w0180
inspire,"Th' ambitious bosom of the landed 'squire,",o5154-l20650,But with most warmth her dress and airs inspire,o5154-l20645,/aɪə/ | /æə/,half-pararhyme,<b>a</b><b>a</b>,pers00112,o5154-w0320
entire,He weds — a cousin of the 'squire;,o5155-l28125,"To make his character entire,",o5155-l28120,/aɪə/ | /æə/,half-pararhyme,<b>a</b><b>a</b>,pers00053,o5155-w0500
fire," There goes my lady, and there goes the 'squire,",o3794-l30610," The flame extinct, he views the roving fire,",o3794-l30605,/aɪə/ | /æə/,half-pararhyme,<b>a</b><b>a</b>,pers00269,o3794-w0180
desire,"Unless by chance a trav'lling 'squire,",o5157-l18140,"Of base intent and foul desire,",o5157-l18145,/aɪə/ | /æə/,half-pararhyme,<b>a</b><b>a</b>,pers00146,o5157-w0200
