r_word,line_1,line_1_id,line_2,line_2_id,r_sounds,r_degree,r_scheme,authors_id,poem_id
pages,""" A' future ages;",cbu86-l05530,""" Their unknown pages. "" ",cbu86-l05540,/eɪdʒɪz/ | /eɪdʒɪz/,full,aaa<b>b</b>a<b>b</b>,pers00307,cbu86-w0080
stages,"When Alma now in diff'rent Ages,",pmp18-l36840, Has finish'd Her ascending Stages;,pmp18-l36845,/eɪdʒɪz/ | /eɪdʒɪz/,full,<b>a</b><b>a</b>,pers00314,pmp18-w1100
engages, For She has really two Ages. ,pmp18-l26035, Whose Beauty thus all Hearts engages? ,pmp18-l26025,/eɪdʒɪz/ | /eɪdʒɪz/,full,a<b>b</b>a<b>b</b>,pers00314,pmp18-w0840
stages,"From Sappho down thro' all succeeding Ages,",pmp18-l26490," And now on French, or on Italian Stages,",pmp18-l26495,/eɪdʒɪz/ | /eɪdʒɪz/,full,<b>a</b><b>a</b>,pers00314,pmp18-w0890
cages," What matter for the forms or ages,",o4986-l19110," Of bills, of feathers, and of cages? ",o4986-l19115,/eɪdʒɪz/ | /eɪdʒɪz/,full,<b>a</b><b>a</b>,pers00210,o4986-w0410
sages, And have not all succeeding ages,o4899-l01190, Follow'd th' example of these sages? ,o4899-l01195,/eɪdʒɪz/ | /eɪdʒɪz/,full,<b>a</b><b>a</b>,pers00330,o4899-w0010
