r_word,line_1,line_1_id,line_2,line_2_id,r_sounds,r_degree,r_scheme,authors_id,poem_id
recall," With terrors new his infant mind appall,",o5280-l04720, And present fears his pristine joys recall;,o5280-l04725,/ɔːl/ | /ɔːl/,full,<b>a</b><b>a</b>,pers00277,o5280-w0330
fall, Let Nature's voice thy ruthless heart appal! ,n27tc-l05125, The mother strikes — the guiltless babes shall fall! ,n27tc-l05135,/ɔːl/ | /ɔːl/,full,a<b>b</b>a<b>b</b>,pers00316,n27tc-w0030
fall, Nor Pain nor Death the virtuous man appall;,pcm93-l03890,"No more then, Henry, I lament thy fall,",pcm93-l03880,/ɔːl/ | /ɔːl/,full,<b>a</b>b<b>a</b>b,pers00313,pcm93-w0050
all,"And does strangely appall,",o3736-l00525,"But what's wildest of all,",o3736-l00520,/ɔːl/ | /ɔːl/,full,abab<b>c</b><b>c</b>cdd,pers00346,o3736-w0010
all,"And does strangely appall,",o3736-l00525," Two hours he talk'd, and said nothing at all:",o3736-l00530,/ɔːl/ | /ɔːl/,full,ababc<b>c</b><b>c</b>dd,pers00346,o3736-w0010
