r_word,line_1,line_1_id,line_2,line_2_id,r_sounds,r_degree,r_scheme,authors_id,poem_id
march,"Now beautiful, beneath the heaven's gray arch,",glb19-l50070,Appeared the main battalion's moving march;,glb19-l50075,/ɑːtʃ/ | /ɑːtʃ/,full,<b>a</b><b>a</b>,pers00352,glb19-w1060
march,"Circling the swamp, now draws its various arch;",glb19-l50285,"Part seen, part lost; the long illustrious march",glb19-l50280,/ɑːtʃ/ | /ɑːtʃ/,full,<b>a</b><b>a</b>,pers00352,glb19-w1060
march,Gamma supports the glorious arch,psm63-l00935," On which angelic legions march,",psm63-l00940,/ɑːtʃ/ | /ɑːtʃ/,full,<b>a</b><b>a</b>bccb,pers00254,psm63-w0010
march," The winged vapours up the aerial arch,",o4671-l06250, AQUATIC NYMPHS! — YOU lead with viewless march,o4671-l06245,/ɑːtʃ/ | /ɑːtʃ/,full,<b>a</b><b>a</b>,pers00337,o4671-w0010
march," Altho' his hair began to arch,",cbu86-l08845,"He whistl'd up lord Lenox' march,",cbu86-l08835,/ɑːtʃ/ | /ɑːtʃ/,full,<b>a</b>b<b>a</b>bcdcdx,pers00307,cbu86-w0110
