r_word,line_1,line_1_id,line_2,line_2_id,r_sounds,r_degree,r_scheme,authors_id,poem_id
legs,"Thus He who runs or dances, begs",pmp18-l34000, The equal Vigor of Two Legs:,pmp18-l34005,/egz/ | /egz/,full,<b>a</b><b>a</b>,pers00314,pmp18-w1100
legs," The ogling Youth most humbly begs,",pmp18-l35455," With down-cast Looks on Totta's Legs,",pmp18-l35450,/egz/ | /egz/,full,<b>a</b><b>a</b>,pers00314,pmp18-w1100
rags," And his Money still wastes, till he starves or he begs. ",o5454-l03480, The Cloaths that hang on him are turning to Rags:,o5454-l03475,/egz/ | /ægz/,half-pararhyme,aa<b>b</b><b>b</b>,pers00292,o5454-w0340
legs," My awkart Muse sair pleads and begs,",cbu86-l16005,"Forjesket sair, with weary legs,",cbu86-l15985,/egz/ | /egz/,full,<b>a</b>aab<b>a</b>b,pers00307,cbu86-w0280
rigs," My awkart Muse sair pleads and begs,",cbu86-l16005," Rattlin the corn out-owre the rigs,",cbu86-l15990,/egz/ | /ɪgz/,half-pararhyme,a<b>a</b>ab<b>a</b>b,pers00307,cbu86-w0280
naigs," My awkart Muse sair pleads and begs,",cbu86-l16005, Or dealing thro' amang the naigs,cbu86-l15995,/egz/ | /eɪgz/,half-pararhyme,aa<b>a</b>b<b>a</b>b,pers00307,cbu86-w0280
