r_word,line_1,line_1_id,line_2,line_2_id,r_sounds,r_degree,r_scheme,authors_id,poem_id
eye,Him and the timid butterfly.,glb19-l23430,"Winter, avaunt! thy haggard eye",glb19-l23420,/ʌtəflaɪ/ | /aɪ/,half-vowelrhyme,<b>a</b>a<b>a</b>,pers00352,glb19-w0920
by,Him and the timid butterfly.,glb19-l23430,"Will scare him, as he wanders by,",glb19-l23425,/ʌtəflaɪ/ | /aɪ/,half-vowelrhyme,a<b>a</b><b>a</b>,pers00352,glb19-w0920
by,"The chrysomel and purple butterfly,",glb19-l41695,"Amid the clear blue light, are wandering by;",glb19-l41700,/ʌtəflaɪ/ | /aɪ/,half-vowelrhyme,<b>a</b><b>a</b>,pers00352,glb19-w1060
eye,"To reach a large and radiant butterfly,",glb19-l52060,"Her infant raised his hands, with glistening eye,",glb19-l52055,/ʌtəflaɪ/ | /aɪ/,half-vowelrhyme,<b>a</b><b>a</b>,pers00352,glb19-w1060
i,The Tulip and the Butterfly,o5454-l02545, Appear in gayer Coats than I:,o5454-l02550,/ʌtəflaɪ/ | /aɪ/,half-vowelrhyme,<b>a</b><b>a</b>bb,pers00292,o5454-w0220
eye,Than thine o'er captive butterfly.,o5157-l36165,That spreads her charms before his eye;,o5157-l36155,/ʌtəflaɪ/ | /aɪ/,half-vowelrhyme,a<b>b</b>a<b>b</b>,pers00115,o5157-w0780
die, Of this enamel'd butterfly;,o4986-l30865, Amaz'd I view the splendid dye,o4986-l30860,/ʌtəflaɪ/ | /aɪ/,half-vowelrhyme,<b>a</b><b>a</b>,pers00198,o4986-w0730
