r_word,line_1,line_1_id,line_2,line_2_id,r_sounds,r_degree,r_scheme,authors_id,poem_id
matter," Say, women-fwok mun chatter. ",bsb18-l27585,I'll tell ye aw the matter;,bsb18-l27575,/ætə/ | /ætə/,full,x<b>a</b>x<b>a</b>xbxb,pers00280;pers00283,bsb18-w0580
water, Their Correspondent Teeth will chatter:,pmp18-l31410,Dip but your Toes into cold Water;,pmp18-l31405,/ætə/ | /ɔːtə/,half-pararhyme,<b>a</b><b>a</b>,pers00314,pmp18-w1100
matter," 'Tis thus, that puppies yelp, and monkies chatter. ",pma99-l07800,"Thus Florio talk'd — much noise and little matter,",pma99-l07795,/ætə/ | /ætə/,full,<b>a</b><b>a</b>,pers00306,pma99-w0370
satire,""" Young BILLY PENWAGGLE, and SIMIUS CHATTER,",o3364-l06530," ""Declare 'tis an ill-natur'd half-witted Satire."" ",o3364-l06535,/ætə/ | /ætæə/,half-vowelrhyme,<b>a</b><b>a</b>,pers00205,o3364-w0010
matter,And Mira's Teeth began to chatter:,o5125-l12270," Fidelia cries, O, what's the Matter? ",o5125-l12265,/ætə/ | /ætə/,full,<b>a</b><b>a</b>,pers00154,o5125-w0350
