r_word,line_1,line_1_id,line_2,line_2_id,r_sounds,r_degree,r_scheme,authors_id,poem_id
shines, And the spread Mint along the Window climbs:,o5125-l03210," Yet the rub'd Chest and Table sweetly shines,",o5125-l03205,/aɪmz/ | /aɪnz/,half-vowelrhyme,<b>a</b><b>a</b>,pers00154,o5125-w0110
limbs," To the high throne of sense soft slumber climbs,",cer72-l01625," Slackens their sinews, and benumbs their limbs;",cer72-l01630,/aɪmz/ | /ɪmz/,half-pararhyme,<b>a</b><b>a</b>,pers00265,cer72-w0010
crimes," Whilst here the Vine o'er Hills of Ruin climbs,",o3499-l00505, Industrious to conceal great Bourbon's Crimes. ,o3499-l00510,/aɪmz/ | /aɪmz/,full,<b>a</b><b>a</b>,pers00150,o3499-w0010
chimes, The foolish Creature thinks he climbs:,pmp18-l19420,"Mov'd in the Orb, pleas'd with the Chimes,",pmp18-l19415,/aɪmz/ | /aɪmz/,full,<b>a</b><b>a</b>,pers00314,pmp18-w0620
limbs,"Swift up her pendant Web Arachne climbs,",pdi13-l02605, While he scarce trails along his tortur'd Limbs;,pdi13-l02610,/aɪmz/ | /ɪmz/,half-pararhyme,<b>a</b><b>a</b>,pers00266,pdi13-w0010
rhymes," Where the fierce Rat (all dreadful) never climbs,",o5125-l25630, Nor the sleek Mouse sad Foe to Mira's Rhymes. ,o5125-l25635,/aɪmz/ | /aɪmz/,full,<b>a</b><b>a</b>,pers00154,o5125-w0670
crimes,"When Pride by guilt to greatness climbs,",o4986-l27545, Here let me learn to shun the crimes,o4986-l27555,/aɪmz/ | /aɪmz/,full,<b>a</b>b<b>a</b>b,pers00029,o4986-w0590
