r_word,line_1,line_1_id,line_2,line_2_id,r_sounds,r_degree,r_scheme,authors_id,poem_id
springs, And steeps in tears the robe to which she clings! ,bhw18-l02540," See, to his aid his child, soft ZILIA, springs,",bhw18-l02535,/ɪŋz/ | /ɪŋz/,full,<b>a</b><b>a</b>,pers00276,bhw18-w0020
springs," From the dwarf Daisy, which, like infants, clings,",o3587-l01325," And fears to leave the earth from whence it springs,",o3587-l01330,/ɪŋz/ | /ɪŋz/,full,<b>a</b><b>a</b>,pers00155,o3587-w0010
springs, The scaled infant clings. ,psm63-l01620, For ADORATION springs:,psm63-l01605,/ɪŋz/ | /ɪŋz/,full,aa<b>b</b>cc<b>b</b>,pers00254,psm63-w0010
flings,"When her lov'd infant to her bosom clings,",bhw18-l20830," When round her neck his eager arms he flings,",bhw18-l20835,/ɪŋz/ | /ɪŋz/,full,<b>a</b><b>a</b>,pers00276,bhw18-w0570
wings," Perch'd on her crest the Griffin Discord clings,",o4671-l05445, And Giant Murder rides between her wings;,o4671-l05450,/ɪŋz/ | /ɪŋz/,full,<b>a</b><b>a</b>,pers00337,o4671-w0010
wings," Round each fair Nymph her dropping mantle clings,",o4671-l07135, And Loves emerging shake their showery wings. ,o4671-l07140,/ɪŋz/ | /ɪŋz/,full,<b>a</b><b>a</b>,pers00337,o4671-w0010
sings,""" My soul on Nature's centre clings,",cac95-l09245,""" And loudly grateful anthems sings. ",cac95-l09255,/ɪŋz/ | /ɪŋz/,full,a<b>b</b>a<b>b</b>,pers00301,cac95-w0150
