r_word,line_1,line_1_id,line_2,line_2_id,r_sounds,r_degree,r_scheme,authors_id,poem_id
god,"Why do they Idolize a dusty clod,",oar96-l06505, And yet refuse their Homage to a God? ,oar96-l06510,/ɒd/ | /ɒd/,full,<b>a</b><b>a</b>,pers00265,oar96-w0260
god,"Can this be dust, a kneaded clod!",o5156-l16170,That knows at once itself and God?,o5156-l16185,/ɒd/ | /ɒd/,full,aa<b>b</b>cc<b>b</b>,pers00097;pers00044,o5156-w0570
god, T'whom Proteus' self's a heavy clod? ,o4739-l03890,"Yet how describe the various god,",o4739-l03885,/ɒd/ | /ɒd/,full,<b>a</b><b>a</b>,pers00284,o4739-w0170
odd," The vision flies, and leaves the clod:",pjo50-l12640," Till, (what sometimes is vastly odd)",pjo50-l12635,/ɒd/ | /ɒd/,full,<b>a</b><b>a</b>,pers00273,pjo50-w0490
loud," ""Though deep beneath the mouldering clod",bjb18-l03420, And terrible that call and loud,bjb18-l03430,/ɒd/ | /aʊd/,half-pararhyme,<b>a</b>b<b>a</b>b,pers00287,bjb18-w0030
god,"In vain thou hop'st for bliss on this poor clod,",o5152-l22625,"Return and seek thy Father, and thy God:",o5152-l22630,/ɒd/ | /ɒd/,full,<b>a</b><b>a</b>,pers00073,o5152-w0260
god," When the dull Ox, why now he breaks the clod,",o3676-l00315," Now wears a Garland, an Aegyptian God;",o3676-l00320,/ɒd/ | /ɒd/,full,<b>a</b><b>a</b>,pers00012,o3676-w0010
bestowed,"Such pow'rs, e'er perish, like an earthly clod;",o5157-l06610,"Nor shall the soul, on which it has bestow'd",o5157-l06605,/ɒd/ | /əʊd/,half-pararhyme,<b>a</b><b>a</b>,pers00112,o5157-w0090
