r_word,line_1,line_1_id,line_2,line_2_id,r_sounds,r_degree,r_scheme,authors_id,poem_id
passion,Bestow a tear of kind compassion,bah18-l05935," And, ah! forgive a fatal passion,",bah18-l05945,/æʃn/ | /æʃn/,full,<b>a</b>b<b>a</b>b,pers00281,bah18-w0370
fashion," Not that he blush'd to shew compassion, —",o3982-l02535, It chanc'd that year to be the fashion. ,o3982-l02540,/æʃn/ | /æʃn/,full,<b>a</b><b>a</b>,pers00274,o3982-w0010
condition,Deserves your Compassion;,o3736-l00435,The Ladies Condition,o3736-l00430,/æʃn/ | /ɪʃn/,half-pararhyme,abab<b>c</b><b>c</b>cdd,pers00346,o3736-w0010
petition,Deserves your Compassion;,o3736-l00435, 'Tis very severe to make Beauty petition:,o3736-l00440,/æʃn/ | /ɪʃn/,half-pararhyme,ababc<b>c</b><b>c</b>dd,pers00346,o3736-w0010
nation,"But when dull speakers strive to move compassion,",o5152-l32385,"I pity their poor hearers, not the nation:",o5152-l32390,/æʃn/ | /eɪʃn/,half-pararhyme,<b>a</b><b>a</b>,pers00143,o5152-w0330
