r_word,line_1,line_1_id,line_2,line_2_id,r_sounds,r_degree,r_scheme,authors_id,poem_id
joint,"Our Heart-strings groan with deep Complaint,",o4672-l02320, And every Limb and every Joynt,o4672-l02330,/eɪnt/ | /ɔɪnt/,half-pararhyme,<b>a</b>b<b>a</b>b,pers00292,o4672-w0120
restraint," I laugh, or sing, or make complaint;",bsb18-l23790," 'Tis true my heart knows no restraint,",bsb18-l23785,/eɪnt/ | /eɪnt/,full,<b>a</b><b>a</b>,pers00280,bsb18-w0340
paint,And pour'd his soul in many a fond complaint;,bed98-l05800,"To him Philario sought his doubts to paint,",bed98-l05795,/eɪnt/ | /eɪnt/,full,<b>a</b><b>a</b>,pers00340,bed98-w0150
constraint,Pastora heard every complaint;,o4986-l31410," He talk'd without fear or constraint,",o4986-l31420,/eɪnt/ | /eɪnt/,full,abab<b>c</b>d<b>c</b>d,pers00199,o4986-w0740
faint, Sigh out my sad complaint;,o4198-l00255,Ah! numbers are too faint! ,o4198-l00270,/eɪnt/ | /eɪnt/,full,aa<b>b</b>cc<b>b</b>,pers00288,o4198-w0030
want, Yet my hard Fate forces this soft Complaint. ,pse03-l06395,"From his cold Breast no languid warmth I want,",pse03-l06385,/eɪnt/ | /ɒnt/,half-pararhyme,<b>a</b>a<b>a</b>,pers00272,pse03-w0310
faint, Yet my hard Fate forces this soft Complaint. ,pse03-l06395," His Fires when at their height to mine are faint,",pse03-l06390,/eɪnt/ | /eɪnt/,full,a<b>a</b><b>a</b>,pers00272,pse03-w0310
saint, Who hath most reason of complaint? ,ojg27-l06010,"To hear you prate would vex a saint,",ojg27-l06005,/eɪnt/ | /eɪnt/,full,<b>a</b><b>a</b>,pers00303,ojg27-w0240
restraint, Pour out a long Complaint. ,o4672-l02875, Impatient of Restraint,o4672-l02865,/eɪnt/ | /eɪnt/,full,a<b>b</b>a<b>b</b>,pers00292,o4672-w0150
faint,I'll weary Thee with my Complaint;,o3900-l09925," With longing sick, with groaning faint:",o3900-l09935,/eɪnt/ | /eɪnt/,full,<b>a</b>b<b>a</b>b,pers00309,o3900-w0560
saint,"And though he hears his darling son's complaint,",o5152-l07790,Can hardly spare one tutelary saint;,o5152-l07795,/eɪnt/ | /eɪnt/,full,<b>a</b><b>a</b>,pers00011,o5152-w0090
faint," Harden'd by constant use, without complaint",o3588-l00650," 'Gainst heat and cold, which make us cowards faint,",o3588-l00645,/eɪnt/ | /eɪnt/,full,<b>a</b><b>a</b>,pers00155,o3588-w0010
faint, He seeth our need and prevents our complaint;,pma99-l06595," When hungry and thirsty we're ready to faint,",pma99-l06590,/eɪnt/ | /eɪnt/,full,aabb<b>c</b><b>c</b>dd,pers00306,pma99-w0290
faint,"Scarce I begin my sad Complaint,",o3900-l10155, When all my warmest Wishes faint;,o3900-l10160,/eɪnt/ | /eɪnt/,full,<b>a</b><b>a</b>bbcc,pers00309,o3900-w0570
faint, And to his Father vainly made Complaint:,o4741-l02930," His Spirits fail'd, he straight began to faint,",o4741-l02925,/eɪnt/ | /eɪnt/,full,<b>a</b><b>a</b>,pers00091,o4741-w0040
restraint,"That measures be chang'd, and some cause of complaint",o5155-l29410,"Be immediately furnish'd, to end their restraint;",o5155-l29415,/eɪnt/ | /eɪnt/,full,<b>a</b><b>a</b>,pers00141,o5155-w0560
grant,Yet still you tease me with some new complaint.,o5152-l10665,What proof of love remains for me to grant?,o5152-l10660,/eɪnt/ | /ɑːnt/,half-pararhyme,<b>a</b><b>a</b>,pers00001,o5152-w0110
restraint,"First rob, before they stop complaint.",o5152-l15695,"For those, that use the gag's restraint,",o5152-l15690,/eɪnt/ | /eɪnt/,full,<b>a</b><b>a</b>,pers00101,o5152-w0180
faint, In like proportion doubles his Complaint;,o4784-l11490,"The waining Wretch, each day become more faint,",o4784-l11485,/eɪnt/ | /eɪnt/,full,<b>a</b><b>a</b>,pers00268,o4784-w0340
faint, That here begins with most that long complaint,o3795-l29175," Of filial frankness lost, and love grown faint,",o3795-l29180,/eɪnt/ | /eɪnt/,full,<b>a</b><b>a</b>,pers00269,o3795-w0080
paint, Nor find my Love an Elegant Complaint. ,oar96-l09690," Ev'n my own Grief, I have no words to Paint,",oar96-l09685,/eɪnt/ | /eɪnt/,full,<b>a</b><b>a</b>,pers00265,oar96-w0500
elephant," And India's Woods return their just Complaint,",pmp18-l43240," Their Brood decay'd, and want of Elephant. ",pmp18-l43245,/eɪnt/ | /elɪfənt/,half-pararhyme,<b>a</b><b>a</b>,pers00314,pmp18-w1110
restraint, And Power is deaf to her complaint;,o4039-l05575,"When she complains of vile restraint,",o4039-l05570,/eɪnt/ | /eɪnt/,full,aa<b>b</b><b>b</b>cc,pers00288,o4039-w0200
