r_word,line_1,line_1_id,line_2,line_2_id,r_sounds,r_degree,r_scheme,authors_id,poem_id
soul,"But this Misfortune you too oft condole,",pse03-l10475, Whilst loosest Thoughts debauch your willing Soul,pse03-l10480,/əʊl/ | /əʊl/,full,<b>a</b><b>a</b>,pers00272,pse03-w0480
soul, And foremost to condole. ,psm63-l00210, (The seraph in his soul),psm63-l00195,/əʊl/ | /əʊl/,full,aa<b>b</b>cc<b>b</b>,pers00254,psm63-w0010
whole," Together they are left, each to condole,",o4885-l09475," That by dividing Grief, neither may bear the Whole. ",o4885-l09480,/əʊl/ | /əʊl/,full,<b>a</b><b>a</b>,pers00300,o4885-w0010
whole,Thus Sickness which my Mourning Friends condole,oau90-l04720,"When Art could not restore my Body whole,",oau90-l04725,/əʊl/ | /əʊl/,full,<b>a</b><b>a</b>a,pers00350,oau90-w0090
soul,Thus Sickness which my Mourning Friends condole,oau90-l04720,Prov'd the Divine Physitian of my Soul.,oau90-l04730,/əʊl/ | /əʊl/,full,<b>a</b>a<b>a</b>,pers00350,oau90-w0090
soul,"'Tis sure, the Publick Loss thou dost condole;",oar96-l09635, 'Tis that which yet lies pressing on thy Soul. ,oar96-l09640,/əʊl/ | /əʊl/,full,<b>a</b><b>a</b>,pers00265,oar96-w0500
