r_word,line_1,line_1_id,line_2,line_2_id,r_sounds,r_degree,r_scheme,authors_id,poem_id
blushed," The breasts made to be press'd, not to be crush'd —",o4103-l02320, Where FLORA has with all her roses blush'd;,o4103-l02310,/ʌʃt/ | /ʌʃt/,full,a<b>b</b>a<b>b</b>cc,pers00254,o4103-w0110
whished," The infant aith, half-form'd, was crusht;",cbu86-l07075,"Ye need na doubt, I held my whisht;",cbu86-l07070,/ʌʃt/ | /iʃt/,half-pararhyme,<b>a</b><b>a</b>abab,pers00307,cbu86-w0100
dusht," The infant aith, half-form'd, was crusht;",cbu86-l07075," I glowr'd as eerie's I'd been dusht,",cbu86-l07080,/ʌʃt/ | /ʌʃt/,full,a<b>a</b><b>a</b>bab,pers00307,cbu86-w0100
blushed," The infant aith, half-form'd, was crusht;",cbu86-l07075," When sweet, like modest Worth, she blusht,",cbu86-l07090,/ʌʃt/ | /ʌʃt/,full,a<b>a</b>ab<b>a</b>b,pers00307,cbu86-w0100
flushed, Who in his mighty paw already crushed,pmt18-l06185, While his fierce eye-balls fiery rage had flushed:,pmt18-l06175,/ʌʃt/ | /ʌʃt/,full,abab<b>c</b>d<b>c</b>dd,pers00320,pmt18-w0022
