r_word,line_1,line_1_id,line_2,line_2_id,r_sounds,r_degree,r_scheme,authors_id,poem_id
invited, Which to delight her seem'd delighted. ,o4987-l15425, By every fragrant flower invited;,o4987-l15420,/aɪtɪd/ | /aɪtɪd/,full,aa<b>b</b><b>b</b>,pers00202,o4987-w0550
knighted," With wits and lords this man was much delighted,",o5089-l15120, And once (it has been said) was near being knighted. ,o5089-l15125,/aɪtɪd/ | /aɪtɪd/,full,<b>a</b><b>a</b>,pers00172,o5089-w0230
recited, At once Instructed and Delighted. ,pmp18-l13780, In Thee is faithfully recited:,pmp18-l13765,/aɪtɪd/ | /aɪtɪd/,full,aa<b>b</b>cc<b>b</b>,pers00314,pmp18-w0500
invited,"Beyond his utmost hopes delighted,",prc90-l01385," By Beauty's self, by Love invited,",prc90-l01390,/aɪtɪd/ | /aɪtɪd/,full,<b>a</b><b>a</b>bccb,pers00328,prc90-w0060
invited, In which my Mother most delighted. ,pmp18-l08580," Or by an emulous Pride invited,",pmp18-l08570,/aɪtɪd/ | /aɪtɪd/,full,a<b>b</b>a<b>b</b>,pers00314,pmp18-w0310
invited, If with Humour and Wit you would have him delighted. ,pba35-l10300,What need I be call'd? — Let the Dean be invited. ,pba35-l10305,/aɪtɪd/ | /aɪtɪd/,full,<b>a</b><b>a</b>,pers00087,pba35-w0850
whited,That with the good man's neatness all must be delighted.,o5156-l35315,"The surplice clean, and chancel newly whited,",o5156-l35310,/aɪtɪd/ | /aɪtɪd/,full,ababb<b>c</b><b>c</b>,pers00108,o5156-w1090
slighted,While the nymphs and swains delighted,o5155-l36960,"Envying joys by others slighted,",o5155-l36970,/aɪtɪd/ | /aɪtɪd/,full,<b>a</b>b<b>a</b>b,pers00035,o5155-w0900
