r_word,line_1,line_1_id,line_2,line_2_id,r_sounds,r_degree,r_scheme,authors_id,poem_id
reserve,"Tho' what your merit might deserve,",bed98-l18970,"I chill'd you not with cold reserve,",bed98-l18960,/ɜːv/ | /ɜːv/,full,<b>a</b>b<b>a</b>b,pers00340,bed98-w0560
starve,"Not more than others I deserve,",o5454-l00445," For I have Food while others starve,",o5454-l00455,/ɜːv/ | /ɑːv/,half-pararhyme,<b>a</b>b<b>a</b>b,pers00292,o5454-w0040
swerve,"Such Scorn we may expect, nay we deserve,",pdi12-l04040, When wanton Souls from steddy Vertue swerve. ,pdi12-l04045,/ɜːv/ | /ɜːv/,full,<b>a</b><b>a</b>,pers00266,pdi12-w0120
preserve," Form'd for ingratitude, would ill deserve",pcm93-l09250,"For she, who could a tranquil mind preserve,",pcm93-l09240,/ɜːv/ | /ɜːv/,full,<b>a</b>b<b>a</b>b,pers00313,pcm93-w0200
swerve,"Who acts by force impell'd, can nought deserve;",o5152-l22525,And wisdom short of infinite may swerve.,o5152-l22530,/ɜːv/ | /ɜːv/,full,<b>a</b><b>a</b>,pers00073,o5152-w0260
serve,""" Nor can it from thee this reproach deserve",ilc19-l00875," ""And ever will its tender mansion serve,",ilc19-l00870,/ɜːv/ | /ɜːv/,full,<b>a</b><b>a</b>,pers00215,ilc19-w0020
nerve," If God should judge us, as our faults deserve! ",o3366-l02495,"And think, what pangs would rack each throbbing nerve,",o3366-l02490,/ɜːv/ | /ɜːv/,full,<b>a</b><b>a</b>,pers00319,o3366-w0010
