r_word,line_1,line_1_id,line_2,line_2_id,r_sounds,r_degree,r_scheme,authors_id,poem_id
once,"The grave, the gay, the fopling, and the dunce,",o4111-l01085, Start up (God bless us!) statesmen all at once. ,o4111-l01090,/ʌns/ | /ʌns/,full,<b>a</b><b>a</b>,pers00155,o4111-w0010
once, The friend behind turns equal Dunce. ,o4257-l00800," With ""What's the matter?"" — All at once,",o4257-l00795,/ʌns/ | /ʌns/,full,<b>a</b><b>a</b>,pers00304,o4257-w0010
once,And fill with sense the vacant dunce.,n10jt-l01240,"Confer the gift of tongues at once,",n10jt-l01235,/ʌns/ | /ʌns/,full,<b>a</b><b>a</b>,pers00356,n10jt-w0010
once,The laugh is caught from dunce to dunce.,n10jt-l01880,"And, like electric fire, at once,",n10jt-l01875,/ʌns/ | /ʌns/,full,<b>a</b><b>a</b>,pers00356,n10jt-w0010
once,And ev'ry money'd Clown and Dunce,n11jt-l00845,Commences Gentleman at once.,n11jt-l00850,/ʌns/ | /ʌns/,full,<b>a</b><b>a</b>,pers00356,n11jt-w0010
once, Or candidly confess yourself a dunce. ,o3794-l02905,"Make their heroic pow'rs your own at once,",o3794-l02900,/ʌns/ | /ʌns/,full,<b>a</b><b>a</b>,pers00269,o3794-w0010
once," Fool beckons fool, and dunce awakens dunce. ",o3842-l00225, Legions of factious authors throng at once;,o3842-l00220,/ʌns/ | /ʌns/,full,<b>a</b><b>a</b>,pers00155,o3842-w0010
once,"Would you your son should be a sot or dunce,",o3795-l27245," Lascivious, headstrong, or all these at once,",o3795-l27250,/ʌns/ | /ʌns/,full,<b>a</b><b>a</b>,pers00269,o3795-w0080
once," The same wild phrenzy spreads from dunce to dunce,",o4985-l09155,"Th' impatient battle joins, and lo! at once",o4985-l09150,/ʌns/ | /ʌns/,full,<b>a</b><b>a</b>,pers00192,o4985-w0140
