r_word,line_1,line_1_id,line_2,line_2_id,r_sounds,r_degree,r_scheme,authors_id,poem_id
d,"""Could think of marrying Mrs. E! ",o4081-l00250," ""Lord! who'd have thought our cousin D",o4081-l00245,/iː/ | /iː/,full,<b>a</b><b>a</b>,pers00348,o4081-w0010
d," ""And as he courted Mrs. E,",o4081-l00295,"""They thought if she'd have cousin D,",o4081-l00300,/iː/ | /iː/,full,<b>a</b><b>a</b>,pers00348,o4081-w0010
b,"In vain you think to find them under E,",tgaen-l11505,They're all diverted into H and B.,tgaen-l11510,/iː/ | /iː/,full,<b>a</b><b>a</b>,pers00039,tgaen-wchcc
dispute," About Administrations, NEW — LE and B — E,",o3364-l01780, But a tight little Doctor began a Dispute,o3364-l01775,/iː/ | /uːt/,half-pararhyme,<b>a</b><b>a</b>,pers00205,o3364-w0010
concubine,"Which cheat this reverend, chaste divi e,",o4899-l08285, Discover'd to his concubine;,o4899-l08290,/iː/ | /ɒŋkjʊbaɪn/,half-pararhyme,<b>a</b><b>a</b>,pers00330,o4899-w0010
