r_word,line_1,line_1_id,line_2,line_2_id,r_sounds,r_degree,r_scheme,authors_id,poem_id
discharged," Has brought back his Paternal Coat, inlarg'd",pmp18-l20035,And (all due Honors faithfully discharg'd),pmp18-l20030,/ɪnlɑːgd/ | /ɑːdʒd/,half-vowelrhyme,<b>a</b><b>a</b>,pers00314,pmp18-w0720
charged,See his proud Standard o're his Tent enlarg'd! ,oar96-l02075,"With bloated Toads, an odious Bearing, charg'd. ",oar96-l02080,/ɑːdʒd/ | /ɑːdʒd/,full,<b>a</b><b>a</b>,pers00265,oar96-w0140
charged,"And Thou, Imperial Windsor, stand inlarg'd,",pmp18-l16290, With all the Monarch's Trophies charg'd:,pmp18-l16295,/ɪnlɑːgd/ | /ɑːdʒd/,half-vowelrhyme,<b>a</b><b>a</b>,pers00314,pmp18-w0550
surcharged," When copiously supplied, then most enlarged,",o3795-l26335," Still to be fed, and not to be surcharged. ",o3795-l26340,/ɑːdʒd/ | /ɜːtʃɑːdʒd/,half-vowelrhyme,<b>a</b><b>a</b>,pers00269,o3795-w0080
charged," Ill grounded Maxims by false Gloss enlarg'd,",pmp18-l42745, And captious Science against Reason charg'd. ,pmp18-l42750,/ɑːdʒd/ | /ɑːdʒd/,full,<b>a</b><b>a</b>,pers00314,pmp18-w1110
charged," With rich instruction, and a soul enlarged. ",o3794-l19140," And brings at his return a bosom charged,",o3794-l19135,/ɑːdʒd/ | /ɑːdʒd/,full,<b>a</b><b>a</b>,pers00269,o3794-w0060
charged,And on the pris'ner's crimes enlarg'd —,o5154-l29385,"The pleader rose with brief full charg'd,",o5154-l29380,/ɑːdʒd/ | /ɑːdʒd/,full,<b>a</b><b>a</b>,pers00141,o5154-w0550
