r_word,line_1,line_1_id,line_2,line_2_id,r_sounds,r_degree,r_scheme,authors_id,poem_id
were," By power divine, and skill that could not err,",o3794-l11015," Had sought to crush them, guarded as they were",o3794-l11010,/ɜː/ | /ɜː/,full,<b>a</b><b>a</b>,pers00269,o3794-w0040
infer, That we're not made so perfect but may err;,oae86-l02065," But yet their faults only thus much infer,",oae86-l02060,/ɜː/ | /ɜː/,full,<b>a</b><b>a</b>,pers00272,oae86-w0010
her,And whoe'er made his gentle virtues err.,o5154-l10345,"Or to the Priest, more Romish still than her;",o5154-l10340,/ɜː/ | /ɜː/,full,<b>a</b><b>a</b>,pers00042,o5154-w0140
prefer,"And all who deviate, vainly think must err:",o5152-l26175,"Whate'er's our choice we still with pride prefer,",o5152-l26170,/ɜː/ | /ɜː/,full,<b>a</b><b>a</b>,pers00032,o5152-w0290
deer, O'er Hills and Dales does doubtful err:,pmp18-l36675,"Poor Alma, like a lonely Deer,",pmp18-l36670,/ɜː/ | /ɪə/,half-pararhyme,<b>a</b><b>a</b>,pers00314,pmp18-w1100
character,"WHAT man, like B—Y, with such pains can err",o4600-l02905," In elocution, action, character? ",o4600-l02910,/ɜː/ | /ærəktə/,half-pararhyme,<b>a</b><b>a</b>,pers00155,o4600-w0010
fear,"The weak are prone to err,",bed98-l07540,Is moved by hope and fear.,bed98-l07550,/ɜː/ | /ɪə/,half-pararhyme,a<b>b</b>a<b>b</b>,pers00340,bed98-w0160
theatre,"If, then, the finish'd man can sometimes err,",o4986-l08550," And make mistakes on the World's Theatre,",o4986-l08555,/ɜː/ | /ɪətə/,half-pararhyme,<b>a</b><b>a</b>,pers00236,o4986-w0180
prefer,"Nor think, against thy Place, or State, I err;",o4784-l06705, A Pow'r above thee does this Charge prefer;,o4784-l06710,/ɜː/ | /ɜː/,full,<b>a</b><b>a</b>,pers00268,o4784-w0140
fear, For seldom your Opinions err:,pmp18-l03930,"You, far from Danger as from Fear,",pmp18-l03920,/ɜː/ | /ɪə/,half-pararhyme,<b>a</b>b<b>a</b>b,pers00314,pmp18-w0170
deer," (For seldom, Archers say, Thy Arrows err)",pmp18-l21800,And when Thou frequent bring'st the smitten Deer;,pmp18-l21795,/ɜː/ | /ɪə/,half-pararhyme,<b>a</b><b>a</b>,pers00314,pmp18-w0720
there, And sure My little Heart can never err,pmp18-l22190, Amidst the worst; if Henry still be there. ,pmp18-l22195,/ɜː/ | /eə/,half-pararhyme,<b>a</b><b>a</b>,pers00314,pmp18-w0720
her,Nor can the wildness of thy Wishes err,pmp18-l22735," So wide, to hope that Thou may'st live with Her. ",pmp18-l22740,/ɜː/ | /ɜː/,full,<b>a</b><b>a</b>,pers00314,pmp18-w0720
prefer,"""But factious synods thro' resentment err;",o5154-l05930,"""And venal senates private good prefer:",o5154-l05935,/ɜː/ | /ɜː/,full,<b>a</b><b>a</b>,pers00022,o5154-w0080
aver, What Inspiration dictates cannot err. ,o4198-l01615,"How blinded are their optics, who aver,",o4198-l01610,/ɜː/ | /ɜː/,full,<b>a</b><b>a</b>,pers00288,o4198-w0120
prefer," Born but to die, and reas'ning but to err;",o3676-l01480," In doubt his mind or body to prefer,",o3676-l01475,/ɜː/ | /ɜː/,full,<b>a</b><b>a</b>,pers00012,o3676-w0010
bear," But yet what's worse, we know not when we err;",ppo24-l17820," What Mark does truth, what bright Distinction bear? ",ppo24-l17825,/ɜː/ | /eə/,half-pararhyme,<b>a</b><b>a</b>,pers00257,ppo24-w0190
prefer," The right, as if not capable to err. ",ppo24-l10990, She does amidst ten Thousand Ways prefer,ppo24-l10985,/ɜː/ | /ɜː/,full,<b>a</b><b>a</b>,pers00257,ppo24-w0130
aver, That even Beauties like the rest may err. ,o5125-l24685," 'Tis true, you're lovely; yet the learn'd aver,",o5125-l24680,/ɜː/ | /ɜː/,full,<b>a</b><b>a</b>,pers00154,o5125-w0630
incur,"Yet if we miss our path and err,",o5152-l15070,We grievous penalties incur;,o5152-l15075,/ɜː/ | /ɜː/,full,<b>a</b><b>a</b>,pers00101,o5152-w0180
far, (Unless Great Socrates could err),o3900-l00690,And yet a Greater Hero far,o3900-l00685,/ɜː/ | /ɑː/,half-pararhyme,<b>a</b><b>a</b>,pers00308,o3900-w0010
prefer," And Providence, not He, in his Affairs must Err! ",o4784-l17865," Still his own Sence he fondly will prefer,",o4784-l17860,/ɜː/ | /ɜː/,full,<b>a</b><b>a</b>,pers00268,o4784-w0560
prefer, But there indeed you seldom err. ,o5089-l14850,Dulness in these to wit prefer —,o5089-l14845,/ɜː/ | /ɜː/,full,<b>a</b><b>a</b>,pers00098,o5089-w0220
singular,The Vulgar thus through Imitation err;,o3675-l02135, As oft the Learn'd by being Singular;,o3675-l02140,/ɜː/ | /ɪŋgjələ/,half-pararhyme,<b>a</b><b>a</b>,pers00012,o3675-w0010
cur," At times will from the path of duty err,",o5398-l06810," E'en so the MASTIFF, or the meaner Cur,",o5398-l06805,/ɜː/ | /ɜː/,full,<b>a</b><b>a</b>,pers00278,o5398-w0010
revere,"Inspir'd by thee can never err,",pro75-l04485,"They who thy counsels do revere,",pro75-l04480,/ɜː/ | /ɪə/,half-pararhyme,aab<b>c</b><b>c</b>b,pers00271,pro75-w0200
war, Nor ever ought a second time to Err. ,pmp18-l45410,"Betray'd by Passion, as subdu'd in War,",pmp18-l45400,/ɜː/ | /ɔː/,half-pararhyme,<b>a</b>a<b>a</b>,pers00314,pmp18-w1110
care, Nor ever ought a second time to Err. ,pmp18-l45410," We wisely should exert a double Care,",pmp18-l45405,/ɜː/ | /eə/,half-pararhyme,a<b>a</b><b>a</b>,pers00314,pmp18-w1110
steer, If thus the Prudent and Determin'd err. ,pmp18-l46830,Our looser Lives let Chance or Folly steer;,pmp18-l46825,/ɜː/ | /ɪə/,half-pararhyme,<b>a</b><b>a</b>,pers00314,pmp18-w1110
aver," From Him, who neither can deceive, nor err. ",pmp18-l52230," Remark what I, GOD's Messenger, aver",pmp18-l52225,/ɜː/ | /ɜː/,full,<b>a</b><b>a</b>,pers00314,pmp18-w1110
defer, When truth's in view 'tis glorious e'en to err. ,o4103-l21660," Weigh our design, your censure still defer,",o4103-l21655,/ɜː/ | /ɜː/,full,<b>a</b><b>a</b>,pers00254,o4103-w0350
sphere,And only make mankind more obstinately err.,o5155-l04545,"Beyond coelestial Truth's attractive sphere,",o5155-l04530,/ɜː/ | /ɪə/,half-pararhyme,ababb<b>c</b>bc<b>c</b>,pers00024,o5155-w0030
severe,And only make mankind more obstinately err.,o5155-l04545,"To their fond votaries a curse severe,",o5155-l04540,/ɜː/ | /ɪə/,half-pararhyme,ababbcb<b>c</b><b>c</b>,pers00024,o5155-w0030
