r_word,line_1,line_1_id,line_2,line_2_id,r_sounds,r_degree,r_scheme,authors_id,poem_id
devil,"Some fly, like pendulums, from good to evil,",o5089-l20600, And in that point are madder than the devil:,o5089-l20605,/iːvl/ | /evl/,half-pararhyme,<b>a</b><b>a</b>,pers00017,o5089-w0420
civil,"Tho' wrong, she knew he meant no evil,",bed98-l01465,"And thought he was exceeding civil,",bed98-l01470,/iːvl/ | /ɪvl/,half-pararhyme,<b>a</b><b>a</b>,pers00340,bed98-w0030
devil, Since therefore 'tis to Combat Evil;,pmp18-l11430, 'Tis lawful to employ the Devil. ,pmp18-l11435,/iːvl/ | /evl/,half-pararhyme,<b>a</b><b>a</b>,pers00314,pmp18-w0450
devil,"In a world so abounding with evil,",o5157-l28020,"As to wage open war with the devil,",o5157-l28035,/iːvl/ | /evl/,half-pararhyme,aa<b>b</b>cc<b>b</b>,pers00128,o5157-w0470
devil," In Color, way of life and evil,",o4198-l04495, Sould be so very like the Devil. ,o4198-l04500,/iːvl/ | /evl/,half-pararhyme,<b>a</b><b>a</b>,pers00288,o4198-w0200
devil,"Alike the instrument of good and evil,",o5153-l34760,The attribute of God and of the Devil.,o5153-l34765,/iːvl/ | /evl/,half-pararhyme,<b>a</b><b>a</b>,pers00147,o5153-w0650
devil," Will exorcise each human evil,",o4899-l01905, And send it packing to the Devil;,o4899-l01910,/iːvl/ | /evl/,half-pararhyme,<b>a</b><b>a</b>,pers00330,o4899-w0010
devil,"Prone were his eyes to earth, his mind to evil,",o5156-l38890,The mongrel offspring of a Witch and Devil.,o5156-l38900,/iːvl/ | /evl/,half-pararhyme,a<b>b</b>a<b>b</b>,pers00054,o5156-w1220
devil,"Well; guard us all, I say, from evil! ",pjo50-l08615,"For mighty watchful is the Devil."" ",pjo50-l08620,/iːvl/ | /evl/,half-pararhyme,<b>a</b><b>a</b>,pers00273,pjo50-w0290
