r_word,line_1,line_1_id,line_2,line_2_id,r_sounds,r_degree,r_scheme,authors_id,poem_id
home," Down the deep chasms, the snowfed torrents foam,",n22cs-l05630," And builds his humble, happy home. ",n22cs-l05645,/əʊm/ | /əʊm/,full,aa<b>b</b>cc<b>b</b>,pers00290,n22cs-w0640
dome, With surging foam;,cbu86-l07235, The lordly dome. ,cbu86-l07245,/əʊm/ | /əʊm/,full,aaa<b>b</b>a<b>b</b>,pers00307,cbu86-w0100
roam," Vault on the Seas, and vex the rising Foam;",pdi22-l07495,"No more they wanton dive, or giddy roam,",pdi22-l07490,/əʊm/ | /əʊm/,full,<b>a</b><b>a</b>,pers00266,pdi22-w0010
home," Or bursts upon the rocks with whitening foam,",pmt18-l16995,As musing pensive in my silent home,pmt18-l16980,/əʊm/ | /əʊm/,full,<b>a</b>bb<b>a</b>cddceffegg,pers00320,pmt18-w0040
roam,"To listen to th' Atlantic foam,",o5155-l06780,"Is this a time on Cambrian hills to roam,",o5155-l06770,/əʊm/ | /əʊm/,full,<b>a</b>b<b>a</b>b,pers00089,o5155-w0050
tomb,"Th' envenom'd monsters spit their deadly foam,",o5154-l37145,To blast the laurel that surrounds his tomb.,o5154-l37150,/əʊm/ | /uːm/,half-pararhyme,<b>a</b><b>a</b>,pers00036,o5154-w0680
dome,White o'er his head the circling waters foam.,o5154-l00515,"He said; — and plunging to his crystal dome,",o5154-l00510,/əʊm/ | /əʊm/,full,<b>a</b><b>a</b>,pers00020,o5154-w0040
