r_word,line_1,line_1_id,line_2,line_2_id,r_sounds,r_degree,r_scheme,authors_id,poem_id
laity,"'Tis in Samuel, ma'am, says the Rector: — Miss Gaiety",peh89-l05490," Bow'd, and the Reverend blush'd for the laity. ",peh89-l05495,/eɪəti/ | /eɪəti/,full,<b>a</b><b>a</b>,pers00324,peh89-w0030
liberty, Appears the scene of gayety. ,bao18-l05500, To mourn the sons of liberty. ,bao18-l05480,/eɪɪtɪ/ | /ɪbəti/,half-pararhyme,aaa<b>b</b>ccc<b>b</b>,pers00279,bao18-w0210
society,"Come, gentle Mirth, and Gaiety,",o5154-l26465,Sweet daughter of Society;,o5154-l26470,/eɪəti/ | /aɪəti/,half-vowelrhyme,<b>a</b><b>a</b>,pers00054,o5154-w0440
thee," Thy boon Attendant Gaiety,",o3364-l01560,"Then, O sweet Goddess, bring with Thee",o3364-l01555,/eɪəti/ | /iː/,half-pararhyme,<b>a</b><b>a</b>,pers00205,o3364-w0010
gallantry," Complaisant Pleasures, modish Gaiety;",pse03-l03570,"Adieu to all the splendid Gallantry,",pse03-l03565,/eɪəti/ | /æləntri/,half-pararhyme,<b>a</b><b>a</b>,pers00272,pse03-w0110
