r_word,line_1,line_1_id,line_2,line_2_id,r_sounds,r_degree,r_scheme,authors_id,poem_id
stems, And fruit-trees pledge their gems;,psm63-l01575, And bell-flowers bow their stems. ,psm63-l01590,/emz/ | /emz/,full,aa<b>b</b>cc<b>b</b>,pers00254,psm63-w0010
stems, That breath'd Ambrosia from its op'ning Gems:,o5125-l15285," A pleasing Tree arose with slender Stems,",o5125-l15280,/emz/ | /emz/,full,<b>a</b><b>a</b>,pers00154,o5125-w0390
stems," Bud into gold, and blossoms into gems. ",o4671-l11850," Branch after branch extend their silver stems,",o4671-l11845,/emz/ | /emz/,full,<b>a</b><b>a</b>,pers00337,o4671-w0010
stems, So with pellucid studs the ice-flower gems,o4671-l21240," Her rimy foliage, and her candied stems. ",o4671-l21245,/emz/ | /emz/,full,<b>a</b><b>a</b>,pers00337,o4671-w0020
diadems,"His Hands, surpassing Lillies, grac'd with Gems",oar96-l03805, Fit to Enrich Coelestial Diadems. ,oar96-l03810,/emz/ | /aɪədemz/,half-pararhyme,<b>a</b><b>a</b>,pers00265,oar96-w0190
