r_word,line_1,line_1_id,line_2,line_2_id,r_sounds,r_degree,r_scheme,authors_id,poem_id
transplanted,And her last prayer in vengeance granted.,o5154-l31945,"Behold the am'rous shrub transplanted,",o5154-l31940,/ɑːntɪd/ | /ɑːntɪd/,full,<b>a</b><b>a</b>,pers00107,o5154-w0570
haunted," If right, their suit is granted. ",o5089-l16940, Your house with beggars haunted:,o5089-l16925,/ɑːntɪd/ | /ɔːntɪd/,half-pararhyme,aa<b>b</b>cc<b>b</b>,pers00098,o5089-w0290
it, That ought should be to merit granted. ,o5089-l35050, Who cannot bear (because they want it),o5089-l35045,/ɑːntɪd/ | /ɪt/,half-pararhyme,<b>a</b><b>a</b>,pers00182,o5089-w0740
wanted,Would indulgent heav'n had granted,o5155-l37140,All the empire I had wanted,o5155-l37150,/ɑːntɪd/ | /ɒntɪd/,half-pararhyme,<b>a</b>b<b>a</b>b,pers00035,o5155-w0900
wanted,"The name, and took the rest for granted.",o5154-l29755,"Or gave, where vices might he wanted,",o5154-l29750,/ɑːntɪd/ | /ɒntɪd/,half-pararhyme,<b>a</b><b>a</b>,pers00141,o5154-w0550
