r_word,line_1,line_1_id,line_2,line_2_id,r_sounds,r_degree,r_scheme,authors_id,poem_id
laugh,"Yet I shall ne'er find rhymes enough by half,",o5153-l37020,I should turn back on th' hardest part and laugh.,o5153-l37035,/ɑːf/ | /ɑːf/,full,abba<b>c</b>dd<b>c</b>efefef,pers00123,o5153-w0760
safe,"Her Beauty, in thy softer Half",pmp18-l05005, But let her Strength in Thee be safe:,pmp18-l05015,/ɑːf/ | /eɪf/,half-pararhyme,<b>a</b>b<b>a</b>b,pers00314,pmp18-w0195
safe,"Her fair Delight, Her softer Half,",omp95-l00255," Unless in Thee her strength is safe,",omp95-l00265,/ɑːf/ | /eɪf/,half-pararhyme,<b>a</b>b<b>a</b>b,pers00314,omp95-w0010
laugh, 'Twill serve the purpose more by half,o3552-l01945, To make the Congregation laugh. ,o3552-l01950,/ɑːf/ | /ɑːf/,full,<b>a</b><b>a</b>,pers00155,o3552-w0010
laugh," Half who pass by are deaf, and t'other half",o3589-l00405," Can hear indeed, but only hear to laugh. ",o3589-l00410,/ɑːf/ | /ɑːf/,full,<b>a</b><b>a</b>,pers00155,o3589-w0010
laugh,"Then, soften'd to a smile, as hiding half",o5154-l03875,Out burst the frannion into open laugh:,o5154-l03865,/ɑːf/ | /ɑːf/,full,<b>a</b>b<b>a</b>bbcbcc,pers00022,o5154-w0070
calf, He may weigh about twenty-three Stone and a Half. ,o3364-l05690," But as near as I guess from the Size of his Calf,",o3364-l05685,/ɑːf/ | /ɑːf/,full,<b>a</b><b>a</b>,pers00205,o3364-w0010
laugh,But I despair to think of half,o4899-l02240, The tricks she acts to make you laugh. ,o4899-l02245,/ɑːf/ | /ɑːf/,full,<b>a</b><b>a</b>,pers00330,o4899-w0010
