r_word,line_1,line_1_id,line_2,line_2_id,r_sounds,r_degree,r_scheme,authors_id,poem_id
tropes," As Men repos'd their various Hopes,",pmp18-l35360," In Battles These, and Those in Tropes. ",pmp18-l35365,/əʊps/ | /əʊps/,full,<b>a</b><b>a</b>,pers00314,pmp18-w1100
fops, In pure Revenge to their Audacious hopes;,oar96-l09910,"Nor with Dissembled Smiles indulge the Fops,",oar96-l09905,/əʊps/ | /ɒps/,half-pararhyme,<b>a</b><b>a</b>,pers00265,oar96-w0510
slopes, The grand Variety confound my Hopes:,pmc36-l05095," Fountains, Canals, Cascades from tow'ring Slopes;",pmc36-l05090,/əʊps/ | /əʊps/,full,<b>a</b><b>a</b>,pers00325,pmc36-w0170
tropes, To be the wreck of promises and hopes,o4198-l04315," A Boy of Learning, and a Bard of Tropes;",o4198-l04320,/əʊps/ | /əʊps/,full,<b>a</b><b>a</b>,pers00288,o4198-w0190
tropes," And while there's life, there's hopes. ",pjo50-l04570, In figures and in tropes —,pjo50-l04560,/əʊps/ | /əʊps/,full,x<b>a</b>x<b>a</b>,pers00273,pjo50-w0100
