r_word,line_1,line_1_id,line_2,line_2_id,r_sounds,r_degree,r_scheme,authors_id,poem_id
refuse,The disobedient Jews.,tpc26-l05185,"Is one that I refuse,",tpc26-l05175,/uːz/ | /efjuːs/,half-vowelrhyme,x<b>a</b>x<b>a</b>,pers00353,tpc26-w0180
peruse, And find his grandsons all as rich as Jews:,pcr18-l12505," His lady's worth, his daughter's we peruse,",pcr18-l12500,/uːz/ | /uːz/,full,<b>a</b><b>a</b>,pers00275,pcr18-w0040
renews,"To roast the French, as once the Moors and Jews;",n20jb-l00480,"Prepares the faggot and the flame renews,",n20jb-l00475,/uːz/ | /uːz/,full,<b>a</b><b>a</b>,pers00354,n20jb-w0010
amuse, The leathern ears of stock-jobbers and jews. ,o3794-l00985," Or tinkle in 'Change Alley, to amuse",o3794-l00980,/uːz/ | /uːz/,full,<b>a</b><b>a</b>,pers00269,o3794-w0010
refuse,"For all the Gentiles and the Jews,",o5454-l00735,"Then if this Gospel I refuse,",o5454-l00725,/uːz/ | /efjuːs/,half-vowelrhyme,<b>a</b>b<b>a</b>b,pers00292,o5454-w0060
refuse,"For as for Joseph, whom the Jews",o4899-l01045," Pretend th' Egyptian did refuse,",o4899-l01050,/uːz/ | /efjuːs/,half-vowelrhyme,<b>a</b><b>a</b>,pers00330,o4899-w0010
