r_word,line_1,line_1_id,line_2,line_2_id,r_sounds,r_degree,r_scheme,authors_id,poem_id
lot," ""To-day the indissoluble knot",pcm93-l07000," ""When happy Gertrude's envied lot",pcm93-l07010,/ɒt/ | /ɒt/,full,<b>a</b>b<b>a</b>b,pers00313,pcm93-w0080
lot, His arms were wreath'd in sorrow's knot;,bmb97-l01835, To bear submissively his lot. ,bmb97-l01845,/ɒt/ | /ɒt/,full,a<b>b</b>a<b>b</b>,pers00315,bmb97-w0050
hottentot,She'll scarcely let me wear a Knot;,pba35-l03705, But keeps me like a Hottentot;,pba35-l03710,/ɒt/ | /ɒtəntɒt/,half-pararhyme,<b>a</b><b>a</b>,pers00087,pba35-w0260
lot, Join to bless the nuptial knot,o5280-l04035," Each transported with their lot,",o5280-l04030,/ɒt/ | /ɒt/,full,<b>a</b><b>a</b>,pers00277,o5280-w0270
forgot," To knot and read, and read and knot,",pjo50-l13155,"Thus all forgetting, or forgot,",pjo50-l13145,/ɒt/ | /ɒt/,full,<b>a</b>b<b>a</b>b,pers00273,pjo50-w0500
