r_word,line_1,line_1_id,line_2,line_2_id,r_sounds,r_degree,r_scheme,authors_id,poem_id
cramp, Where horrid silence chills the vital lamp;,pye85-l07215," Monastic glooms, which active virtue cramp,",pye85-l07210,/æmp/ | /æmp/,full,<b>a</b><b>a</b>,pers00256,pye85-w0170
stamp, The topaz blazing like a lamp,psm63-l00775," The jasper of the master's stamp,",psm63-l00770,/æmp/ | /æmp/,full,aab<b>c</b><b>c</b>b,pers00254,psm63-w0010
swamp," And still when Midnight trims her mazy lamp,",o4039-l01250, They take their way thro' Tiber's wat'ry swamp. ,o4039-l01255,/æmp/ | /ɒmp/,half-pararhyme,<b>a</b><b>a</b>,pers00288,o4039-w0080
damp," ""My father! by this waning lamp",bhw18-l14000," Yet sure thy brow is cold and damp,",bhw18-l14010,/æmp/ | /æmp/,full,<b>a</b>b<b>a</b>b,pers00276,bhw18-w0160
damp, And rising Cynthia trimm'd her silver lamp;,peh89-l06695," The sun departed, and the plains grew damp,",peh89-l06690,/æmp/ | /æmp/,full,<b>a</b><b>a</b>,pers00324,peh89-w0060
camp, And trims the midnight lamp;,o4984-l33360, And guards the jealous camp;,o4984-l33350,/æmp/ | /æmp/,full,a<b>b</b>a<b>b</b>cc,pers00252,o4984-w0590
