r_word,line_1,line_1_id,line_2,line_2_id,r_sounds,r_degree,r_scheme,authors_id,poem_id
pap,"Oh folly worthy of the nurse's lap,",o3794-l23120, Give it the breast or stop its mouth with pap! ,o3794-l23125,/æp/ | /æp/,full,<b>a</b><b>a</b>,pers00269,o3794-w0070
mishap,"Driv'n from the ease of Fortune's lap,",o5156-l32725,"New to the school of hard Mishap,",o5156-l32720,/æp/ | /ɪshæp/,half-pararhyme,<b>a</b><b>a</b>,pers00108,o5156-w0890
snap," To lay your Head in every Lap,",o3665-l00085," And, when they think not of you — snap! ",o3665-l00090,/æp/ | /æp/,full,<b>a</b><b>a</b>,pers00012;pers00148,o3665-w0010
nap," He laid his head in luxury's soft lap,",o3794-l03445, And took too often there his easy nap. ,o3794-l03450,/æp/ | /æp/,full,<b>a</b><b>a</b>,pers00269,o3794-w0010
drop, In showers of Gold on lovely Danae's Lap;,pco62-l00130,"JOVE once descending from the Clouds, did drop",pco62-l00125,/æp/ | /ɒp/,half-pararhyme,<b>a</b><b>a</b>,pers00293,pco62-w0010
