r_word,line_1,line_1_id,line_2,line_2_id,r_sounds,r_degree,r_scheme,authors_id,poem_id
out,Fretting he threw it by: then thus the lout;,o5154-l07225,"""There's musick in it, could I fetch it out.""",o5154-l07230,/aʊt/ | /aʊt/,full,<b>a</b><b>a</b>,pers00124,o5154-w0100
about," To satisfy the greedy Lout,",o5125-l11160, And bind the Papers round about. ,o5125-l11165,/aʊt/ | /aʊt/,full,<b>a</b><b>a</b>,pers00154,o5125-w0310
out, The Land was overlaid with many a Lout;,o3818-l04805," Even much of Private; eat our Spirit out,",o3818-l04795,/aʊt/ | /aʊt/,full,ababb<b>c</b>b<b>c</b>c,pers00020,o3818-w0010
stout, The Land was overlaid with many a Lout;,o3818-l04805," Not, as old Fame reports, wise, generous, bold, and stout. ",o3818-l04810,/aʊt/ | /aʊt/,full,ababbcb<b>c</b><b>c</b>,pers00020,o3818-w0010
about," Sit aged crone and thoughtless lout,",bjb18-l16085," When, drawn the evening fire about,",bjb18-l16080,/aʊt/ | /aʊt/,full,<b>a</b><b>a</b>,pers00287,bjb18-w0320
out,Doom'd in her caterpillar's shape to lout.,o5154-l04655,"Pride, rage, and vanity to banish out,",o5154-l04665,/aʊt/ | /aʊt/,full,ababb<b>c</b>b<b>c</b>c,pers00022,o5154-w0070
about,Doom'd in her caterpillar's shape to lout.,o5154-l04655,"She creeping crawls, and drags a loathsome length about.",o5154-l04670,/aʊt/ | /aʊt/,full,ababb<b>c</b>bc<b>c</b>,pers00022,o5154-w0070
