r_word,line_1,line_1_id,line_2,line_2_id,r_sounds,r_degree,r_scheme,authors_id,poem_id
quarry,"May first debauch me, and then marry;",o5156-l25335,"Who, charm'd with his delicious quarry,",o5156-l25330,/æri/ | /ɒri/,half-vowelrhyme,<b>a</b><b>a</b>,pers00083,o5156-w0720
harry, Wha wad a monkey marry? ,bsb18-l30615, What think ye o' young Harry? ,bsb18-l30605,/æri/ | /æri/,full,a<b>b</b>a<b>b</b>cdcd,pers00280,bsb18-w0730
carry, My Johnny I will marry. ,o5463-l00500, Black Eye-brows he does carry. ,o5463-l00490,/æri/ | /æri/,full,x<b>a</b>x<b>a</b>,pers00329,o5463-w0010
quandary,"There's a pair of young damsels I'm proffer'd to marry,",o5156-l34730,And whether to choose puts me in a quandary:,o5156-l34735,/æri/ | /ɒndri/,half-vowelrhyme,<b>a</b><b>a</b>,pers00133,o5156-w1020
carry,"Wives, are like Spannels there, and when ye marry",oau90-l17330,"You need but whistle, Wife must fetch and carry,",oau90-l17335,/æri/ | /æri/,full,<b>a</b><b>a</b>,pers00350,oau90-w0580
carry, It came into his head to marry;,peh89-l08465," As he to th' crib the hay did carry,",peh89-l08460,/æri/ | /æri/,full,<b>a</b><b>a</b>,pers00324,peh89-w0170
canary,"OH, neighbours! what had I a-do for to marry! ",bjb18-l23240,"My wife she drinks possets and wine o' Canary,",bjb18-l23245,/æri/ | /eəri/,half-pararhyme,<b>a</b><b>a</b>bbbb,pers00287,bjb18-w0530
starry," But people find, whene'er they marry,",o4899-l01715, Their Hymen's heav'n not half so starry. ,o4899-l01720,/æri/ | /ɑːri/,half-pararhyme,<b>a</b><b>a</b>,pers00330,o4899-w0010
