r_word,line_1,line_1_id,line_2,line_2_id,r_sounds,r_degree,r_scheme,authors_id,poem_id
swerve," With jealous Eyes the while their Steps observe,",pdi22-l05700, Left playful Hours from steady Virtue swerve;,pdi22-l05705,/ɜːv/ | /ɜːv/,full,<b>a</b><b>a</b>,pers00266,pdi22-w0010
serve,"YOUR Lordship here then may observe,",o4257-l00905, That Nonsense frequently will serve,o4257-l00910,/ɜːv/ | /ɜːv/,full,<b>a</b><b>a</b>,pers00304,o4257-w0010
swerve, To sanctify the space you now observe. ,o5137-l00260," Mysterious nature's laws that never swerve,",o5137-l00250,/ɜːv/ | /ɜːv/,full,a<b>b</b>a<b>b</b>,pers00284,o5137-w0010
reserve,"To lie fit opportunity observe,",o5152-l31875,Saving some double meaning in reserve;,o5152-l31880,/ɜːv/ | /ɜːv/,full,<b>a</b><b>a</b>,pers00143,o5152-w0330
nerve,"But this you must with care observe,",pma99-l05970, That when you've wound up every nerve,pma99-l05975,/ɜːv/ | /ɜːv/,full,<b>a</b><b>a</b>,pers00306,pma99-w0270
