r_word,line_1,line_1_id,line_2,line_2_id,r_sounds,r_degree,r_scheme,authors_id,poem_id
border, To haud the wretch in order;,cbu86-l13925, Let that ay be your border:,cbu86-l13935,/ɔːdə/ | /ɔːdə/,full,a<b>b</b>a<b>b</b>cdcd,pers00307,cbu86-w0230
border,Bromley and Hanmer cry aloud — to order.,o5152-l34685,"When rakes begin on blasphemy to border,",o5152-l34680,/ɔːdə/ | /ɔːdə/,full,<b>a</b><b>a</b>,pers00143,o5152-w0330
border,Orion has his belt in order;,bao18-l05825, Of Saturn's ring bright shines the border;,bao18-l05830,/ɔːdə/ | /ɔːdə/,full,<b>a</b><b>a</b>,pers00279,bao18-w0220
border, Puts each odoriferous Plant in it's Order;,o3364-l05440," The Gard'ner industrious trims out his Border,",o3364-l05435,/ɔːdə/ | /ɔːdə/,full,<b>a</b><b>a</b>,pers00205,o3364-w0010
border, And words that love would call to order;,bhw18-l19905," With accents that on harshness border,",bhw18-l19900,/ɔːdə/ | /ɔːdə/,full,<b>a</b><b>a</b>,pers00276,bhw18-w0510
