r_word,line_1,line_1_id,line_2,line_2_id,r_sounds,r_degree,r_scheme,authors_id,poem_id
small, A Copy differs from the original. ,oae86-l01775," And yet all he can say, will be but small,",oae86-l01770,/ɪdʒnl/ | /ɔːl/,half-pararhyme,<b>a</b><b>a</b>,pers00272,oae86-w0010
all, Confess 'tis like the bright Original. ,ppo24-l08555, As cannot justly be describ'd; tho' all,ppo24-l08550,/ɪdʒnl/ | /ɔːl/,half-pararhyme,<b>a</b><b>a</b>,pers00257,ppo24-w0110
call, To thy Original. ,o5282-l00490, Thy Large-Genius call? ,o5282-l00480,/ɪdʒnl/ | /ɔːl/,half-pararhyme,x<b>a</b>x<b>a</b>,pers00150;pers00152,o5282-w0010
fall,I mourn the loss of the original.,pro75-l04340,"With never-ceasing honors on him fall,",pro75-l04330,/ɪdʒnl/ | /ɔːl/,half-pararhyme,a<b>b</b>a<b>b</b>,pers00271,pro75-w0190
all, But must do wrong to th'fair Original. ,ppo24-l08425," No human Skill can e'er express 'em all,",ppo24-l08420,/ɪdʒnl/ | /ɔːl/,half-pararhyme,<b>a</b><b>a</b>,pers00257,ppo24-w0100
fall,"GReat Second Cause, of Mans Original,",oau90-l07370,Why does thy Head upon thy Bosom fall?,oau90-l07375,/ɪdʒnl/ | /ɔːl/,half-pararhyme,<b>a</b><b>a</b>,pers00350,oau90-w0250
small," Resign'd up the original,",o4987-l02180," Once for the copy, payment small,",o4987-l02175,/ɪdʒnl/ | /ɔːl/,half-pararhyme,<b>a</b><b>a</b>,pers00057,o4987-w0050
all, Thou art thine own Original;,o4672-l00300, And Self-Sufficience bears them all. ,o4672-l00310,/ɪdʒnl/ | /ɔːl/,half-pararhyme,a<b>b</b>a<b>b</b>,pers00292,o4672-w0020
ale,She had her great Original;,oau90-l08480,"From Taplash froth of Nappy Ale,",oau90-l08475,/ɪdʒnl/ | /eɪl/,half-pararhyme,<b>a</b><b>a</b>,pers00350,oau90-w0280
