r_word,line_1,line_1_id,line_2,line_2_id,r_sounds,r_degree,r_scheme,authors_id,poem_id
powers," Love of mankind, not novelty, be ours;",cac95-l09210, For general good may man exert his powers! ,cac95-l09215,/æəz/ | /aʊəz/,half-pararhyme,<b>a</b><b>a</b>,pers00301,cac95-w0130
powers, But acts on Maxims much like Ours. ,pmp18-l13050, Exerts no supernat'ral Powers;,pmp18-l13045,/æəz/ | /aʊəz/,half-pararhyme,<b>a</b><b>a</b>,pers00314,pmp18-w0480
hours, The sex whose presence civilizes ours:,o3794-l21995, Thy worst effect is banishing for hours,o3794-l21990,/æəz/ | /æəz/,rich,<b>a</b><b>a</b>,pers00269,o3794-w0070
powers, Have we not SHAKESPEAR? — Is not JOHNSON ours? ,o4600-l00650,"Happy in tragic and in comic pow'rs,",o4600-l00645,/æəz/ | /aʊəz/,half-pararhyme,<b>a</b><b>a</b>,pers00155,o4600-w0010
bowers,And the shepherds as gentle as ours?,o5155-l39025,And where are her grots and her bow'rs?,o5155-l39015,/æəz/ | /aʊəz/,half-pararhyme,a<b>b</b>a<b>b</b>cdcd,pers00035,o5155-w0950
powers," ""His was the grave, and Doctor Grandspear ours. ",pcr18-l19975,""" The strong attack subdued his lively powers, —",pcr18-l19970,/æəz/ | /aʊəz/,half-pararhyme,<b>a</b><b>a</b>,pers00275,pcr18-w0040
towers, For victory must surely be ours:,bao18-l00460, Waves proudly o'er Saracen towers? ,bao18-l00450,/æəz/ | /aʊəz/,half-pararhyme,x<b>a</b>x<b>a</b>,pers00279,bao18-w0010
powers," Support thy Sway, and charm these Minds of ours? ",o4672-l16080,"Friendship! Mysterious Thing, what Magick Powers",o4672-l16075,/æəz/ | /aʊəz/,half-pararhyme,<b>a</b><b>a</b>,pers00292,o4672-w0680
powers," Most love those Tempers, that resemble ours. ",o4741-l22800," So we, by Nature's sympathetic Pow'rs,",o4741-l22795,/æəz/ | /aʊəz/,half-pararhyme,<b>a</b><b>a</b>,pers00091,o4741-w0460
powers,"Be theirs the musket, while the tongue is ours.",o5152-l07565,Th' unthinking victors vainly boast their pow'rs;,o5152-l07560,/æəz/ | /aʊəz/,half-pararhyme,<b>a</b><b>a</b>,pers00011,o5152-w0090
bowers, Yet is the sweet retirement ours. ,o4986-l08865," Tho' mortal hands have form'd these bowers,",o4986-l08860,/æəz/ | /aʊəz/,half-pararhyme,<b>a</b><b>a</b>,pers00242,o4986-w0200
powers,"But 'tis not easy with a mind like ours,",o3794-l25880," Conscious of weakness in its noblest pow'rs,",o3794-l25885,/æəz/ | /aʊəz/,half-pararhyme,<b>a</b><b>a</b>,pers00269,o3794-w0080
powers," Were we to press, inferior might on ours;",o3676-l01170, From thee to Nothing! — On superior pow'rs,o3676-l01165,/æəz/ | /aʊəz/,half-pararhyme,<b>a</b><b>a</b>,pers00012,o3676-w0010
powers," One in their nature, which are two in ours,",o3676-l03300,See then the acting and comparing pow'rs,o3676-l03295,/æəz/ | /aʊəz/,half-pararhyme,<b>a</b><b>a</b>,pers00012,o3676-w0010
powers,And nature meant it only ours;,bed98-l01035,"Its worth to know exceeds your powers,",bed98-l01030,/æəz/ | /aʊəz/,half-pararhyme,<b>a</b><b>a</b>,pers00340,bed98-w0020
powers,"As error and distress are ours,",bed98-l14310,Be pardon yours Almighty powers;,bed98-l14315,/æəz/ | /aʊəz/,half-pararhyme,<b>a</b><b>a</b>,pers00340,bed98-w0360
yours,And for repentance pardon ours.,bed98-l14355,"For crimes be true repentance yours,",bed98-l14350,/æəz/ | /ɔːz/,half-pararhyme,<b>a</b><b>a</b>,pers00340,bed98-w0360
powers," Is Winter's glowing hearth; — and ye were ours,",bse96-l03260, Where are they now? — alas! their choicest powers,bse96-l03270,/æəz/ | /aʊəz/,half-pararhyme,a<b>b</b>a<b>b</b>ccbdd,pers00282,bse96-w0060
hours," Is Winter's glowing hearth; — and ye were ours,",bse96-l03260," In thrill'd remembrance of the vanish'd hours,",bse96-l03285,/æəz/ | /æəz/,rich,a<b>b</b>abcc<b>b</b>dd,pers00282,bse96-w0060
powers,"Virtue, and arms, and liberty be ours.",o5154-l06915,"Grant us more real goods, you heav'nly powers!",o5154-l06910,/æəz/ | /aʊəz/,half-pararhyme,<b>a</b><b>a</b>,pers00018,o5154-w0090
powers," Their Triumphant LORD, and ours,",o3900-l24885,"Circled round with Angel Powers,",o3900-l24880,/æəz/ | /aʊəz/,half-pararhyme,<b>a</b><b>a</b>bb,pers00309,o3900-w1320
powers," Theirs — yet Oh! benignly Ours,",o3900-l14995,"LORD and GOD of Heav'nly Pow'rs,",o3900-l14990,/æəz/ | /aʊəz/,half-pararhyme,<b>a</b><b>a</b>bb,pers00309,o3900-w0830
powers," Even such enraptur'd Life, such Energy was ours. ",o3818-l06435,How light its Essence! how unclogg'd its Powers! ,o3818-l06420,/æəz/ | /aʊəz/,half-pararhyme,ababb<b>c</b>bc<b>c</b>,pers00020,o3818-w0010
bowers," Even such enraptur'd Life, such Energy was ours. ",o3818-l06435," Even so we glad forsook these sinful Bowers,",o3818-l06430,/æəz/ | /aʊəz/,half-pararhyme,ababbcb<b>c</b><b>c</b>,pers00020,o3818-w0010
yours,"Shall Rival Insects own a Love-like ours,",oau90-l03005,And lay their sprawling filthy Limbs by yours:,oau90-l03010,/æəz/ | /ɔːz/,half-pararhyme,<b>a</b><b>a</b>,pers00350,oau90-w0070
powers," Pardon, Grace, and Glory Ours! ",o3900-l22535," Sing with Us, ye Heav'nly Pow'rs,",o3900-l22530,/æəz/ | /aʊəz/,half-pararhyme,aa<b>b</b><b>b</b>,pers00309,o3900-w1190
powers," And waste them, as thy sword has wasted ours. ",o3794-l17930,"The sword shall light upon thy boasted pow'rs,",o3794-l17925,/æəz/ | /aʊəz/,half-pararhyme,<b>a</b><b>a</b>,pers00269,o3794-w0060
powers," To recollect that in a form like ours,",o3794-l20445," He bruis'd beneath his feet th' infernal pow'rs,",o3794-l20450,/æəz/ | /aʊəz/,half-pararhyme,<b>a</b><b>a</b>,pers00269,o3794-w0060
powers,"Join ye your joyful songs with ours,",o5155-l19520,"Ye thrones, dominions, virtues, pow'rs,",o5155-l19515,/æəz/ | /aʊəz/,half-pararhyme,<b>a</b><b>a</b>bccb,pers00045,o5155-w0250
powers,"Hail your dread Lord and Ours,",o3900-l20190," Dominions, Thrones, and Pow'rs! ",o3900-l20195,/æəz/ | /aʊəz/,half-pararhyme,<b>a</b><b>a</b>bcbc,pers00309,o3900-w1080
powers," With Reason, Faith and Friendship ours,",n22cs-l06210," With firmer souls, and stronger pow'rs,",n22cs-l06205,/æəz/ | /aʊəz/,half-pararhyme,aab<b>c</b><b>c</b>cb,pers00290,n22cs-w0660
hours," With Reason, Faith and Friendship ours,",n22cs-l06210, We'll not regret the stealing hours,n22cs-l06215,/æəz/ | /æəz/,rich,aabc<b>c</b><b>c</b>b,pers00290,n22cs-w0660
