r_word,line_1,line_1_id,line_2,line_2_id,r_sounds,r_degree,r_scheme,authors_id,poem_id
stained, Ours were the Sins that bruis'd and pain'd,o3900-l10415,"But O! with our Transgressions stain'd,",o3900-l10405,/eɪnd/ | /eɪnd/,full,<b>a</b>b<b>a</b>bcdcd,pers00309,o3900-w0580
sustained," Of which the thought, my soul, so oft has pain'd? ",o4039-l06215," How tell the loss, O, earth, by thee sustain'd;",o4039-l06205,/eɪnd/ | /eɪnd/,full,a<b>b</b>a<b>b</b>,pers00289,o4039-w0220
gained," If present, railing, till he saw her pain'd;",pcr18-l14095," If absent, spending what their labours gain'd;",pcr18-l14100,/eɪnd/ | /eɪnd/,full,<b>a</b><b>a</b>,pers00275,pcr18-w0040
reigned,"Like objects pleas'd them, and like objects pain'd;",o5152-l39660,'Twas but one soul that in two bodies reign'd.,o5152-l39665,/eɪnd/ | /eɪnd/,full,<b>a</b><b>a</b>,pers00130,o5152-w0350
constrained," All Night to wake. With hunger is he pain'd,",sap09-l00100,"I only with the prouling Wolf, constrain'd",sap09-l00095,/eɪnd/ | /eɪnd/,full,<b>a</b><b>a</b>,pers00302,sap09-w0010
trained," By each offence my heart was pain'd,",pcr18-l25965,"True, I was not to virtue train'd,",pcr18-l25955,/eɪnd/ | /eɪnd/,full,<b>a</b>b<b>a</b>bab,pers00275,pcr18-w0080
disdained," By each offence my heart was pain'd,",pcr18-l25965," My better thoughts my life disdain'd,",pcr18-l25975,/eɪnd/ | /eɪnd/,full,ab<b>a</b>b<b>a</b>b,pers00275,pcr18-w0080
