r_word,line_1,line_1_id,line_2,line_2_id,r_sounds,r_degree,r_scheme,authors_id,poem_id
spare," Nor strive to move the unforgiving pair,",o4986-l17195,"Friendship her tender offices may spare,",o4986-l17190,/eə/ | /eə/,full,<b>a</b><b>a</b>,pers00210,o4986-w0400
care,Where fixed in wonder stood the warlike pair,tgaen-l00830,His course he turned and thus relieved their care:,tgaen-l00835,/eə/ | /eə/,full,<b>a</b><b>a</b>,pers00039,tgaen-wtrgl
there," Content with YOU to mak a pair,",cbu86-l06165,Whilst I — but I shall haud me there —,cbu86-l06145,/eə/ | /eə/,full,<b>a</b>aab<b>a</b>b,pers00307,cbu86-w0080
where," Content with YOU to mak a pair,",cbu86-l06165, Wi' you I'll scarce gang ony where —,cbu86-l06150,/eə/ | /eə/,full,a<b>a</b>ab<b>a</b>b,pers00307,cbu86-w0080
more," Content with YOU to mak a pair,",cbu86-l06165," Then Jamie, I shall say nae mair,",cbu86-l06155,/eə/ | /eə/,full,aa<b>a</b>b<b>a</b>b,pers00307,cbu86-w0080
despair, And vow'd Destruction to the gentle Pair:,o5125-l19730," Grew wild with Love and desp'rate with Despair,",o5125-l19725,/eə/ | /eə/,full,<b>a</b><b>a</b>,pers00154,o5125-w0510
fair," And pour their curses on the bloody pair,",o5280-l02605, Who gave to early fate the regal fair. ,o5280-l02610,/eə/ | /eə/,full,<b>a</b><b>a</b>,pers00277,o5280-w0150
care, Would call us the conjugal pair. ,o4987-l11015, For she was my pride and my care;,o4987-l11005,/eə/ | /eə/,full,a<b>b</b>a<b>b</b>cdcd,pers00179,o4987-w0330
air,"WELCOME to light, advent'rous pair! ",o4984-l02895,Thrice welcome to the balmy air,o4984-l02900,/eə/ | /eə/,full,<b>a</b><b>a</b>,pers00218,o4984-w0030
are,"The Loves of ev'ry Turtle Pair,",oat77-l03315,Do we not see how perfect are,oat77-l03310,/eə/ | /ɑː/,half-pararhyme,<b>a</b><b>a</b>,pers00344,oat77-w0190
fear,"So parting, devious fled th'affrighted Pair;",o4741-l08340," Such was AVARO's, such AMANDA's Fear. ",o4741-l08345,/eə/ | /ɪə/,half-pararhyme,<b>a</b><b>a</b>,pers00091,o4741-w0100
share,The radiant glories of the matchless pair?,o5156-l22385,"How vales resound, how crowds collected share",o5156-l22380,/eə/ | /eə/,full,<b>a</b><b>a</b>,pers00103,o5156-w0690
share, The strictest Friendship centers in a Pair. ,pdi22-l03705,Some with one Partner all their Blessings share;,pdi22-l03700,/eə/ | /eə/,full,<b>a</b><b>a</b>,pers00266,pdi22-w0010
fair, Propitious Hymen joyns the constant Pair. ,pdi22-l04250,"No Change he seeks, nor leaves his dusky Fair;",pdi22-l04245,/eə/ | /eə/,full,<b>a</b><b>a</b>,pers00266,pdi22-w0010
bear," And finish'd Time brings forth the Princely Pair,",pdi22-l05520,"When painful Throws, (for Twins the Dolphins bear)",pdi22-l05515,/eə/ | /eə/,full,<b>a</b><b>a</b>,pers00266,pdi22-w0010
care," The Dolphins watch, and guard their Infant Pair,",pdi22-l06215,"Full of the tender Thought, with anxious Care",pdi22-l06210,/eə/ | /eə/,full,<b>a</b><b>a</b>,pers00266,pdi22-w0010
heir," May all propitious guard the Royal Pair,",pdi22-l07250," Thee, Mighty Prince, and the World's growing Heir. ",pdi22-l07255,/eə/ | /eə/,full,<b>a</b><b>a</b>,pers00266,pdi22-w0010
share,"Thus fed by mutual Aid, the friendly Pair",pdi22-l08405," Divide their Gains, and all the Plunder share. ",pdi22-l08410,/eə/ | /eə/,full,<b>a</b><b>a</b>,pers00266,pdi22-w0010
heir," May all indulgent guard the Royal Pair,",pdi22-l12525," The World's great Monarch, and the blooming Heir. ",pdi22-l12530,/eə/ | /eə/,full,<b>a</b><b>a</b>,pers00266,pdi22-w0010
there,"Next at our altar stood a luckless pair,",pcr18-l13415, Brought by strong passions and a warrant there;,pcr18-l13420,/eə/ | /eə/,full,<b>a</b><b>a</b>,pers00275,pcr18-w0040
repair, All in a chaise and pair. ,o3795-l30910, And we will then repair,o3795-l30900,/eə/ | /eə/,full,x<b>a</b>x<b>a</b>,pers00269,o3795-w0090
compare," ''Tis when a youthful, loving, modest Pair,",cbu86-l10235,O heart-felt raptures! bliss beyond compare! ,cbu86-l10210,/eə/ | /eə/,full,a<b>b</b>abbc<b>b</b>cc,pers00307,cbu86-w0130
declare," ''Tis when a youthful, loving, modest Pair,",cbu86-l10235, And sage EXPERIENCE bids me this declare —,cbu86-l10220,/eə/ | /eə/,full,aba<b>b</b>bc<b>b</b>cc,pers00307,cbu86-w0130
spare," ''Tis when a youthful, loving, modest Pair,",cbu86-l10235," 'If Heaven a draught of heavenly pleasure spare,",cbu86-l10225,/eə/ | /eə/,full,abab<b>b</b>c<b>b</b>cc,pers00307,cbu86-w0130
care,"Since this a College Life, peace to that pair,",pma99-l07735," Who dying left me to a Guardian's care,",pma99-l07740,/eə/ | /eə/,full,<b>a</b><b>a</b>,pers00306,pma99-w0370
care,"Philander and Cleora, happy pair,",o5157-l15020,"Their breasts from guilt, their looks are free from care,",o5157-l15030,/eə/ | /eə/,full,<b>a</b>b<b>a</b>b,pers00132,o5157-w0140
air," When in the blooming Grove the first kind Pair,",pse03-l10015, With amorous Sighs fan'd the ambrosial Air:,pse03-l10020,/eə/ | /eə/,full,<b>a</b><b>a</b>,pers00272,pse03-w0460
despair," A helpless, disappointed pair,",pik94-l05645, Had now been victims of despair. ,pik94-l05650,/eə/ | /eə/,full,<b>a</b><b>a</b>,pers00327,pik94-w0280
care, And smiled delighted on the pair;,pik94-l05835," Yet still bestowed his guardian care,",pik94-l05830,/eə/ | /eə/,full,<b>a</b><b>a</b>,pers00327,pik94-w0280
care," Each folly of the humble pair,",pik94-l05950, These favor'd pigeons of his care;,pik94-l05955,/eə/ | /eə/,full,<b>a</b><b>a</b>,pers00327,pik94-w0280
share," ""Then I resolve the pigeon pair,",pik94-l06240,""" Shall still my kind protection share. "" ",pik94-l06245,/eə/ | /eə/,full,<b>a</b><b>a</b>,pers00327,pik94-w0280
care, Receiv'd the harmless pair. ,o5346-l04575, Requir'd a master's care;,o5346-l04565,/eə/ | /eə/,full,a<b>b</b>a<b>b</b>,pers00174,o5346-w0030
rare," To meet with such a well-match'd pair,",o3794-l32755,Belinda and her bird! 'tis rare,o3794-l32750,/eə/ | /eə/,full,<b>a</b><b>a</b>bccb,pers00270;pers00269,o3794-w0340
fair,Should some fair frail-one drive her prancing pair,pcr18-l07800, Where rival peers contend to please the fair;,pcr18-l07805,/eə/ | /eə/,full,<b>a</b><b>a</b>,pers00275,pcr18-w0030
fair," Then, wed for life, the restless wrangling pair",pcr18-l08635," Forget how constant one, and one how fair:",pcr18-l08640,/eə/ | /eə/,full,<b>a</b><b>a</b>,pers00275,pcr18-w0030
care, Receiv'd the harmless pair. ,o5089-l06590, Requir'd a master's care! ,o5089-l06580,/eə/ | /eə/,full,a<b>b</b>a<b>b</b>,pers00174,o5089-w0080
despair, So shall I sing the worth of this illustrious pair.,o3396-l00975," So my strong zeal shall disappoint despair,",o3396-l00970,/eə/ | /eə/,full,<b>a</b><b>a</b>,pers00347,o3396-w0010
forbear,"The kindest and the happiest pair,",o3794-l33230," Will find occasion to forbear,",o3794-l33235,/eə/ | /ɔːbeə/,half-vowelrhyme,<b>a</b><b>a</b>,pers00269,o3794-w0370
care, Attend the happy pair;,pyl90-l00440," Free from corroding care,",pyl90-l00430,/eə/ | /eə/,full,a<b>b</b>a<b>b</b>cdcdefef,pers00322,pyl90-w0030
fair, Ye Gods! I envy not the happy Pair. ,pdi12-l01095,Laron is courted by a lovely Fair:,pdi12-l01090,/eə/ | /eə/,full,<b>a</b><b>a</b>,pers00266,pdi12-w0030
care,"Last of the toiling race there liv'd a pair,",o5156-l08975,"Bred up in labour, and inur'd to care,",o5156-l08980,/eə/ | /eə/,full,<b>a</b><b>a</b>,pers00037,o5156-w0350
glare,"They thought all fairies slept, ah luckless pair!",o5152-l05520,"Hid, but in vain, in the sun's noon-tide glare!",o5152-l05525,/eə/ | /eə/,full,<b>a</b><b>a</b>,pers00011,o5152-w0080
care,"What happiness attends the pair,",peh89-l10395," Whose bliss no low intruding care,",peh89-l10400,/eə/ | /eə/,full,<b>a</b><b>a</b>bccb,pers00324,peh89-w0300
air," Mate chasing mate, full many a pair. ",bjb18-l13095," Then coursed and circled through the air,",bjb18-l13090,/eə/ | /eə/,full,<b>a</b><b>a</b>,pers00287,bjb18-w0250
there,In Bed then view this happy Pair;,pmp18-l11690, And think how Hymen Triumph'd there. ,pmp18-l11695,/eə/ | /eə/,full,<b>a</b><b>a</b>,pers00314,pmp18-w0450
were," What cou'd we think of such an Heavenly Pair,",oac95-l01005, But they Immortal as their Actions were,oac95-l01010,/eə/ | /ɜː/,half-pararhyme,<b>a</b><b>a</b>a,pers00333,oac95-w0010
here," What cou'd we think of such an Heavenly Pair,",oac95-l01005," For, till one dy'd, we thought that Heaven was here",oac95-l01015,/eə/ | /ɪə/,half-pararhyme,<b>a</b>a<b>a</b>,pers00333,oac95-w0010
care, Would hail the happy Pair;,pba35-l14285, Her Strains are damp'd by Care. ,pba35-l14295,/eə/ | /eə/,full,a<b>b</b>a<b>b</b>,pers00087,pba35-w1100
care," The mercenary pair,",o4668-l00530," The mean, the selfish care,",o4668-l00520,/eə/ | /eə/,full,a<b>b</b>a<b>b</b>,pers00276,o4668-w0010
care, And half he welcomes in the shivering Pair;,o4106-l11620," Slow creaking turns the Door with jealous Care,",o4106-l11615,/eə/ | /eə/,full,<b>a</b><b>a</b>,pers00294,o4106-w0190
year,"They sit and smile upon the prattling pair,",o5156-l35440,Who loves a sister younger by a year;,o5156-l35430,/eə/ | /ɪə/,half-pararhyme,a<b>b</b>a<b>b</b>bcc,pers00108,o5156-w1090
appear,"They sit and smile upon the prattling pair,",o5156-l35440,(Who two sweet roses on one stalk appear),o5156-l35445,/eə/ | /ɪə/,half-pararhyme,aba<b>b</b><b>b</b>cc,pers00108,o5156-w1090
chair,"Now to the hay field walk the happy pair,",o5156-l35550,In sweet contentment smoaking in his chair;,o5156-l35535,/eə/ | /eə/,full,a<b>b</b>ab<b>b</b>cc,pers00108,o5156-w1090
share,"Now to the hay field walk the happy pair,",o5156-l35550,And ev'ry tenth he reckons to his share.,o5156-l35545,/eə/ | /eə/,full,aba<b>b</b><b>b</b>cc,pers00108,o5156-w1090
fair, And watch'd with jealous step the guilty pair;,o4671-l03900,"— Indignant VULCAN eyed the parting Fair,",o4671-l03895,/eə/ | /eə/,full,<b>a</b><b>a</b>,pers00337,o4671-w0010
air, And shed gay visions o'er the sleeping pair;,o4671-l09670," — SYLPHS! while your winnowing pinions fan'd the air,",o4671-l09665,/eə/ | /eə/,full,<b>a</b><b>a</b>,pers00337,o4671-w0010
care,"As on a time, the loving pair",ojg27-l11635," Walk'd forth to tend the garden's care,",ojg27-l11640,/eə/ | /eə/,full,<b>a</b><b>a</b>,pers00303,ojg27-w0490
stare," Surpriz'd at all they meet, the goslin pair",o3794-l05805," With aukward gait, stretch'd neck, and silly stare,",o3794-l05810,/eə/ | /eə/,full,<b>a</b><b>a</b>,pers00269,o3794-w0020
chair, Besure lay Farquhar's Constant Pair. ,pjo50-l10245,"Stay — go, I mean — but on my chair",pjo50-l10240,/eə/ | /eə/,full,<b>a</b><b>a</b>,pers00273,pjo50-w0420
care,"But oh! when he beheld his little Pair,",o4885-l01350," The Mothers Darlings, and the Fathers Care,",o4885-l01355,/eə/ | /eə/,full,<b>a</b><b>a</b>,pers00300,o4885-w0010
declare," Then lift his Eyes, and blest the believing Pair,",o4885-l02450," But tho' intreated, would no more declare. ",o4885-l02455,/eə/ | /eə/,full,<b>a</b><b>a</b>,pers00300,o4885-w0010
sincere,"Paint now the Pleasures of the happy Pair,",o4885-l05405," Whose Joys were Innocent, and most Sincere;",o4885-l05410,/eə/ | /ɪə/,half-pararhyme,<b>a</b><b>a</b>,pers00300,o4885-w0010
despair," Your boundless Wrath destroy'd a faithful Pair,",o4885-l07355, And heaps on me the Terrours of Dispair. ,o4885-l07360,/eə/ | /eə/,full,<b>a</b><b>a</b>,pers00300,o4885-w0010
care," Leave now, in perfect Bliss, the happy Pair,",o4885-l08010, And let Perotto next become thy Care. ,o4885-l08015,/eə/ | /eə/,full,<b>a</b><b>a</b>,pers00300,o4885-w0010
there,"He raised his face to the youthful pair,",bjb18-l14450,There passeth a glance of pleasure there,bjb18-l14460,/eə/ | /eə/,full,<b>a</b>b<b>a</b>b,pers00287,bjb18-w0270
fair," ""Gin ye'll go there, yon runkl'd pair,",cbu86-l03075," ""I'm gaun to ********* holy fair,",cbu86-l03065,/eə/ | /eə/,full,abab<b>c</b>d<b>c</b>dx,pers00307,cbu86-w0040
share,Thro' spring's gay scenes each happy pair,o5156-l08815,"Its various charms and produce share,",o5156-l08825,/eə/ | /eə/,full,<b>a</b>b<b>a</b>b,pers00037,o5156-w0340
fair, To the first wedded Pair. ,o4741-l24165, Congratulate your FAIR! ,o4741-l24155,/eə/ | /eə/,full,a<b>b</b>a<b>b</b>,pers00091,o4741-w0470
forbear,"An Honest, but a Simple Pair",pmp18-l12055, (And Twenty other I forbear),pmp18-l12060,/eə/ | /ɔːbeə/,half-vowelrhyme,<b>a</b><b>a</b>a,pers00314,pmp18-w0470
clear,"An Honest, but a Simple Pair",pmp18-l12055, May serve to make this Thesis clear. ,pmp18-l12065,/eə/ | /ɪə/,half-pararhyme,<b>a</b>a<b>a</b>,pers00314,pmp18-w0470
jar,And Loath each other like an Ill-wed Pair? ,oat77-l06030,What shou'd we do when Soul and Body jar,oat77-l06025,/eə/ | /ɑː/,half-pararhyme,<b>a</b><b>a</b>,pers00344,oat77-w0330
share, And ev'ry muse shall hail the happy pair. ,bjl92-l12315, Nor did bright Eve such radient beauty share. ,bjl92-l12305,/eə/ | /eə/,full,a<b>b</b>a<b>b</b>,pers00338,bjl92-w0500
fair, Two houses hold the fashionable pair. ,o4671-l13120,"The proud OSYRIS flies his angry fair,",o4671-l13115,/eə/ | /eə/,full,<b>a</b><b>a</b>,pers00337,o4671-w0020
fair," With shadowy hand, and warn'd the guiltless pair;",o4671-l21285, An Angel-guest led forth the trembling Fair,o4671-l21280,/eə/ | /eə/,full,<b>a</b><b>a</b>,pers00337,o4671-w0020
share,These gifts insured the royal pair.,bed98-l12290,A joy disdaining fear to share;,bed98-l12295,/eə/ | /eə/,full,<b>a</b><b>a</b>,pers00340,bed98-w0360
fair, Smiling cherubs bless the pair:,o5280-l04025,Rosy blushes tinge the fair;,o5280-l04020,/eə/ | /eə/,full,<b>a</b><b>a</b>,pers00277,o5280-w0270
fair, To a lately Wedded Pair;,o4784-l08670," They as Youthful, they as Fair. ",o4784-l08680,/eə/ | /eə/,full,a<b>b</b>a<b>b</b>,pers00268,o4784-w0180
care,"No int'rest join'd the happy pair,",o5155-l21545,"Securely blest in Nature's care,",o5155-l21550,/eə/ | /eə/,full,<b>a</b><b>a</b>,pers00001,o5155-w0300
here," ""And bless'd the New-born Pair:",o4672-l11675,""" To seek them Bodies here:",o4672-l11690,/eə/ | /ɪə/,half-pararhyme,aa<b>b</b>cc<b>b</b>,pers00292,o4672-w0600
fair,Joy attend this happy pair;,o5280-l07115, He is brave as she is fair. ,o5280-l07120,/eə/ | /eə/,full,<b>a</b><b>a</b>bb,pers00277,o5280-w0410
fair,"Who e'er in courtship saw a pair,",o5154-l25095,"So kind as he, as she so fair?",o5154-l25100,/eə/ | /eə/,full,<b>a</b><b>a</b>,pers00104,o5154-w0400
fair, As Satan look'd at the first pair. ,o3613-l00195," And cry, ""The wise deserve the fair!"" ",o3613-l00185,/eə/ | /eə/,full,a<b>b</b>a<b>b</b>,pers00304,o3613-w0010
fair,"Now to the palace hastes the royal pair,",o5089-l29655, The Latian crowd confess the strangers fair;,o5089-l29660,/eə/ | /eə/,full,<b>a</b><b>a</b>,pers00033,o5089-w0650
repair,"Attended by a youthful pair,",bmb97-l07550," Oft would fair Editha repair,",bmb97-l07560,/eə/ | /eə/,full,<b>a</b>b<b>a</b>b,pers00315,bmb97-w0220
bare," Unnatural Mixtures form the gendring Pair,",o4299-l06115, Alternately they both beget and bare. ,o4299-l06120,/eə/ | /eə/,full,<b>a</b><b>a</b>,pers00346,o4299-w0010
are,"Her Lips, that dear, soft, pouting juicy Pair",pdi12-l03505, (Whose Breathings sweet as Eastern Breezes are),pdi12-l03510,/eə/ | /ɑː/,half-pararhyme,<b>a</b><b>a</b>,pers00266,pdi12-w0100
wear,"So, whil'st some seeming Happy Pair",oat77-l01230,(who Hymens Fetters wear),oat77-l01235,/eə/ | /eə/,full,aaabcbcdeedffggghhiijj<b>k</b><b>k</b>kmnmn,pers00344,oat77-w0040
are,"So, whil'st some seeming Happy Pair",oat77-l01230,"In Publick Fond as Turtles are,",oat77-l01240,/eə/ | /ɑː/,half-pararhyme,aaabcbcdeedffggghhiijj<b>k</b>k<b>k</b>mnmn,pers00344,oat77-w0040
care,"""And heav'n approve the happy pair. """,o5089-l15920," ""Our mutual help would soothe our care,",o5089-l15915,/eə/ | /eə/,full,<b>a</b><b>a</b>,pers00157,o5089-w0250
care," Anxious, busy, restless pair,",o4986-l16630, Manhood link'd by Fate to Care. ,o4986-l16635,/eə/ | /eə/,full,<b>a</b><b>a</b>,pers00044,o4986-w0380
were," Is yet unsung: they were an ill-match'd pair,",pcr18-l20830, But both disposed to wed — and wed they were. ,pcr18-l20835,/eə/ | /ɜː/,half-pararhyme,<b>a</b><b>a</b>,pers00275,pcr18-w0050
fair,But the kind Mullets are a constant Pair;,pdi12-l05215," They (each) still fix to one, and seek no other Fair. ",pdi12-l05220,/eə/ | /eə/,full,<b>a</b><b>a</b>,pers00266,pdi12-w0140
air, For sic a pair. ,cbu86-l09460, Wi' maiden air! ,cbu86-l09450,/eə/ | /eə/,full,aaa<b>b</b>a<b>b</b>,pers00307,cbu86-w0120
fair,"Handmaids of Truth: with those, an adverse pair",o5157-l12660,"(False Wisdom's minions, that deceiving fair)",o5157-l12665,/eə/ | /eə/,full,<b>a</b><b>a</b>,pers00125,o5157-w0120
care," But, thank my Stars! that worthy Pair",o3364-l00220," Who undertook a Guardian's Care,",o3364-l00225,/eə/ | /eə/,full,<b>a</b><b>a</b>,pers00205,o3364-w0010
there, Could hurt the little pair;,prc90-l02000, And thought to settle there. ,prc90-l02015,/eə/ | /eə/,full,aa<b>b</b>cc<b>b</b>,pers00328,prc90-w0110
declare,When diff'rent passions draw the wedded pair?,o5157-l08805,"Need I the miseries of that state declare,",o5157-l08800,/eə/ | /eə/,full,<b>a</b><b>a</b>,pers00112,o5157-w0090
where,"""A hackney-coach receive the pair,",o5154-l24720,"""They went to — but, I won't tell where.",o5154-l24725,/eə/ | /eə/,full,<b>a</b><b>a</b>,pers00104,o5154-w0390
heir," For lo! to Britain and her favour'd pair,",o4984-l26960, Heaven's high command has sent a sacred heir! ,o4984-l26965,/eə/ | /eə/,full,<b>a</b><b>a</b>,pers00053,o4984-w0480
there, Not any two of them will pair. ,o4899-l02345," Tho' fifty Loves and Doves are there,",o4899-l02340,/eə/ | /eə/,full,<b>a</b><b>a</b>,pers00330,o4899-w0010
care, Receiv'd the harmless pair. ,o4987-l16055, Requir'd a master's care;,o4987-l16045,/eə/ | /eə/,full,a<b>b</b>a<b>b</b>,pers00174,o4987-w0570
air," ""And who are these, — this startled pair,",pmt18-l21445,"Behold the mother's maniac air,",pmt18-l21455,/eə/ | /eə/,full,<b>a</b>b<b>a</b>b,pers00320,pmt18-w0360
air," He, unperceiv'd, alights beside the happy pair. ",pye85-l02580," With azure pinions veil'd he skims the air,",pye85-l02570,/eə/ | /eə/,full,a<b>b</b>a<b>b</b>,pers00256,pye85-w0070
