r_word,line_1,line_1_id,line_2,line_2_id,r_sounds,r_degree,r_scheme,authors_id,poem_id
death,"Cry, That is Empire! shun her baleful path,",o5154-l09110,"Her Words are Slavery, and her Touch is Death!",o5154-l09115,/ɑːθ/ | /eθ/,half-pararhyme,<b>a</b><b>a</b>,pers00042,o5154-w0140
bath,"Moderns, to hit the self-same path,",o4987-l05605, Place figures in a room at Bath:,o4987-l05615,/ɑːθ/ | /ɑːθ/,full,<b>a</b>b<b>a</b>b,pers00014,o4987-w0180
hath,As it uneath mote find its watry path,o5153-l10875,"So on he passed, till he comen hath",o5153-l10865,/ɑːθ/ | /æθ/,half-pararhyme,<b>a</b>b<b>a</b>bbcbcc,pers00024,o5153-w0310
breath," With choicest Flowers strow all the joyful Path,",pse03-l13965," Gay as his Looks, sweet as his tuneful Breath. ",pse03-l13970,/ɑːθ/ | /eθ/,half-pararhyme,<b>a</b><b>a</b>,pers00272,pse03-w0570
wrath," Glancing thro' Pleasure's flowery path,",o4987-l17785," There dread the spight-swoln Beldame's wrath,",o4987-l17780,/ɑːθ/ | /ɒθ/,half-pararhyme,<b>a</b><b>a</b>,pers00203,o4987-w0580
wrath, Still dost thou strew with thorns my rugged path? ,pmt18-l20255, Will crouch submissive to avert thy wrath? ,pmt18-l20265,/ɑːθ/ | /ɒθ/,half-pararhyme,a<b>b</b>a<b>b</b>cdcdefefgg,pers00320,pmt18-w0310
bath," And PINDUS 'flow'ry Path,",o3364-l00040, And verdant Meads of Bath. ,o3364-l00050,/ɑːθ/ | /ɑːθ/,full,a<b>b</b>a<b>b</b>,pers00205,o3364-w0010
bath," Wheresoever be thy Path,",o3364-l04015," Tell, O tell the Joys of Bath. ",o3364-l04020,/ɑːθ/ | /ɑːθ/,full,<b>a</b><b>a</b>,pers00205,o3364-w0010
