r_word,line_1,line_1_id,line_2,line_2_id,r_sounds,r_degree,r_scheme,authors_id,poem_id
withal," As bold as in Agrippa's presence, Paul,",o3794-l12210," As meek as the man Moses, and withal",o3794-l12205,/ɔːl/ | /ɔːl/,full,<b>a</b><b>a</b>,pers00269,o3794-w0040
fall,"Be born a WHITEHEAD, and baptiz'd a PAUL;",o3585-l01360,"May I, (can worse disgrace on manhood fall?) ",o3585-l01355,/ɔːl/ | /ɔːl/,full,<b>a</b><b>a</b>,pers00155,o3585-w0010
small,"Nor hate I less thy vile catheral, Paul!",o5152-l36290,"The choir's too big, the cupola's too small:",o5152-l36295,/ɔːl/ | /ɔːl/,full,<b>a</b><b>a</b>,pers00143,o5152-w0340
all, Of this queer tribe had been like my Old PAUL. ,o4002-l01690," But this proud Coxcomb — Zounds, I thought that All",o4002-l01685,/ɔːl/ | /ɔːl/,full,<b>a</b><b>a</b>,pers00155,o4002-w0010
all," Sometimes, with Aristippus, or St. Paul,",o3677-l00710," Indulge my Candor, and grow all to all;",o3677-l00715,/ɔːl/ | /ɔːl/,full,<b>a</b><b>a</b>,pers00012,o3677-w0010
all, From  low St. James's up to high St. Paul;,o3677-l00965,"This, this the saving doctrine, preach'd to all,",o3677-l00960,/ɔːl/ | /ɔːl/,full,<b>a</b><b>a</b>,pers00012,o3677-w0010
all," We learn, says she, from good St. Paul:",pjo50-l08710, And sure Content is all in all! ,pjo50-l08715,/ɔːl/ | /ɔːl/,full,<b>a</b><b>a</b>,pers00273,pjo50-w0290
