r_word,line_1,line_1_id,line_2,line_2_id,r_sounds,r_degree,r_scheme,authors_id,poem_id
freak,"Oh, ye soft floods, that hang upon the peak",o4739-l04185," Of lofty rocks, and bound in wanton freak,",o4739-l04190,/iːk/ | /iːk/,full,<b>a</b><b>a</b>,pers00284,o4739-w0170
cheek,"LOW hung the dark clouds on Plinlimmon's tall peak,",bao18-l08090," When Ellen, sweet Ellen, a tear on her cheek,",bao18-l08100,/iːk/ | /iːk/,full,<b>a</b>b<b>a</b>b,pers00279,bao18-w0360
seek,Now gladly I mark from Plinlimmon's tall peak,bao18-l08130," And climb the rough mountain, thence Ellen to seek,",bao18-l08140,/iːk/ | /iːk/,full,<b>a</b>b<b>a</b>b,pers00279,bao18-w0360
break," From Chabnus, and the wild Psebarian peak,",cer72-l05110, Whose hoary cliffs the clouds long order break. ,cer72-l05115,/iːk/ | /eɪk/,half-pararhyme,<b>a</b><b>a</b>,pers00265,cer72-w0010
bleak," BUXTONIA smiles, the Goddess-Nymyh of Peak;",o4671-l07010,— So in green vales amid her mountains bleak,o4671-l07005,/iːk/ | /iːk/,full,<b>a</b><b>a</b>,pers00337,o4671-w0010
bleak," And with mishapen turrets crests the Peak,",o4671-l20925,"Where, as proud Masson rises rude and bleak,",o4671-l20920,/iːk/ | /iːk/,full,<b>a</b><b>a</b>,pers00337,o4671-w0020
seek," Or on Meander's Bank, or Latmus' Peak. ",pmp18-l07570,"Rightly advis'd, far hence Thy Sister seek,",pmp18-l07565,/iːk/ | /iːk/,full,<b>a</b><b>a</b>,pers00314,pmp18-w0260
