r_word,line_1,line_1_id,line_2,line_2_id,r_sounds,r_degree,r_scheme,authors_id,poem_id
laurel-boughs,"Henceforth, I'll rove where busy ploughs",cbu86-l05555,"Then farewel hopes of Laurel-boughs,",cbu86-l05545,/aʊz/ | /aʊz/,full,<b>a</b>a<b>a</b>bab,pers00307,cbu86-w0080
brows,"Henceforth, I'll rove where busy ploughs",cbu86-l05555, To garland my poetic brows! ,cbu86-l05550,/aʊz/ | /aʊz/,full,a<b>a</b><b>a</b>bab,pers00307,cbu86-w0080
howes,"Henceforth, I'll rove where busy ploughs",cbu86-l05555, An' teach the lanely heights an' howes,cbu86-l05565,/aʊz/ | /aʊz/,full,aa<b>a</b>b<b>a</b>b,pers00307,cbu86-w0080
boughs,"His little farm by GEORGICK rules he ploughs,",o5154-l08840,"And prunes by metre the luxuriant boughs,",o5154-l08845,/aʊz/ | /aʊz/,full,<b>a</b><b>a</b>,pers00042,o5154-w0140
vows," See whistling Hinds attend their Ploughs,",pba35-l06505, Who never hear of broken Vows;,pba35-l06510,/aʊz/ | /aʊz/,full,<b>a</b><b>a</b>,pers00087,pba35-w0470
brows,"Rude locks o'erhang, a frown their forehead plows:",o5157-l12535,"In centry see these haggard crones, whose brows",o5157-l12530,/aʊz/ | /aʊz/,full,<b>a</b><b>a</b>,pers00125,o5157-w0120
blows," That summon from its shed the slumb'ring ploughs,",o5398-l00435, While health impregnates every breeze that blows. ,o5398-l00440,/aʊz/ | /əʊz/,half-pararhyme,<b>a</b><b>a</b>,pers00278,o5398-w0010
