r_word,line_1,line_1_id,line_2,line_2_id,r_sounds,r_degree,r_scheme,authors_id,poem_id
frames,Her Conquest ore the Flow'rs proclaims.,oat77-l02235,She sits and flow'ry Wreaths she frames;,oat77-l02225,/eɪmz/ | /eɪmz/,full,a<b>b</b>a<b>b</b>,pers00344,oat77-w0100
frames," To flocks and rocks, to hills and rills proclaims,",o4110-l00060," His oaten reed to rural ditties frames,",o4110-l00055,/eɪmz/ | /eɪmz/,full,<b>a</b><b>a</b>,pers00155,o4110-w0010
beams," And Truth, divinely bright, proclaims",o4987-l06055," Plenty and Health attend his beams,",o4987-l06050,/eɪmz/ | /iːmz/,half-pararhyme,aab<b>c</b><b>c</b>b,pers00201,o4987-w0220
flames,"Thou, whose awless voice proclaims",bse96-l02390," Scorn of the sepulchral flames,",bse96-l02395,/eɪmz/ | /eɪmz/,full,<b>a</b><b>a</b>,pers00282,bse96-w0040
flames," LEANDER safe arriv'd proclaims,",o4741-l13635, Shall bid AUGUSTA rise in Flames;,o4741-l13645,/eɪmz/ | /eɪmz/,full,a<b>b</b>a<b>b</b>,pers00091,o4741-w0310
frames,Have they again (as Sacred Song proclaims),pmp18-l42245," Substances real, and existing Frames? ",pmp18-l42250,/eɪmz/ | /eɪmz/,full,<b>a</b><b>a</b>,pers00314,pmp18-w1110
names,"""Thus write (the voice from heav'n proclaims)",o5156-l10160,"""Their works immortalize their names,",o5156-l10170,/eɪmz/ | /eɪmz/,full,<b>a</b>b<b>a</b>b,pers00145,o5156-w0390
