r_word,line_1,line_1_id,line_2,line_2_id,r_sounds,r_degree,r_scheme,authors_id,poem_id
rides," And so no Hearse, or following Train provides;",o4784-l11130," Which in a Coach was plac'd, wherein he rides,",o4784-l11125,/aɪdz/ | /aɪdz/,full,<b>a</b><b>a</b>,pers00268,o4784-w0320
tides,"This sees the Sire, and hastily provides",o4741-l06805," A Vessel, proof against the Wind and Tides. ",o4741-l06810,/aɪdz/ | /aɪdz/,full,<b>a</b><b>a</b>,pers00091,o4741-w0100
hides,"Skill'd in each drug the varying world provides,",o5153-l28645,"All earth embosoms, and all ocean hides,",o5153-l28650,/aɪdz/ | /aɪdz/,full,<b>a</b><b>a</b>,pers00038,o5153-w0480
rides, The watchful knight for Psyche's ease provides;,pmt18-l13930," And in the shallows moored securely rides,",pmt18-l13920,/aɪdz/ | /aɪdz/,full,ababc<b>d</b>c<b>d</b>d,pers00320,pmt18-w0024
hides, The watchful knight for Psyche's ease provides;,pmt18-l13930, Some fisher's hut perchance the shelving harbour hides. ,pmt18-l13935,/aɪdz/ | /aɪdz/,full,ababcdc<b>d</b><b>d</b>,pers00320,pmt18-w0024
hides," Now all things for his Voyage he provides,",o4885-l06050," But from his dearest Friends, the Secret hides:",o4885-l06055,/aɪdz/ | /aɪdz/,full,<b>a</b><b>a</b>,pers00300,o4885-w0010
presides," For age and want, and wo provides",bjl92-l11760, And over misery presides. ,bjl92-l11765,/aɪdz/ | /aɪdz/,full,<b>a</b><b>a</b>,pers00338,bjl92-w0480
guides," Ye shun those helps which bounteous Heav'n provides."" ",pma99-l00140," ""Why leave ye thus your folds and fost'ring guides? ",pma99-l00130,/aɪdz/ | /aɪdz/,full,a<b>b</b>a<b>b</b>,pers00306,pma99-w0010
hides,"Britain, more generous, every vice provides,",o4985-l08800," That Europe ripens, and that Asia hides. ",o4985-l08805,/aɪdz/ | /aɪdz/,full,<b>a</b><b>a</b>,pers00192,o4985-w0140
