r_word,line_1,line_1_id,line_2,line_2_id,r_sounds,r_degree,r_scheme,authors_id,poem_id
mute,"Hopeless her spirits to recruit,",pjo50-l08890, For ev'ry virtue is a mute. ,pjo50-l08895,/uːt/ | /uːt/,full,<b>a</b><b>a</b>,pers00273,pjo50-w0300
disrepute,With earth's first commoners recruit.,o5156-l18720,They must (or grow in disrepute),o5156-l18715,/uːt/ | /uːt/,full,<b>a</b><b>a</b>,pers00101,o5156-w0640
fruit, For ever giving fresh Recruit. ,pmc36-l03040,"Where grows immortalizing Fruit,",pmc36-l03035,/uːt/ | /uːt/,full,<b>a</b><b>a</b>,pers00325,pmc36-w0090
fruit,The craving Stomach to recruit.,oat77-l05230,"But yeild no nourishing Grain or Fruit,",oat77-l05225,/uːt/ | /uːt/,full,<b>a</b><b>a</b>,pers00344,oat77-w0280
fruit,The birds with plenteous feasts their strength recruite;,o5154-l02485,Those many trees blush forth with ripen'd fruite;,o5154-l02475,/uːt/ | /uːt/,full,a<b>b</b>a<b>b</b>bcbcc,pers00022,o5154-w0070
flute,The birds with plenteous feasts their strength recruite;,o5154-l02485,And warble songs more sweet than shepherd's flute.,o5154-l02490,/uːt/ | /uːt/,full,aba<b>b</b><b>b</b>cbcc,pers00022,o5154-w0070
suit,The birds with plenteous feasts their strength recruite;,o5154-l02485,"Charm'd with the place, almost forgot its suite;",o5154-l02500,/uːt/ | /iːt/,half-pararhyme,aba<b>b</b>bc<b>b</b>cc,pers00022,o5154-w0070
