r_word,line_1,line_1_id,line_2,line_2_id,r_sounds,r_degree,r_scheme,authors_id,poem_id
undeceived,"Know, one false step is ne'er retrieved,",tgaen-l04740,"From hence, ye beauties, undeceived,",tgaen-l04735,/iːvd/ | /iːvd/,full,<b>a</b><b>a</b>bccb,pers00039,tgaen-wodfc
achieved," Spain, from th'Usurper Bourbon's Arms retriev'd,",pmp18-l25155," Numb'ring the Wonders which That Youth atchiev'd,",pmp18-l25165,/iːvd/ | /iːvd/,full,abab<b>c</b>d<b>c</b>dee,pers00314,pmp18-w0730
believed, A lost good-name is ne'er retriev'd. ,ojg27-l07330,"The change shall never be believ'd,",ojg27-l07325,/iːvd/ | /iːvd/,full,<b>a</b><b>a</b>,pers00303,ojg27-w0300
saved," Say, is the Majesty of Verse retriev'd? ",pmp18-l18075,"The Danube rescu'd, and the Empire sav'd,",pmp18-l18070,/iːvd/ | /eɪvd/,half-pararhyme,<b>a</b><b>a</b>,pers00314,pmp18-w0580
grieved," In her you'll find Maria's Loss retriev'd,",o3318-l00295, That Charming Queen for whom so much we griev'd. ,o3318-l00300,/iːvd/ | /iːvd/,full,<b>a</b><b>a</b>,pers00296,o3318-w0010
achieved,"From time's wide waste retriev'd,",o5155-l35995,In peace or war atchiev'd.,o5155-l36005,/iːvd/ | /iːvd/,full,a<b>b</b>a<b>b</b>,pers00142,o5155-w0850
undeceived,"Know, one false step is ne'er retriev'd,",o5153-l31710,"From hence, ye beauties undeceiv'd,",o5153-l31705,/iːvd/ | /iːvd/,full,<b>a</b><b>a</b>bccb,pers00039,o5153-w0580
