r_word,line_1,line_1_id,line_2,line_2_id,r_sounds,r_degree,r_scheme,authors_id,poem_id
advance,The luscious Heroine of her own romance.,o5155-l36535,"Without a blush behold each nymph advance,",o5155-l36530,/æns/ | /ɑːns/,half-pararhyme,<b>a</b><b>a</b>,pers00142,o5155-w0870
lance,"FROM D—bl—n, fam'd in legends of romance",o4600-l02695," For mighty magic of enchanted lance,",o4600-l02700,/æns/ | /ɑːns/,half-pararhyme,<b>a</b><b>a</b>,pers00155,o4600-w0010
advance," For once to real life, and quit Romance. ",o3585-l00410,"These stale conceits thrown off, let us advance",o3585-l00405,/æns/ | /ɑːns/,half-pararhyme,<b>a</b><b>a</b>,pers00155,o3585-w0010
advance, And greet — the ancient worthies of Romance. ,pcr18-l02750,"Come, let us then with reverend step advance,",pcr18-l02745,/æns/ | /ɑːns/,half-pararhyme,<b>a</b><b>a</b>,pers00275,pcr18-w0010
advance,"Truth is diverting, as the best romance.",o5154-l28100,"In truth by easy steps you here advance,",o5154-l28095,/æns/ | /ɑːns/,half-pararhyme,<b>a</b><b>a</b>,pers00124,o5154-w0470
dance,"Where wild hypothesis, and learn'd romance",o5157-l12930,Too oft lead up the philosophic dance.,o5157-l12935,/æns/ | /ɑːns/,half-pararhyme,<b>a</b><b>a</b>,pers00125,o5157-w0120
