r_word,line_1,line_1_id,line_2,line_2_id,r_sounds,r_degree,r_scheme,authors_id,poem_id
discloses,"Mark, my Polly, how the roses",o5155-l29060,"How the bud its sweets discloses,",o5155-l29070,/əʊzɪz/ | /əʊzɪz/,full,<b>a</b>b<b>a</b>b,pers00025,o5155-w0540
noses,"Carnations, violets, and roses",o5157-l35470,Cause a sensation in our noses;,o5157-l35475,/əʊzɪz/ | /əʊzɪz/,full,<b>a</b><b>a</b>,pers00115,o5157-w0720
supposes,"Makes Cheeks fair, where no Lillies grow nor Roses,",oau90-l07115,"Fancy digested into strong Supposes,",oau90-l07110,/əʊzɪz/ | /əʊzɪz/,full,<b>a</b><b>a</b>a,pers00350,oau90-w0240
noses,"Makes Cheeks fair, where no Lillies grow nor Roses,",oau90-l07115,And Women beautiful that want their Noses:,oau90-l07120,/əʊzɪz/ | /əʊzɪz/,full,a<b>a</b><b>a</b>,pers00350,oau90-w0240
reposes,"In vain the lillies bloom, or roses,",o5156-l35945,In whose soft down while he reposes,o5156-l35940,/əʊzɪz/ | /əʊzɪz/,full,<b>a</b><b>a</b>,pers00026,o5156-w1100
posies," Myrtles, Jessamin and Roses,",o3364-l01455," Vi'lets, Pinks, Italian Posies,",o3364-l01450,/əʊzɪz/ | /əʊziz/,half-vowelrhyme,<b>a</b><b>a</b>,pers00205,o3364-w0010
discloses,Blooms with returning roses.,o5156-l15915,Its various pow'r discloses;,o5156-l15900,/əʊzɪz/ | /əʊzɪz/,full,aa<b>b</b>cc<b>b</b>,pers00027,o5156-w0560
noses, They surely smell to nought but roses;,o4899-l01770," And, though we see they carry noses,",o4899-l01765,/əʊzɪz/ | /əʊzɪz/,full,<b>a</b><b>a</b>,pers00330,o4899-w0010
