r_word,line_1,line_1_id,line_2,line_2_id,r_sounds,r_degree,r_scheme,authors_id,poem_id
speaks," The soul's sure int'rest in the good she seeks,",o3794-l24365, Their very language of a kind that speaks,o3794-l24360,/iːks/ | /iːks/,full,<b>a</b><b>a</b>,pers00269,o3794-w0070
speaks," And whilst She vainly to Describe thee seeks,",o4784-l05935," The Pen but traces, where the Pencil speaks. ",o4784-l05940,/iːks/ | /iːks/,full,<b>a</b><b>a</b>,pers00268,o4784-w0130
breaks,"Fame, future fame, in thought he seeks:",bao18-l06720, And bright the sun of science breaks. ,bao18-l06730,/iːks/ | /eɪks/,half-pararhyme,a<b>b</b>a<b>b</b>,pers00279,bao18-w0270
cheeks,"Where Grief sad social solace seeks,",o4984-l33885," The rose has fled her meagre cheeks,",o4984-l33890,/iːks/ | /iːks/,full,<b>a</b><b>a</b>bccb,pers00252,o4984-w0610
cheeks,"To AUTUMN cooling caverns seeks,",o5154-l13395,"And stains with wine his jolly cheeks,",o5154-l13400,/iːks/ | /iːks/,full,<b>a</b><b>a</b>,pers00049,o5154-w0180
cheeks," With hideous yawn the flying shoals He seeks,",o4671-l14205, Or clasps with fringe of horn his massy cheeks;,o4671-l14210,/iːks/ | /iːks/,full,<b>a</b><b>a</b>,pers00337,o4671-w0020
cheeks," In vain her heav'nly Robes she, sighing, seeks;",o4741-l11545, In vain the humid Pearls bedew her Cheeks;,o4741-l11550,/iːks/ | /iːks/,full,<b>a</b><b>a</b>,pers00091,o4741-w0180
cheeks,"Thus sooth'd and reconcil'd, each seeks",o3794-l31235," The seat of empire is her cheeks,",o3794-l31245,/iːks/ | /iːks/,full,<b>a</b>b<b>a</b>b,pers00269,o3794-w0230
