r_word,line_1,line_1_id,line_2,line_2_id,r_sounds,r_degree,r_scheme,authors_id,poem_id
brake," That wond'rous Spell will rouze the crested Snake,",pdi22-l09325, Forc'd from the Covert of the inmost Brake. ,pdi22-l09330,/eɪk/ | /eɪk/,full,<b>a</b><b>a</b>,pers00266,pdi22-w0010
brake,"""Yet it hides the vengeful snake.",o5156-l01590,"""Fair and flowery is the brake,",o5156-l01585,/eɪk/ | /eɪk/,full,aa<b>b</b><b>b</b>,pers00035,o5156-w0020
take,"The friend unfaithful, or th' envenom'd snake;",o5154-l05225,No less imprudent to his breast to take,o5154-l05220,/eɪk/ | /eɪk/,full,<b>a</b><b>a</b>,pers00022,o5154-w0080
brake," Majestic as the many colour'd Snake,",o4198-l03965, Trailing his glories thro' the blossom'd brake;,o4198-l03970,/eɪk/ | /eɪk/,full,<b>a</b><b>a</b>,pers00288,o4198-w0180
track,"Avoid the Altar, and the hissing Snake,",oar96-l04710," Both opposite, betwixt them keep the Track;",oar96-l04715,/eɪk/ | /æk/,half-pararhyme,<b>a</b><b>a</b>,pers00265,oar96-w0200
wake, The rattling terrors of the vengeful snake;,o5346-l03975," Where, at each step, the stranger fears to wake",o5346-l03970,/eɪk/ | /eɪk/,full,<b>a</b><b>a</b>,pers00174,o5346-w0020
brake," The hungry Crocodile, and hissing Snake",pmp18-l40785, Lurk in the troubl'd Stream and fenny Brake:,pmp18-l40790,/eɪk/ | /eɪk/,full,<b>a</b><b>a</b>,pers00314,pmp18-w1110
take," Feed the She-Adder, and the brooding Snake? ",pmp18-l40850,"Would they on Board or Bears, or Lynxes take,",pmp18-l40845,/eɪk/ | /eɪk/,full,<b>a</b><b>a</b>,pers00314,pmp18-w1110
