r_word,line_1,line_1_id,line_2,line_2_id,r_sounds,r_degree,r_scheme,authors_id,poem_id
longer,"Again as She grows something stronger,",pmp18-l32180," And Master's Feet are swath'd no longer,",pmp18-l32185,/ɒŋgə/ | /ɒŋgə/,full,<b>a</b><b>a</b>,pers00314,pmp18-w1100
longer," When Members knit, and Legs grow stronger,",pmp18-l01600, Make use of such Machine no longer;,pmp18-l01605,/ɒŋgə/ | /ɒŋgə/,full,<b>a</b><b>a</b>,pers00314,pmp18-w0050
longer,And tie the Knot much stronger;,oau90-l11305,"Fourteen years and longer,",oau90-l11295,/ɒŋgə/ | /ɒŋgə/,full,a<b>b</b>a<b>b</b>cdcd,pers00350,oau90-w0350
longer," Than mine your Constitution's stronger,",o4784-l04880, And in Fatigues can hold out longer;,o4784-l04885,/ɒŋgə/ | /ɒŋgə/,full,<b>a</b><b>a</b>,pers00268,o4784-w0110
longer," But, without any Doubt, I shall find myself stronger,",o3364-l00840, When I've took the same Physic a Week or two longer. ,o3364-l00845,/ɒŋgə/ | /ɒŋgə/,full,<b>a</b><b>a</b>,pers00205,o3364-w0010
