r_word,line_1,line_1_id,line_2,line_2_id,r_sounds,r_degree,r_scheme,authors_id,poem_id
recline, Along their sloping sides supine,o4984-l03940, The peaceful villages recline:,o4984-l03945,/uːpaɪn/ | /aɪn/,half-vowelrhyme,<b>a</b><b>a</b>,pers00218,o4984-w0030
divine," On Sands, as dead, the Cramp-Fish lies supine,",pdi22-l07415,"Conscious of secret Pow'r, a Gift divine,",pdi22-l07410,/uːpaɪn/ | /aɪn/,half-vowelrhyme,<b>a</b><b>a</b>,pers00266,pdi22-w0010
divine,"So when the mind imbrutes in sloth supine,",o5153-l33850,Sharp pangs awake her energy divine.,o5153-l33855,/uːpaɪn/ | /aɪn/,half-vowelrhyme,abab<b>c</b><b>c</b>,pers00083,o5153-w0630
decline,"See how astonished now the crowd supine,",pmt18-l15830, In tottering masses o'er their heads decline,pmt18-l15840,/uːpaɪn/ | /aɪn/,half-vowelrhyme,<b>a</b>b<b>a</b>bcdcdd,pers00320,pmt18-w0025
thine," To rouse the vain, the giddy, and supine,",pye85-l01215," Stalk o'er the gloomy grave, Muse! be it thine",pye85-l01210,/uːpaɪn/ | /aɪn/,half-vowelrhyme,<b>a</b><b>a</b>,pers00256,pye85-w0020
mine,"Take, if ye can, ye careless and supine! ",o3794-l03955,Counsel and caution from a voice like mine;,o3794-l03960,/uːpaɪn/ | /aɪn/,half-vowelrhyme,<b>a</b><b>a</b>,pers00269,o3794-w0020
shrine,"Let me not sink in sloth supine,",o5156-l36785,While all creation at thy shrine,o5156-l36790,/uːpaɪn/ | /aɪn/,half-vowelrhyme,aab<b>c</b><b>c</b>b,pers00095,o5156-w1160
recline, Than yawn out the dull droning life supine,o4984-l02345,"Better to die with glory, than recline",o4984-l02335,/uːpaɪn/ | /aɪn/,half-vowelrhyme,<b>a</b>b<b>a</b>bcdcdefefgg,pers00221,o4984-w0020
shine," I greedy gaze, you sleep supine,",pjo50-l03860,"Insensible how much they shine,",pjo50-l03850,/uːpaɪn/ | /aɪn/,half-vowelrhyme,<b>a</b>b<b>a</b>b,pers00273,pjo50-w0050
