r_word,line_1,line_1_id,line_2,line_2_id,r_sounds,r_degree,r_scheme,authors_id,poem_id
sing," Talk with such toss, and saunter with such swing;",pcr18-l14580,"Join'd with these powers, he could so sweetly sing,",pcr18-l14575,/ɪŋ/ | /ɪŋ/,full,<b>a</b><b>a</b>,pers00275,pcr18-w0040
thing, As some of those who in a hammock swing. ,bjb18-l13825, With as good observation of the thing,bjb18-l13820,/ɪŋ/ | /ɪŋ/,full,<b>a</b><b>a</b>,pers00287,bjb18-w0260
wing," Then stooped on flexile twig to swing,",bjb18-l13085," Then rose aloft with outspread wing,",bjb18-l13080,/ɪŋ/ | /ɪŋ/,full,<b>a</b><b>a</b>,pers00287,bjb18-w0250
sing," And may they soon at Tyburn swing,",bjl92-l13015, Who would not sign what here I sing. ,bjl92-l13020,/ɪŋ/ | /ɪŋ/,full,<b>a</b><b>a</b>,pers00338,bjl92-w0530
king," ""And while this rogue is doom'd in air to swing,",o3366-l01760,""" That for a peerage kneels to thank the King. "" ",o3366-l01765,/ɪŋ/ | /ɪŋ/,full,<b>a</b><b>a</b>,pers00319,o3366-w0010
