r_word,line_1,line_1_id,line_2,line_2_id,r_sounds,r_degree,r_scheme,authors_id,poem_id
sang," Are whistling thrang,",cbu86-l05560, My rustic sang. ,cbu86-l05570,/æŋ/ | /æŋ/,full,aaa<b>b</b>a<b>b</b>,pers00307,cbu86-w0080
long," An' fleeching chiels around her thrang,",bsb18-l25810, Till she miskens her a' day lang. ,bsb18-l25815,/æŋ/ | /æŋ/,full,aabbcc<b>d</b><b>d</b>,pers00280,bsb18-w0490
long,"IT was on a morn, when we were thrang,",bjb18-l22580, When ane at the door chapp't loud and lang. ,bjb18-l22595,/æŋ/ | /æŋ/,full,<b>a</b>bb<b>a</b>cdcd,pers00287,bjb18-w0510
whang,"The lasses, skelpan barefit, thrang,",cbu86-l03155," Wi' sweet-milk-cheese, in monie a whang,",cbu86-l03165,/æŋ/ | /æŋ/,full,abab<b>c</b>d<b>c</b>dx,pers00307,cbu86-w0040
fang," To sway out-owre the feather'd thrang,",o5089-l34875, Who dread his martial bill and fang:,o5089-l34880,/æŋ/ | /æŋ/,full,<b>a</b><b>a</b>,pers00182,o5089-w0740
sang,"I see ye're complimented thrang,",cbu86-l06230," ""God save the King"" 's a cukoo sang",cbu86-l06240,/æŋ/ | /æŋ/,full,<b>a</b>b<b>a</b>bcdcdx,pers00307,cbu86-w0090
