r_word,line_1,line_1_id,line_2,line_2_id,r_sounds,r_degree,r_scheme,authors_id,poem_id
french, And the great boy became a simple wench! ,o4986-l32605,"Nay, we have run from English to the French,",o4986-l32600,/enʃ/ | /entʃ/,half-vowelrhyme,<b>a</b><b>a</b>,pers00098,o4986-w0850
bench," He swore, and wept, and kick'd the Wench,",o4741-l10170," Forgot his Hat, and left the Bench. ",o4741-l10175,/enʃ/ | /enʃ/,full,<b>a</b><b>a</b>,pers00091,o4741-w0130
bench,Why there one Joseph and a wench,tpc26-l06030,"Who are to go before the bench,",tpc26-l06035,/enʃ/ | /enʃ/,full,aab<b>c</b><b>c</b>b,pers00353,tpc26-w0220
french, Ye Gods! what Sonnets on a Wench? ,o4106-l09355,What lean Translations out of French? ,o4106-l09360,/enʃ/ | /entʃ/,half-vowelrhyme,<b>a</b><b>a</b>,pers00294,o4106-w0140
quench," And, sure, I love a pretty wench! ",o4899-l00875," I sometimes love my thirst to quench,",o4899-l00870,/enʃ/ | /enʃ/,full,<b>a</b><b>a</b>,pers00330,o4899-w0010
