r_word,line_1,line_1_id,line_2,line_2_id,r_sounds,r_degree,r_scheme,authors_id,poem_id
bewitch," Against those many tempting pleasures, which",oae86-l01345, Not only theirs but Masculine Souls bewitch. ,oae86-l01350,/ɪtʃ/ | /ɪtʃ/,full,<b>a</b><b>a</b>,pers00272,oae86-w0010
rich,""" He knew no better than his cassock which:",pcr18-l20115," ""And when addressing either poor or rich,",pcr18-l20110,/ɪtʃ/ | /ɪtʃ/,full,<b>a</b><b>a</b>,pers00275,pcr18-w0040
each, The comic Episodes of which,o4257-l00195, Would tire your Lordship's Patience each;,o4257-l00200,/ɪtʃ/ | /iːtʃ/,half-pararhyme,<b>a</b><b>a</b>,pers00304,o4257-w0010
rich," Speak Malice, Speak Insulters, tell us which.",o4299-l02060,"So Scotlands Barren, Fruitful, Poor and Rich:",o4299-l02055,/ɪtʃ/ | /ɪtʃ/,full,<b>a</b><b>a</b>,pers00346,o4299-w0010
ditch," 'Twas dark, and so they knew not which,",ilc19-l00360," When some most awkward bank or ditch,",ilc19-l00355,/ɪtʃ/ | /ɪtʃ/,full,<b>a</b><b>a</b>,pers00215,ilc19-w0010
